,published_at,video_id,title,description,relevance
11,2018-01-22T20:00:01.000Z,Pe475Zng2Ls,"""Grab & Go!"" | Ep7 | Divine Journey w/ Immortal (& Rhino)","Making a world interaction upgrade for the fluid transfer node, getting water into the smeltery, and making a nether portal, and grabbing some nether quartz.",0
2018-01-30T07:55:49.000Z,X654mVjCjGg,ARK: TLC PHASE TWO [PT.1] DISCUSSION | Survival Evolved Preview w/ ShipWrekt,"Studio Wildcard has previewed Part 1 of Phase 2 TLC, adding new animations, models, and abiltiies to the Argentavis & Spino! We discuss the upcoming ...",0
2018-01-20T21:00:01.000Z,a6goHHPk8VE,Taking Some Doydoys to Reign of Giants - Don't Starve: Shipwrecked/RoG Gameplay - Part 76,"We're up to part 76 of Season 6 of this Don't Starve Let's Play Series as Wigfrid. In this series, we'll be travelling back and forth between Shipwrecked and Reign ...",0
2018-01-27T00:30:04.000Z,qbN_3kS3hIY,DRAGON BALL FighterZ - How to Play SSGSS (Super Saiyan Blue) Vegeta in 60 Seconds,"Want to go from power level 0 to over 9000 with Super Saiyan Blue Vegeta in 60 seconds? Well get that stop watch ready, because 60 second strategy begins...",0
2018-02-01T10:31:43.000Z,Oa4RBkGIO14,Offroad Outlaws Hack 2018 - Offroad Outlaws Cheats 2018 Free Coins (Android/iOS),Hey gamers! This video teach you how to get Offroad Outlaws Free Coins - Offroad Outlaws Hack 2018! Offroad Outlaws Cheats 2018 works for Android and iOS ...,0
2018-01-23T21:35:13.000Z,5CmJYf1PI5Q,Granny I p#3 (we found the padlock key),Hey guys this is red Panda.,0
2018-01-26T13:20:25.000Z,pQHmLZfz8sc,Kick the Buddy - Gameplay Walkthrough Part 2 - ALL Objects Weapons  (IOS),Kick the Buddy - Gameplay Walkthrough Part 2 - ALL Objects Weapons (IOS) Kick the Buddy ...,0
2018-01-24T17:32:28.000Z,MzhF21cK3vI,Mini Golf King Hack Cheats - How to get Unlimited Coins and Gold [Apk  & ISO],https://tinyurl.com/y75jw5tm Mini Golf King Hack Cheats - How to get Unlimited Coins and Gold [Apk & ISO] 2018 android and iphone unlock all stages of mini ...,0
2018-01-26T01:00:01.000Z,dLAbmoalLOQ,Last Shelter: Survival | miscellaneous things to do,https://discord.gg/dd5YqR https://facebook.com/swillentertainment https://twitter.com/REALSWILL https://streamtip.com/y/swillentertainment ...,0
2018-01-23T20:54:46.000Z,P4wjw8XYUiE,how to Download Emblems in COD WW2 NOW! Tutorial on Call of Duty WWII emblems,In this tutorial i show you how to download and use other peoples emblems in Call of Duty WW2! After the new Resistance DLC update they made this COD ...,0
2018-01-25T21:05:15.000Z,yKVcCUiOFhA,Housmile Robotic Vacuum Cleaner: Review,Amazon UK - http://amzn.to/2ncIWbC A look at the affordable robot vacuum cleaner. I try out this budget model to see if it's up to the job for general cleaning ...,0
2018-01-26T18:51:54.000Z,cKGqiOW0p_I,INSIGHTS ON PBS HAWAI‘I: How Cyber-Secure Are You? | Program,"INSIGHTS ON PBS HAWAI'I revisits one of the program's most popular discussion topics from last year – online security. From the internet, to mobile devices, ...",0
2018-01-24T18:54:49.000Z,gd-cGLnmZoY,Wildcraft: How to find your den and raise wolf pups,Songs: My love is on fire: blackpink Whistle/my love is on fire/fire : blackpink and bts mix Power: Exo Thanks for watching if your stuck on the game ask me and I ...,0
2018-01-17T17:12:37.000Z,on19evGeLsI,Easy Way To Get 4000 Hours Of Watch Time,"People are panicking about these new YouTube partnership requirements, specifically the 4000 hours of watch time. 1000 subs can easily be acquired with bots ...",0
2018-01-30T14:41:04.000Z,_bjH4YdocgY,[SukyGaming] Dx2 Shin Megami Tensei: Menu Walk-through,Dx2 (Pronounced: Dee-two)Shin Megami Tensei Liberation for mobile devices. This is Menu Walk-Through for Sega & Atlus' new mobile game: Dx2 Shin ...,0
2018-01-26T20:12:23.000Z,FcI_IYHjZYg,Ethics of AI,"Detecting people, optimising logistics, providing translations, composing art: artificial intelligence (AI) systems are not only changing what and how we are doing ...",0
2018-01-28T10:08:50.000Z,NSOlCtIPzFo,Harry Potter Hogwarts Mystery Hack 2018 - Free Coins and Energy Hack 2018 (iOS/Android/PC),Harry Potter Hogwarts Mystery Hack 2018 - Free Coins and Energy Hack 2018 (iOS/Android/PC) Download below: ...,0
2018-01-18T07:07:45.000Z,d5v_9-fR4x8,SonyLIV 3 Months Subscription Free,SonyLIV 3 Months Subscription Free - www.sonyliv.com/promotion/SVOD/3m_120_india/SD100?paymentOption=DC ...,0
2018-01-29T07:26:29.000Z,40tVOhmC5T0,WildCraft Animal Sim Online 3D - Android Gameplay FHD,FOR MORE ANDROID GAMES -http://www.youtube.com/user/androidgameplaynet?sub_confirmation=1 WildCraft Animal Sim Online 3D by Turbo Rocket ...,0
2018-01-18T00:43:27.000Z,mYn-y-KGdrg,HSN | Luminess Beauty / Benefit Cosmetics 01.17.2018 - 05 PM,Look gorgeous from head to toe with make-up and beauty tools designed to make life and beauty easier. Shop innovative cosmetics that deliver performance ...,0
2018-01-29T11:09:58.000Z,BgqOc8S3Hqw,How to Download program XAMPP and htdocs 2018,How to Get Software for Unlock iCloud Free 2018 https://www.gamehacks007.ga/2018/06/how-to-get-software-for-unlock-icloud.html How to Download program ...,0
2018-01-24T15:15:39.000Z,c_ggy8vXNYg,HACK HARRY POTTER HOGWARDS MYSTERY GAME ULIMATED COIN / ENERGY / GEMS,hack Harry Potter HOGWARDS MYSTERY GAME ON ANDROID and IOS ULIMATED all COIN / ENERGY/ GEMS Download lucky patcher apk link ...,0
2018-01-31T00:54:54.000Z,c6XSSDNptsw,How to Hack Hero Hunters by Gameguardian.,Description Download link Hero Hunters https://m.apkpure.com/hero-hunters/com.hotheadgames.google.free.survivors Gameguardian ...,0
2018-01-29T18:00:07.000Z,hXGiF9AzkB0,Alliance Wars Seasons | Marvel Contest of Champions,Get ready to face the highest level of Alliance competition that the Contest has to offer! Read about this and other features in our Release Notes: ...,0
2018-01-19T22:24:56.000Z,C7bCDs3Hg9E,HSN | DIY Home 01.19.2018 - 02 PM,"Discover innovative problem solving products for in and around the home that help make life easier. Get countless tips and tricks from home experts, the ...",0
2018-01-21T19:40:55.000Z,HqkuQAfWO6k,ombi request system example,how to request.,0
2018-01-19T17:14:01.000Z,34DPmYctt60,Yu-Gi-Oh! Duel Links 2.3.1 Apk Mod Download,Download Links 1 : http://rapidtory.com/71BA Download Links 2 : http://q.gs/E2hWS.,0
2018-01-21T21:02:05.000Z,sFPj3OG9TQw,8 BALL POOL HACK APK - 8 BALL POOL MONEY MOD APK 8 BALL POOL HACKED APK OMG UNLIMITED COINS,Get here - hhttp://nolink.us/156pc2.,0
2018-01-25T12:29:38.000Z,mlovQRKtmII,agar.io hack mod apk download - how to hack agar.io using cheat DNA,"Agar.io Hack Hack – Free Coins and DNA for iOS, Android and PC Hi guys, This is how I got my free Coins and DNA! I'm just like you guys trying to find working ...",0
2018-01-26T03:05:22.000Z,MM2TftXxKj4,"Marvel Puzzle Quest-android MOD,HACK,PRIVATE SERVER--2018--1000%Working!",MARVEL PUZZLE QUEST HACK 2018 - FREE COINS HACK 2018 - UNLIMITED COINS MARVEL PUZZLE QUEST - Get Hack Here    ️ ...,0
2018-01-20T14:18:05.000Z,V9ckzMilS5M,Where Can You Buy Physical Gold Bullion?,Where Can You Buy Physical Gold Bullion? Register Your FREE Account here: https://goo.gl/LB8h3f For Further Information Click ...,0
2018-01-17T21:37:55.000Z,wjOTX7bNxOk,drag racing classic hacking tool - drag racing classic hack apk - drag racing classic cheats android,"drag racing classic cheatsDrag Racing v1.6.75 Android Apk Hack (Money+Unlocked) Mod Download*Since it was first released, reaching hundreds of millions ...",0
2018-01-17T23:18:24.000Z,ZtMQGXbrD1Q,transformers earth wars hack tool - transformers earth wars cheat app,transformers earth wars hack no survey free - transformers earth wars hack - transformers earth wars cheat app.,0
2018-01-18T12:30:07.000Z,vagZo4MMxc0,Farmville Tropic Escape Hack - Unlimited Gems and Coins Cheats NO JAILBREAK,Farmville Tropic Escape Hack - Unlimited Gems and Coins Cheats NO JAILBREAK Link :- https://tinyurl.com/mn6c8nh Our Farmville Tropic Escape online hack ...,0
2018-01-18T12:30:07.000Z,qBXBioR2PJs,FarmVille Tropic Escape  Hack ! Cheats iOS Android ! DOWNLOAD ! NEW UPDATE,FarmVille Tropic Escape Hack ! Cheats iOS Android ! DOWNLOAD ! NEW UPDATE Link :- https://tinyurl.com/mn6c8nh Our Farmville Tropic Escape online hack ...,0
2018-01-24T10:16:55.000Z,ciapxBEi0I0,king of avalon dragon warfare hack activation code - king of avalon dragon warfare hacker - king of,"is king of avalon dragon warfare gold hack a virusFrom its title, MMO diversion King of Avalon: Dragon Warfare (out now, free) appears to guarantee bunches of ...",0
2018-01-03T07:12:12.000Z,qusunuHaUHY,8 Ball Pool v3.12.4 HACK/CHEATS MEGA MOD APK (NO ROOT) - Level 255 Hack for Android 2017,"Make Sure To Like , Share & Subscribe Our Channel!!! Comment Down Below To Give Us Any Suggestion/Tips...",0
2018-01-16T15:41:20.000Z,F9JE-_ztH4U,How to get YOUTUBE RED with BLACK MOD for free on your android device | Colossal Tech,"Are you a YouTube addict? Want YouTube Red? But cannot pay for it. Here I am again to save your day. Come on, grab this offer and install YOUTUBE RED ...",0
2018-01-03T04:09:33.000Z,nk2vBtLa7Qc,8 Ball Pool - Latest Mod 3.12.4 Legendary Guidelines Free || How to download 8 ball pool mod 2018,Watch My LATEST 8 Ball Pool mod 3.13.4 : https://youtu.be/a0zcK6p83yQ .Hello Friends .,0
2018-01-16T08:34:27.000Z,fEQDeyn0FeU,8 Ball Pool - New 3.12.4 Mega Mod Extend Full Guideline - League Work+Anti Ban {No Root} Latest 2018,ஜ۩۞۩ஜ▭▭▭▭▭▭▭▭▭▭▭▭ ·▭········ Open This Description ········· ▭▭▭▭▭▭▭▭...,0
2018-01-14T18:03:16.000Z,QBs9-vpUzPE,8 Ball Pool Free Legendary Cues 3.12.4 || 8 Ball Pool Long Guidelines Anti-Ban Latest 2018,( 8 Ball Pool Free Coins App ) http://zipansion.com/1tuQ9 ---------------------------------------------------------------------------------- 8 Ball Pool Free Legendary Cues 3.12.4 ...,0
2018-01-09T11:41:34.000Z,hba6VuaB4dk,8 Ball Pool Mod Apk - Unlimited Money iOS & Android,8 Ball Pool Mod Apk - 8 Ball Pool Hack Cheats for Android and iOS - How to Hack 8 Ball Pool tutorial you will see how to get unlimited money and coins in just 4 ...,0
12,2018-01-07T17:25:21.000Z,LN-4eG_iQAs,Lixgrab pro nitflix 1080 p downloader,"LixGrab, unique and powerful application for downloading entire NitFlix serials, TV shows, documentaries, movies, music using the fastest multistream FreeApp ...",0
2018-01-13T14:40:15.000Z,cwomLIsm1U4,8 Ball Pool - NEW MOD LEGENDARY CUE FREE 3.12.4 ANTI BAN+LEAGUE WORK FREE ARCHON CUE LATEST 2018,ஜ۩۞۩ஜ▭▭▭▭▭▭▭▭▭▭▭▭ ·▭········ Open This Description ········· ▭▭▭▭▭▭▭▭...,0
2018-01-03T16:07:10.000Z,zqFgr2QJmgY,8 Ball Pool New Special Mod With All Legendary Cues Hack 100% Anti Ban,"Download Link: http://brisktopia.com/4ch3 8 Ball Pool New Special Mod With All Legendary Cues Hack 100% Anti Ban, 8 Ball Pool New Special Mod With All ...",0
2018-01-04T02:17:40.000Z,5pH_BjoktdU,Factorio Mod Spotlight - Napalm Artillery & Epic Artillery Sounds,Check out the mods here: https://mods.factorio.com/mods/MadClown01/Epic-Artillery-Sounds https://mods.factorio.com/mods/MFerrari/NapalmArtillery Stay up to ...,0
2018-01-12T19:35:37.000Z,SW3hYu1sor0,3 Best Websites For Downloading modded Android Games (FOR EDUCATIONAL PURPOSE ONLY),Hi guys my name is Raj Pandya and my channel name is coming with technical Raj you like a video then please subscribe my channel link of ...,0
2018-01-08T13:18:32.000Z,wx-rb1t-zF0,HOW TO DOWNLOAD 8 BALL POOL  LEGENDARY CUE MOD,Don't play with original apk Play with MOD APK DOWNLOAD MOD APP FROM THIS LINK ...,0
2018-01-05T13:00:04.000Z,LvqOmwpiVDQ,Colony Management - RimWorld B18 Mods Gameplay part 7,RimWorld Beta 18 gameplay with over 100 mods installed! This is a modded RimWorld let's play containing over a hundred mods with more being added ...,0
2018-01-13T15:24:03.000Z,3pIigDeWeZI,Legendary Cue 8 ball pool Mod Hack || How to get legendary cue in 8 ball pool anti-ban ||,Link To Download- https://drive.google.com/file/d/1qeIIwtObTTtlZnlwrWUQT1SxnXGV9hRH/view?usp=drivesdk Subscribe Now- ...,0
2018-01-04T14:57:57.000Z,ZDJZuytYfnw,8 ball pool hack Ultimate Mod,Kilyelentem hogy ez nem pénz hack hanem a vonalat meghoszabitsa. Ha tetszet a video akkor dobj egy liket. És egy feliratkozást és ha szeretnetek még ...,0
2018-01-14T13:00:04.000Z,mfWO6zktADU,Maybe Too Peaceful? - RimWorld B18 Mods Gameplay part 11,RimWorld Beta 18 gameplay with over 100 mods installed! This is a modded RimWorld let's play containing over a hundred mods with more being added ...,0
2018-01-12T13:00:04.000Z,z2Wp7w0GH8Y,The Road the Cornbread! - RimWorld B18 Mods Gameplay part 10,RimWorld Beta 18 gameplay with over 100 mods installed! This is a modded RimWorld let's play containing over a hundred mods with more being added ...,0
2018-01-09T15:00:01.000Z,I2gsQVg-Hhc,Marriage Area! - RimWorld B18 Mods Gameplay part 9,RimWorld Beta 18 gameplay with over 100 mods installed! This is a modded RimWorld let's play containing over a hundred mods with more being added ...,0
2018-01-05T10:38:21.000Z,FKic5an4J8s,8 Ball pool hack mod APK with arechale cue,Don't forget to subscribe my channel like and share Don't use your personal account I am warning you My WhatsApp no is 7980801976 APK mod ...,0
2018-01-13T08:30:21.000Z,51nFR_ed47s,8 Ball Pool Mod|Unlimited Free Coins|Cash(No Root)|2018|100% Working,8 Ball Pool Mod APK :https://apk-mod.net/en/games/8-ball-pool-v3103-mod-unlocked/download/3829/ Any Questions ask in the comments Freely       ...,0
2018-01-06T19:18:14.000Z,AEU6Fd8ektc,"8 Ball Pool Free Coins , Spin Reward link 2018 || Grab it before it expire",Grab it before it expire 1.http://8bp.co/?ulink&challengeID=0&reward=A6nhkZxBgd4UetU&fb 2.http://8bp.co/?,0
2018-01-08T20:31:24.000Z,hHlAZx2AuOE,hacker 8 ball pool mod top,hacker 8 ball pool mod top.,0
2018-01-02T16:33:05.000Z,lcbvDTAAsAQ,8 ball pool hacks | 8 ball pool mod apk | 8 ball pool free coins & cash(1000% working},"8 Ball Pool Hack apk 2018 - hey there everybody , im gonna show you today how to get coins and cash in 8 ball pool game , follow given instructions in video ...",0
2018-01-10T12:35:20.000Z,ErAkOlyE4gk,8 Ball pool hack mod menu unlimited cash & coins8 Ball Pool Mod 2017,"Welcome To The Description == Copyright Disclaimer Under Section 107 of the Copyright Act 1976, allowance is made for ""fair use"" for purposes such as ...",0
2018-01-12T13:46:36.000Z,T-VHk0Iue-U,8 ball pool mod  level part 1,Durecoder.,0
2018-01-08T15:26:36.000Z,gQWP-jmHEGA,#1 GAME PLAY:- Stick Fight: SW,CHANNEL UPDATE 2.0 POSTED HERE MUST CHECK IT (NEW TOPICS ON MY CHANNEL):- ...,0
2018-01-12T20:19:34.000Z,TyZ1IqiI60w,8 Ball Pool Free Coins Reward Link 2018 || Grab it before it expire,ஜ۩۞۩ஜ▭▭▭▭▭▭▭▭▭▭▭▭ ·▭········ Open This Description ········· ▭▭▭▭▭▭▭▭...,0
2018-01-13T06:30:53.000Z,kP_wp7bEWzg,8 Ball PoolFree 20M Coins Reward It | Grab It Now!,This Video Special I Show The Password In Video Of 20M Account So Who Taken This Account Plz Comment It.... HI YouTube :) Welcome to My Channel.,0
2018-01-08T23:30:00.000Z,e12kvauGW08,SuperPower 2: Central African Republic | #1,"Join us as we begin our global conquest in continuing and expanding the glorious socialist revolution! Hello everybody! In the voting episode, every single ...",0
2018-01-09T01:36:07.000Z,76Lobhh9hTM,GTA 5 Mods ps4,Ill be doing ps4 videos and xbox one videos. im new to this so bare with me guys subscribe to //www.youtube.com/channel/UCL-cAxqiLB7dujuMOF8fJOw and ...,0
2018-01-05T13:12:29.000Z,miaEf1P9a0k,How to download paid apps and games for free (works 100%),This is the way to grab your long awaited app or game which is paid but you can't afford.. Watch this video to learn how to download them for free.. Like the video ...,0
2018-01-08T12:00:04.000Z,lf19Bnkzz4U,Bowmasters - Gameplay Walkthrough Part 6 - New Characters Unlocked - HACK - Android GamePlay,"Please Like,Share and SUBSCRIBE. Thank You  Subscribe : https://goo.gl/6Gimxj • Dati Subscribe Canal Romana Aici : https://goo.gl/rqeT1m • SUBSCRIBE to ...",0
2018-01-11T23:30:00.000Z,yWdGSGwNcek,SuperPower 2: Central African Republic | #2,"As we prepare for war, we hit more than just a snag in the road... Hi, everyone! Matt from NODStudios here to tell you about this great second episode! Things in ...",0
2018-01-14T09:28:18.000Z,epq_0OdB78g,"8 Ball Pool Free Coins, Spin updated Reward Link 2018 - Grab it before it expire - I TECH",ஜ۩۞۩ஜ▭▭▭▭▭▭▭▭▭▭▭▭ ·▭········ Open This Description ········· ▭▭▭▭▭▭▭▭...,0
2018-01-07T07:21:54.000Z,u0vscVLsUR8,"0.16 Factorio Explorers EP12: More Power! - Multiplayer Gameplay, Lets Play","Lets explore Factorio 0.16 and test out all the new features and additions in the update! I'm join by Katherine Of Sky in this multiplayer Lets Play, and we are ...",0
2018-01-07T03:47:55.000Z,pmhgoZwGK0E,Free Coins + Extra Spin Links Claim Now 8 Ball Pool 100% Working Latest 7 Jan 2018,2018Hit Like And Subscribe For Latest Updates And More And Press Bell Icon To Receive Notification:) Links: 1.http://8bp.co/?ulink&challengeID=0&re.,0
2018-01-15T06:54:43.000Z,cbaE6w6b4hU,"0.16 Factorio Explorers EP19: High Tech Science & Robots! - Multiplayer Gameplay, Lets Play","Lets explore Factorio 0.16 and test out all the new features and additions in the update! I'm join by Katherine Of Sky in this multiplayer Lets Play, and we are ...",0
2018-01-08T17:12:47.000Z,isEDtYwmCo4,8 Ball Pool Long Lines Anti-Ban || 8 Ball Pool Free Legendary Cue || Free Archangel Cue 3.12.4,( 8 Ball Pool Free Coins App ) http://zipansion.com/1tuQ9 ---------------------------------------------------------------------------------- 8 Ball Pool Long Lines Anti-Ban || 8 Ball ...,0
2018-01-09T10:41:23.000Z,YXtnusUC0tI,8 ball pool Bugs (That Ever Person Should i Follow All Bugs) Just Fun.,ஜ۩۞۩ஜ▭▭▭▭▭▭▭▭▭▭ ·········About The Post·········` ▭▭▭▭▭▭▭▭▭ஜ۩۞۩ஜ▭▭▭▭▭▭...,0
2018-01-05T20:30:01.000Z,XexIGILua6s,Battlefront 2 Mod Lets You Play As SNL's Matt The Radar Technician,Play as Matt the Radar technician from the famous SNL sketch with this Battlefront 2 mod by GameTSF. Battlefront 2 Mod Lets You Play As Pink Vader ...,0
2018-01-16T03:43:47.000Z,gEQcgtGgky4,"They Are Billions Steam Release Gameplay EP3: 1st Map, 100% Difficulty - Lets Play",They Are Billions has just released on Steam so lets give it a try. I'm super excited to do a Lets Play of this! We will work our way through the 4 maps in Survival ...,0
2018-01-11T07:42:52.000Z,ylqmfXfvXfM,"0.16 Factorio Explorers EP16: Additional Iron! - Multiplayer Gameplay, Lets Play","Lets explore Factorio 0.16 and test out all the new features and additions in the update! I'm join by Katherine Of Sky in this multiplayer Lets Play, and we are ...",0
2018-01-12T07:16:11.000Z,l5u6dcfXqjA,how to download 8 ball pool mod apk latest version,hii Friend's welcome to my channel Gamer Ritik ______ yr game jo ma ap ko day rahahu wo ____ Game ma unlimited loga melta h ok so i think muja pata ha ki ...,0
2018-01-09T19:38:36.000Z,OkbvqTEMShY,8 Ball Pool Free Coins and Spin Reward Link 2018 || Grab it before it expire || 100% Working,ஜ۩۞۩ஜ▭▭▭▭▭▭▭▭▭▭▭▭ ·▭········ Open This Description ········· ▭▭▭▭▭▭▭▭...,0
2018-01-06T07:00:01.000Z,19hIATuOODA,"0.16 Factorio Explorers EP11: WE'RE BACK! - Multiplayer Gameplay, Lets Play","Lets explore Factorio 0.16 and test out all the new features and additions in the update! I'm join by Katherine Of Sky in this multiplayer Lets Play, and we are ...",0
2018-01-08T07:00:35.000Z,jNOqGxhtKJI,"0.16 Factorio Explorers EP13: The Battle Begins! - Multiplayer Gameplay, Lets Play","Lets explore Factorio 0.16 and test out all the new features and additions in the update! I'm join by Katherine Of Sky in this multiplayer Lets Play, and we are ...",0
2018-01-17T07:21:12.000Z,r064AC4HiI8,Hydraulic Press Pocket Hack diamantes infinitos (down na desc),Um jogo 2d criado na Unity Engine pelo programador Johannes Linnama Com a participação do youtuber Lauri do canal Hydraulic Press Channel (HPC) e ...,0
2018-01-10T08:05:44.000Z,gTFC3lC2auk,"0.16 Factorio Explorers EP15: Outpost Smelting! - Multiplayer Gameplay, Lets Play","Lets explore Factorio 0.16 and test out all the new features and additions in the update! I'm join by Katherine Of Sky in this multiplayer Lets Play, and we are ...",0
2018-01-09T07:24:13.000Z,AATgikRE1Xk,"0.16 Factorio Explorers EP14: The Tank Devastator! - Multiplayer Gameplay, Lets Play","Lets explore Factorio 0.16 and test out all the new features and additions in the update! I'm join by Katherine Of Sky in this multiplayer Lets Play, and we are ...",0
2018-01-03T06:48:39.000Z,3dNqgaIgJdw,"Factorio Multiplayer Production Challenge Round 2 EP2 Gameplay - With ColonelWill, AntiElitz & More!","We are competing in the Production Challenge in Multiplayer. We have 4 teams competing against each other. Team Moar Faster, Team Townies, Team ...",0
2018-01-03T11:33:39.000Z,9B61Vo0AMWU,"Minecraft Survival STREAM, BASE, Friends and a Large hole.","so i did some work off stream to make today a little less repeditive but unfortunatly it is still going to be somewhat, its time for me and tyler to build our base and ...",0
2018-01-05T18:54:03.000Z,iu98nW4JoDY,Hack Any Game Without Using Any Website 2018!! [(No Root Required)(On Any Android and Any IOS)],AC Market is a must have android app for hacks and mods because of the selection. There is a solid selection of apps you've heard of and apps you haven't.,0
2018-01-08T00:40:12.000Z,k0MizMmjztU,Toon blast mod level 195 hack full screen #toonblast #toonblastgame #peakgame #pesakgame,This video is Toon Blast level 195 for those that need help on level 195 of the game or for those that want to watch gameplay on toon blast level 195. Toon blast ...,0
2018-01-15T04:22:35.000Z,-_fKPSiW2xY,MINECRAFT PE | SURVIVAL LIVE | GRAB POPTARTS!,Come by have fun and just live life the way you want no the way others want you to.,0
2018-01-04T19:46:38.000Z,PHE3kBM6Iww,WOLF ONLINE |NOVA MOD| V2.1.1 READ DESC 200 SUB SPEACIAL,I HAD TO TAKE DOWN TEAL MOD CAUSE IT WAS A PERSONAL MOD I AMDE AND I DIDNT NOTICE LOL BUT HOPE THIS CAN MAKE UP IM SORRY GUYS ...,0
2018-01-05T08:44:13.000Z,zbs1Rq4aTH4,"TALKING TOM CAMP Gameplay Walkthrough Part 3 - FIGHT BACK (iOS, Android)","Talking Tom Camp, Walkthrough Gameplay Part 3 (Android/iOS/iPhone/iPad) SHARE AND LIKE, THANK YOU!!! SUBSCRIBE▻▻ ...",0
2018-01-11T20:59:07.000Z,KHTSQT6P-hA,How to download Kine Master premium FREE || Without water mark || All features || 2018 ||,"Well hello friends !!! Here is full version of ""Kine Master"" for you ! Just open below link and grab it. Link :- http://j.gs/18762953/hackmysteps It's totally free 100%.",0
2018-01-06T22:27:27.000Z,0kZXkHtcjdk,8 BALL POOL - HACK APK MOD ATUALIZADO 2018 #12,NOVO HACK 8 BALL POOL LINHA INFINITA SE GOSTARÃO DO VÍDEO DEIXA O LIKE E INCREVE SE NO CANAL PRA NÃO PERDE NENHUM VÍDEO LINK ...,0
2018-01-06T13:16:16.000Z,qwP7Idx_Rzs,"Moto X3M Bike Race Game -IOS, Android Gameplay  - Bike Racing Game","Moto X3M Bike Race Game - Android, IOS Gameplay Walkthrough - Google Play Mobile App Game Android download: ...",0
2018-01-15T15:49:51.000Z,c9o1yuaFqzU,SMALL DINO BARN :: Ark Building Tutorial :: Geeks Aberration Ep. 3,"Welcome back geeks, to Ark Aberration and episode two in our Aberration DLC survival series on the Geeks Patreon server. In this episode we design and build ...",0
2018-01-12T14:22:48.000Z,YC-mIAB1t4g,8 Ball Pool v3.12.4-Coins+ Cash+BOX REWARDS[NO ROOT] Link in Descrprtion 2018+in app purchases free,8 Ball Pool v3.12.4-Coins+ Cash+BOX REWARDS[NO ROOT] Link in Descrprtion 2018+in app purchases free ...,0
2018-01-05T06:09:49.000Z,uedYCb2pM0I,Let's Play Heroes Of Might & Magic 3 HD Edition - Ep. 64 - They Are Rats!,"These guys are like rats. Popping up over here. Then over there. Poking and prodding, but unable to actually do anything. They keep me running all over.",0
2018-01-10T18:00:01.000Z,FMi7YuAYt88,A CURSE ON YOU! - Wonder Boy: The Dragon's Trap - #1,Today we start on a journey old yet new! Grab Wonder Boy: The Dragon's Trap here ...,0
2018-01-05T05:31:52.000Z,Vi_VHdLVhPo,[OFFICIAL] Nintendo Switch Emulator Android - How To Play Nintendo Switch Games On Android and iOS,Try The New Nintendo Switch Emulator For Android and iOS ( USE YOUR MOBILE PHONE TO DOWNLOAD ) Get It Here: ...,0
2018-01-15T01:00:01.000Z,-6xWiCqibUE,MY SUMMER CAR - 10 - KILLING SPREE (GUN MOD),Welcome to the land of Finland. Where we build cars and crash them and most often die. Welcome to My Summer Car today we test out the new gun mod.,0
2018-01-12T08:05:17.000Z,ZuA2MWB4nsw,"0.16 Factorio Explorers EP17: Belt Upgrades! - Multiplayer Gameplay, Lets Play","Lets explore Factorio 0.16 and test out all the new features and additions in the update! I'm join by Katherine Of Sky in this multiplayer Lets Play, and we are ...",0
2018-01-02T19:06:20.000Z,n1MJnh3sauU,Rare Box + Extra Spin +Free Coins Links Claim Now 8 Ball Pool 100% Working Latest 3 Jan 2018,Hit Like And Subscribe For Latest Updates And More And Press Bell Icon To Receive Notification:) Links: 1.http://8bp.co/?,0
2018-01-16T20:57:04.000Z,t9y9fwLlIQw,WWE Mayhem Hack  2018- Free Unlimited Cash & Gold (Android & iOS),WWE MayhemHack get Free Unlimited Cash and Gold works for Android and iOS. WWE MayhemHack Available Now! WWE Mayhem Hack link ...,0
