,published_at,video_id,title,description,relevance
2018-03-01T23:30:00.000Z,2Wl2HPDYNcw,Talking Tom Pool Android Gameplay #12 Talking Tom Games Android/IOS Gameplay Youtube Kids,Talking Tom Pool Android Gameplay #12 Talking Tom Games Android/IOS Gameplay Youtube Kids      https://goo.gl/trngN2 - SUBSCRIBE YOUTUBE Kids ...,0
2018-02-20T13:30:01.000Z,AhQ7pjzVcoA,Talking Tom Pool Android Gameplay #10 Talking Tom Games Android/IOS Gameplay Youtube Kids,Talking Tom Pool Android Gameplay #10 Talking Tom Games Android/IOS Gameplay Youtube Kids      https://goo.gl/trngN2 - SUBSCRIBE YOUTUBE Kids ...,0
2018-03-02T07:32:15.000Z,oY7N0DX8fxk,"Talking Tom Gold Run - Neon Angela Gameplay  (1,239,000 High Score)",Talking Tom Gold Run - Neon Angela Gameplay (1239000 High Score) If you run fast enough you can chase down the raccoon and get extra rewards! You've ...,0
2018-02-26T23:30:00.000Z,jkUyhkGET4M,Talking Tom Pool Android Gameplay #11 Talking Tom Games Android/IOS Gameplay Youtube Kids,Talking Tom Pool Android Gameplay #11 Talking Tom Games Android/IOS Gameplay Youtube Kids      https://goo.gl/trngN2 - SUBSCRIBE YOUTUBE Kids ...,0
2018-02-26T00:34:55.000Z,fZn8vMShzU0,"yo quick stream b4 i hang with my dad [VOD: Feb 25, 2018]","Mitch Jones - yo quick stream b4 i hang with my dad [VOD: Feb 25, 2018]",0
0,2018-02-06T03:58:36.000Z,YnlZ__n4Ejo,Cellphone Grab Hack,Makes life just a little bit easier.,0
2018-02-02T19:53:38.000Z,c3zwgjEeCfg,8 Ball Pool Mega MOD 3.12.5 With King Cue Hack + Unlimited Aim + Force + Spin +Time | Feb 2018 |,Android & Games !!! 8 Ball Pool Mega MOD 3.12.5 With King Cue Hack (Link Given Below) ...,0
2018-02-07T05:41:39.000Z,Y-pDYYnYiAg,gofood mod,orderan gofood di aplikasi gojek driver https://youtube.com/PujomarkoDriver.,0
2018-02-09T04:51:59.000Z,Vt1c3PObr8g,MEGA RAMP - Funny Vehicles Mod - Official Game,Available to play now: Game link: https://play.google.com/store/apps/details?id=com.rcgames.megaramp.impossible Playlist link: ...,0
1,2018-02-09T02:00:01.000Z,Xs65UnUkrec,TenkiuFaCai with Grab,"Sometimes, the best greeting is the simplest one. No need for pow-der-ful, flowery language. #keepitsimple #tenkiufacai Click http://grb.to/TenKiuFaCai for more ...",1
2018-02-14T17:17:43.000Z,rYYQFE7Dln0,Frank Gojek GACOR,Selalu berdoa berusaha INSYAALLAH Rizki nya lancar.,0
2018-02-11T19:22:38.000Z,5lP_FrJ0ij4,How to download  8ballpool mod apk,Please subscribe my channel and like this video.,0
2018-02-04T04:41:09.000Z,mWkNmzhTjXw,Chef Town mod unlimited money!!,Hi link to mod. https://m.downloadatoz.com/chef-town-cooking-simulation/org.nanobit.cheftown/com.mod.chef-town-cooking-simulation-mod-5-2-download.html.,0
2018-02-08T14:10:25.000Z,7GFvstiJDfg,"MoShow instantly turns your photos into Fun, professional slideshow editing perfect for social media","From a single selfie to a week of pics, add your favorite photos and create stunning video stories that stand out from the crowd. To make your movie, choose any ...",0
2018-02-14T14:48:30.000Z,v7mrIx5Ieyw,BLACKHOLE + JAKARTA + SOLAR SYSTEM CUES FREE IN 8 BALL POOL MOD VERSION 3.11.3 - I Tech Pakistan,READ DESCRIPTION✰ ············ ▭▭▭▭...,0
2018-02-02T13:00:01.000Z,600mk-YCinA,Disorganized - RimWorld B18 Mods Gameplay part 17,RimWorld Beta 18 gameplay with over 100 mods installed! This is a modded RimWorld let's play containing over a hundred mods with more being added ...,0
2018-02-03T09:16:39.000Z,-6h6yyIU_EA,Climate Control - RimWorld B18 Mods Gameplay part 16,RimWorld Beta 18 gameplay with over 100 mods installed! This is a modded RimWorld let's play containing over a hundred mods with more being added ...,0
2018-02-11T13:00:01.000Z,Io_LgPxYylc,Arachnid Warrior Bugs! - RimWorld B18 Mods Gameplay part 20,RimWorld Beta 18 gameplay with over 100 mods installed! This is a modded RimWorld let's play containing over a hundred mods with more being added ...,0
2018-02-06T14:51:14.000Z,tJecnBP35M4,8 ball pool king cue mega anti ban mod 2018 king cue long line with unlimited spin,published on 06/02/2018 king cue mod downloading link http://www.mediafire.com/file/m618b2t56jee2s6/8bp+king+cue+Mod.apk how to create your own MOD ...,0
2018-02-04T13:00:00.000Z,8xANve4KWkc,"Yay, Heating! - RimWorld B18 Mods Gameplay part 18",RimWorld Beta 18 gameplay with over 100 mods installed! This is a modded RimWorld let's play containing over a hundred mods with more being added ...,0
2018-02-13T14:00:02.000Z,EpBm5HtHplA,Back on Track! - RimWorld B18 Mods Gameplay part 21,RimWorld Beta 18 gameplay with over 100 mods installed! This is a modded RimWorld let's play containing over a hundred mods with more being added ...,0
2018-02-07T13:30:00.000Z,UXFKwE37tq4,Starting a Defense - RimWorld B18 Mods Gameplay part 19,RimWorld Beta 18 gameplay with over 100 mods installed! This is a modded RimWorld let's play containing over a hundred mods with more being added ...,0
2018-02-10T17:05:10.000Z,Mj77yeSU7Dw,iJoy Capo 216: First Dual Regulated 20700 Squonk! | VapeAM #135,"Finally, the iJoy Capo 216 arrived at Orbital Vaping Headquarters, and I fell in love with this mod immediately. Dual #20700 cells, 10mL squonk bottle, separate ...",0
2018-02-03T16:24:34.000Z,86xDlWT7zKw,8 Ball Pool Hack Mod... Unlimited Guidelines | 100% working,8 Ball Pool Hack Mod... Unlimited Guidelines | 100% working.,0
2018-02-06T02:14:04.000Z,K3LrrAmjfgY,8 ball pool mod by Yash Patel,Mod LINK---- https://www.mediafire.com/file/fxe60p209979171/,0
2018-02-07T18:40:16.000Z,9zIiBxrbaoA,THE TAMING OF THE DRAGON! | ARK: Pooping Evolved Modded Aberration E7,"ARK: POOPING EVOLVED MODDED PUGNACIA & GAIA Waking up on 'Aberration', a derelict, malfunctioning ARK with an elaborate underground biome ...",0
2018-02-10T19:00:01.000Z,Fcw4DfV-40M,MAKING FRIENDS ANGRY AT A CHILDREN'S CARD GAME! - UNO Funny Moments,Grab your Terroriser merch here: https://shop.terrorisermerch.com/ If you enjoyed the video hit that LIKE button and drop a COMMENT down below!,0
2018-02-02T20:00:03.000Z,y-BeLGs_iio,BASE BUILDING FOR DAYS!! From the Stream | ARK: Pooping Evolved Modded Aberration E5,"ARK: POOPING EVOLVED MODDED PUGNACIA & GAIA Waking up on 'Aberration', a derelict, malfunctioning ARK with an elaborate underground biome ...",0
2018-02-08T23:53:32.000Z,Hbcjq0cgdR0,"20,000 SUBSCRIBERS! THANK YOU & SPECIAL STREAM SATURDAY!","I am blown away by how the channel has grown and that we actually hit this goal! I can't thank you guys enough, you all are awesome and the best community I ...",0
2018-02-07T12:08:19.000Z,cXbBD4poRi4,8 ball pool free avatar/grab it before end,How are you all...... Welcome back to my channel If anybody want to buy coins contact me on fb page Follow me on:- My fb page link:- ...,0
2018-02-10T12:32:13.000Z,EAG3DCp2B7Y,earn free money from app ??,This video will show you how to earn money from an android app!! it really works. download grab ...,0
2018-02-07T17:13:25.000Z,tdiQ6nERUK8,Get Newest Avatar For Free - Grab it Quickly - 8 Ball Pool,"Get Newest Avatar For Free - Grab it quickly - 8 Ball Pool Hey Guys, In this video, I will Show You How You Can Get Newest 8 Ball Pool Avatar Grab it Quickly ...",0
2018-02-01T19:01:47.000Z,6dXOtkwJ1_0,8 Ball Pool King Cue Double Longline Mod 95% Chance To Win 01/02/2018,Click Bellow Link To Download King CUe Double Longline Mod And Also Download The Music of Gta 5 ...,0
2018-02-15T18:12:37.000Z,sE1dD_YA8-c,THE BUU CREW | Dragon Ball FighterZ | #1,So now the game has released! How well do I do online? Grab Dragon Ball FighterZ here ...,0
2018-02-04T05:36:17.000Z,LwbQ_xTEOFI,"Factorio: Tightening The Belt: Megabase Guide EP8 - OIL, PLASTIC, BATTERY | Tutorial Gameplay Series","This Factorio series is intended to be a guide or walkthrough for newer players as well as experienced players with tips, tricks, How To, and the Why behind ...",0
2018-02-09T03:48:47.000Z,uIOGkhV1lv4,Factorio: Tightening The Belt: Megabase Guide EP13 - MALL CONSTRUCTION! | Tutorial Gameplay Series,"This Factorio series is intended to be a guide or walkthrough for newer players as well as experienced players with tips, tricks, How To, and the Why behind ...",0
2018-02-03T18:35:06.000Z,FkmVL03HkZo,FFF #228 (High Res Turrets & New Laser Beams & 0.16 Stable) - Factorio Friday Facts Discussion,Friday Facts Here: https://www.factorio.com/blog/post/fff-228 Stay up to date with new releases by Subscribing. My Merchandise: ...,0
2018-02-11T21:59:48.000Z,WpS_aaG3KKg,JEEP MOD - J8 Jeep Front Bumper with Winch Fairlead - Part 1,Part 1 of modifying a Jeep J8 front Bumper to accomodate a winch fairlead. I plan on using a drop down winch plate to keep the winch hidden behind the ...,0
2018-02-13T06:06:35.000Z,rD3Q9Q65nMk,The Pixel Gun King [Pixel Gun 3D],"Grab Your Popcorn! . . . Here Are My Links, Stalk Me   Snap: djkents345 Discord: Djkents#3444 https://twitter.com/djkents345 ...",0
2018-02-06T03:31:42.000Z,zvA7PR_LFOM,Factorio: Tightening The Belt: Megabase Guide EP10 - RED CIRCUIT BUILD | Tutorial Gameplay Series,"This Factorio series is intended to be a guide or walkthrough for newer players as well as experienced players with tips, tricks, How To, and the Why behind ...",0
2018-02-04T18:00:02.000Z,_39VxEcP7eI,Closed Loop Farming: Turning Poo into Plant Food! | Let's play Starbound Frackin' Universe S2 ep 23,We close the farming loop by automatically recycling fluffalo poo into fertiliser! We also finish breeding bees in let's play Starbound Frackin' Universe ep 23.,0
2018-02-16T04:28:00.000Z,xVPc3g94p6I,Factorio - ColonelWill's Original Megabase Visit Part 2: Train Surprise & 30 Stack Challenge,40 Stack Challenge Info: https://pastebin.com/bxDh0CvD blueprint fro the boxes for the challenge: https://pastebin.com/gFDVLqp9 We take some time to go visit ...,0
2018-02-02T03:36:38.000Z,R7tUj5G53PY,Factorio: Tightening The Belt: Megabase Guide EP6 - SIGNALS & MILITARY | Tutorial Gameplay Series,"This Factorio series is intended to be a guide or walkthrough for newer players as well as experienced players with tips, tricks, How To, and the Why behind ...",0
2018-02-03T06:36:50.000Z,x71Qd8wnT6Y,8 ball pool mod long line not antiband mod by qasir lodhi,download link here   http://www45.zippyshare.com/v/VQnMLJXF/file.html app ki real id maat login kasr na.,0
2018-02-10T16:16:26.000Z,_HwsyPfO7Mw,Mini Militia Stream {{148}} thok ke maro yr ,Letter Padne se phele {Subscribe} mar lena kyuki Is channel ko apk subki support ki jarurat hai .... Jai Hind hi Friends welcome to all S.P Gamer Channel Dosto ...,0
2018-02-09T10:30:30.000Z,Cfr-fgKwJSQ,Minetest Gameplay Episode 142 Starting the Private Airstrip,Today's Minetest Gameplay episode covers the start of building a private airstrip. Nathan and octacian's tutorials on modding Blender Guru ...,0
2018-02-05T03:18:05.000Z,nTsKpqnxNkw,Factorio: Tightening The Belt: Megabase Guide EP9 - ENGINES & MINERS | Tutorial Gameplay Series,"This Factorio series is intended to be a guide or walkthrough for newer players as well as experienced players with tips, tricks, How To, and the Why behind ...",0
2018-02-03T03:56:15.000Z,j_eSKmMVGw8,Factorio: Tightening The Belt: Megabase Guide EP7 - MILITARY DONE & OIL | Tutorial Gameplay Series,"This Factorio series is intended to be a guide or walkthrough for newer players as well as experienced players with tips, tricks, How To, and the Why behind ...",0
2018-02-07T04:39:36.000Z,yKJWlhPC2iU,Factorio: Tightening The Belt: Megabase Guide EP11 - TRAIN STATION SETUP | Tutorial Gameplay Series,"This Factorio series is intended to be a guide or walkthrough for newer players as well as experienced players with tips, tricks, How To, and the Why behind ...",0
2018-02-07T21:34:11.000Z,PUOWwiDVMxw,Lets Play The Curious Expedition With Mods! - Recruitment Drive! - Mad Max Rockatansky Expedition 5,"Welcome back to my let's play series of The Curious Expedition Version 1.3.2, now with modding support! - TCE is a procedurally generated rogue-like ...",0
2018-02-11T19:00:02.000Z,q5XITU79GTQ,BABY TRIES TO BURN DOWN HIS FAMILY'S HOUSE! - Baby Hands VR HTC VIVE Gameplay,BABY TRIES TO BURN DOWN HIS FAMILY'S HOUSE! - Baby Hands VR HTC VIVE Gameplay Subscribe if you like! + http://bit.ly/1PG8z9G Welcome to a ...,0
2018-02-07T06:55:51.000Z,crBqf2gkxFk,"They Are Billions - Community Challenge Map EP1: 100 Days Survival Lets Play, Gameplay",They Are Billions has just released on Steam so lets give it a try. We are trying out the Community Challenge Event / Map and see how we do in this Lets Play.,0
2018-02-03T07:14:19.000Z,-eAYRiarTRc,"They Are Billions Steam Release Gameplay EP6: 1st Map, 100% Difficulty - Lets Play",They Are Billions has just released on Steam so lets give it a try. I'm super excited to do a Lets Play of this! We will work our way through the 4 maps in Survival ...,0
2018-02-14T07:49:56.000Z,9tOZmhWjVSE,"They Are Billions - Community Challenge Map EP4: 100 Days Survival Lets Play, Gameplay",They Are Billions has just released on Steam so lets give it a try. We are trying out the Community Challenge Event / Map and see how we do in this Lets Play.,0
2018-02-12T12:00:34.000Z,0jXDYeuH3k0,[Gta V/sprx] Semjase’s Mod Menu (Ban Players and more) + Download,I recommend to open this :D········· ○▭▭▭▭▭▭▭▭ஜ۩۞۩ஜ▭▭▭▭▭▭▭▭▭▭○ ○ # CHEETOS ON THE ASS ❖  Rate ✎...,0
2018-02-15T01:31:41.000Z,_eUIMcksPTI,Factorio Mod Spotlight - Strange Matter (Create ore from energy),This Factorio Mod Spotlight covers the Strange Matter mod. It allows you to turn energy / power into ores with a few special machines. They will take your energy ...,0
2018-02-10T07:38:21.000Z,gioodleN5QI,"They Are Billions - Community Challenge Map EP2: 100 Days Survival Lets Play, Gameplay",They Are Billions has just released on Steam so lets give it a try. We are trying out the Community Challenge Event / Map and see how we do in this Lets Play.,0
2,2018-02-01T22:28:55.000Z,fIohoFxFHqk,Grab the auto 5| ripoff review,Hello and today we are going to review the worst gta ripoff on the play store.,0
2018-02-12T17:04:32.000Z,VR6hh4ypDjc,"BRAWL STARS COLLAB! - Gem Fight! with Ark, Kairos Time and Doing Life Gaming!",Today I challenge Kairos Time and Doing Life Gaming to a Brawl Stars challenge! In Gem Fight you must work together to achieve a victory whilst competing ...,0
2018-02-03T08:21:58.000Z,hbxyeXenWfM,8 ball pool latest Legendry cue mod.apk,Hello guys! Here's the link of moded 8 ball pool .apk ...,0
2018-02-13T06:56:42.000Z,-BsdXK1M3LE,"They Are Billions - Community Challenge Map EP3: 100 Days Survival Lets Play, Gameplay",They Are Billions has just released on Steam so lets give it a try. We are trying out the Community Challenge Event / Map and see how we do in this Lets Play.,0
2018-02-08T06:03:58.000Z,FYV7du9Xc_A,Factorio: Tightening The Belt: Megabase Guide EP12 - BLUE SCIENCE! | Tutorial Gameplay Series,"This Factorio series is intended to be a guide or walkthrough for newer players as well as experienced players with tips, tricks, How To, and the Why behind ...",0
2018-02-04T15:00:01.000Z,EMoLybjakos,This is as good as it gets | Motosport Manager Season 3 Race 10 prep,"With no money remaining for development, we're now stuck with what we've got. Can we make any more progress before the penultimate race in the season?",0
2018-02-04T09:06:54.000Z,JvDi_RBr83Y,Talking Tom Gold Run MOD New Update 2018 - New World Map Hank on Hawaii - City Sights Character,Download link :- http://rexdlfile.com/index.php?id=talking-tom-gold-run-apk Talking Tom gold run mod apk Unlimited Coins and Crackers Talking tom gold Run ...,0
2018-02-14T07:55:55.000Z,LkCFpQA4uW8,50000 per month | online earning website | latest video 2018 | grabpoint,50000 per month | online earning website | latest video 2018 | grabpoint..... Full Video Tuturial.....,0
2018-02-05T14:00:05.000Z,xUHo5symiUA,Review REDUX - Mass Effect,"In this video, I take another look at the first game in the Mass Effect series. ESRB Rating: Mature (17+) - Blood, Language, Partial Nudity, Sexual Themes, ...",0
2018-02-15T05:32:28.000Z,1Oau9PoF0rg,Factorio: Tightening The Belt: Megabase Guide EP19 - OIL TANKER WAGON | Tutorial Gameplay Series,"This Factorio series is intended to be a guide or walkthrough for newer players as well as experienced players with tips, tricks, How To, and the Why behind ...",0
2018-02-06T08:36:44.000Z,JmUJ2KZ-sLw,Cafe Racer Hack for iOS and Android Unlimited Free Money Glitch (No Root | No JailBreak),"You can get unlimited Money using this Cafe Racer Cheats by following the steps shown in the video. This Cafe Racer Hack for Android, iPhone & iPad is ...",0
2018-02-14T08:02:47.000Z,7CynY5HKuAM,[NotITG] 140 Part 1 [Released!],Song: 140 Part 1 Artist: Schmid Schmid http://www.schmid.dk/ https://soundcloud.com/schmid https://www.youtube.com/channel/UC-UgUEYz6PtpYy3DtK9GlOQ ...,0
2018-02-09T01:00:02.000Z,iyqMCCCJtSg,"Bowmasters Headshot Epic Wins - Gameplay Walkthrough Part 2 - All Characters Unlocked (iOS, Android)","Bowmasters Headshot Epic Wins - Gameplay Walkthrough Part 2 - All Characters Unlocked (iOS, Android) A brand new version of the world-famous multiplayer ...",0
2018-02-04T08:17:48.000Z,4eFU5-DHPYs,Samurai Siege Cheats for iOS & Android - UNLIMITED FREE DIAMONDS HACK [No Root | No JailBreak],"Link: http://Samurai.CheatCampus.com Hey there, in this video I show you how to get free unlimited Diamonds using this Samurai Siege Hack Online.",0
2018-02-16T12:23:11.000Z,1lLHU2_kkp8,Bowmasters SECRET LEVEL (Blind battle) THOR the Thundergod - Gameplay Walkthrough (101),Bowmasters - THOR the Thundergod Bowmasters - https://itunes.apple.com/us/app/bowmasters-top-multiplayer/id1118431695?mt=8 Bowmasters - Free We're ...,0
2018-02-12T06:44:40.000Z,WRYBXYNas44,8 ball pool LEGENDARY CUE MOD 100% ANRTIBAN,hi freinds this is anti-ban mod and mod link-http://cuon.io/ydUcm.,0
2018-02-10T19:42:09.000Z,G9cCJoJ_KoI,Draw a Stickman: Epic 2 Gameplay,Like and subscribe for more updates. ** Winner of 5 Webby Awards - Draw a Stickman Franchise ** ** Played over 100 Million Times around the Globe ** Grab ...,0
2018-02-08T02:00:00.000Z,7C6iL1xZtHg,"Bowmasters - Gameplay Walkthrough Part 1 - All Characters Unlocked (iOS, Android Gameplay)","Bowmasters - Gameplay Walkthrough Part 1 - All Characters Unlocked (iOS, Android Gameplay) A brand new version of the world-famous multiplayer game with ...",0
2018-02-08T02:29:45.000Z,plNIXH_i6tc,DJI MAVIC AIR SPORT MODE SPEED TEST!! ** unboxing and pro vs air comparison **,First impressions of the DJI Mavic Air and comparing it to DJI Mavic Pro. Unboxing of the DJI Mavic Air Fly More Combo and speed testing the Mavic Air in sport ...,0
2018-02-06T04:05:37.000Z,44-8Ic6rJrY,Land Dwarves? - Regions of Ruin - First Impression,"Developer Description: Regions of Ruin is a 2D pixel side-scrolling RPG with town-building, where you explore, fight and build into an open world that ...",0
2018-02-12T06:59:51.000Z,yK-u1WVHTDQ,"Slay The Spire Playthrough EP6 - The Ironclad, Act 3 : Lets Play, Gameplay","Lets start our journey through Slay The Spire. A rogue-like card game with some interesting and unique twists! We start in Act 1 with the second the class, the ...",0
2018-02-13T10:04:34.000Z,AhuYYe8OC4I,8 Ball pool cue hack: full guideline and Max spin,http://www.mediafire.com/file/65rt6dortxxb0iy/8%20Ball%20Cue%20Force%20%26%20Aim%20MOD_3.12.4%20MOD%20By%20AZEEM%20ASGHAR%20YT ...,0
2018-02-10T10:32:30.000Z,DWAZ2-XHOpQ,"How To Win Every Berlin By Playing """" Watch And Learn """" 10/02/2018","For Free COins Account By App Join The Link Bellow "" Every 1 Have Chance To Win COins Account"" https://www.youtube.com/watch?v=sgTy0vKSD14 ...",0
2018-02-05T07:36:06.000Z,kXQqdSdyklk,"Slay The Spire Playthrough EP5 - The Silent, Act 2 : Lets Play, Gameplay","Lets start our journey through Slay The Spire. A rogue-like card game with some interesting and unique twists! We start in Act 1 with the second the class, the ...",0
2018-02-07T15:58:01.000Z,cnJ_hhSgmE0,Descenders Extreme Mountain Biking Downhill Game | What the hell did I just watch?,"The team at RageSquid said to me, ""Hey Colonel, you're a middle aged man. Why not try virtual mountain biking in our new game, Descenders?"" I thought it ...",0
2018-02-11T07:29:48.000Z,8DhuBKjWcPE,Factorio: Tightening The Belt: Megabase Guide EP15 - PURPLE SCIENCE & BOTS| Tutorial Gameplay Series,"This Factorio series is intended to be a guide or walkthrough for newer players as well as experienced players with tips, tricks, How To, and the Why behind ...",0
2018-02-12T01:29:56.000Z,Vy-y7-pD1oQ,Using the Pokemon Go Plus,"In this video I show you guys all of the uses of the Pokemon Go Plus. This thing is so needed, it is awesome. Buy it in Amazon: http://azon.ly/avd2 Please support ...",0
2018-02-02T22:11:36.000Z,VDGogNEOzkk,Play Ayodance Mobile on Root Device,STEPS== 1. Download Xposed Installer : https://goo.gl/cakbb6 (via GoogleDrive). 2. Download RootCloak : https://goo.gl/epgLmN (via GoogleDrive). 3.,0
2018-02-02T07:15:18.000Z,PoZDbRbHUcA,"Slay The Spire Playthrough EP4 - Ironclad, Act 3 : Lets Play, Gameplay","Lets start our journey through Slay The Spire. A rogue-like card game with some interesting and unique twists! We start in Act 1 with the second the class, the ...",0
2018-02-15T16:30:01.000Z,wf-NMXHtYUQ,Taming The First Primeval Dragon On The Server & RIP Tater Tots! | Ark Modded Aberration Ep2,"Welcome to the first episode of a new series of Ark Aberration. This is a more heavly modded server that has Pugnacia, Gaia, and so many more mods to play ...",0
2018-02-09T09:39:18.000Z,sJdqp4pYGCg,Get Free 8 Ball Pool Cash Upto 1000 | 2018 | 100% Working Trick,Get your free 8 ball pool cash upto 1000 by doing this trick Subscribe : https://goo.gl/jyy5iA tags : 8 8 ball pool 8 ball pool reward 8 ball pool free coins 8 ball pool ...,0
2018-02-11T02:24:14.000Z,KZO_sczcBko,INSTALL TERRARIUM 1.9.2 (MOVIES AND TV SHOWS),The greatest apk has just been updated. It's always a good idea to stay updated because the developer adds fixs and updates sources. Here is where you ...,0
2018-02-06T22:09:52.000Z,nEcPBfUoJhk,( No Root ) 8 Ball Pool Hack ( Version 3.11.1 ) ( 7 february 2018 ) india no1 channel Rutik 8bp,Download mod https://goo.gl/TyYkAd Subscribers for more videos and like this video now Thanks for watching me.,0
2018-02-14T03:29:12.000Z,K9fup1F6N2A,Factorio: Tightening The Belt: Megabase Guide EP18 - LOGISTICS NETWORK | Tutorial Gameplay Series,"This Factorio series is intended to be a guide or walkthrough for newer players as well as experienced players with tips, tricks, How To, and the Why behind ...",0
2018-02-06T12:05:06.000Z,6Eo8CY4fewE,TopShooting Multiplayer games for Android|offline|Special force group 2 HD graphic,Wholesale Fashion Store Grab The Deals https://udupifashion.wooplr.com Download Apk on Playstore If you have any doubts comment below For more earning ...,0
2018-02-14T10:21:22.000Z,GP84SeU55ak,8 ball pool - Boxes hack real 2018/19 unlimited free coins and cash by LORD ROBIN 8bp,Hey guys welcome to my channel.. Like Share Subscribe In this video we have shared about - How to Get 100%Work | Hack 8 Ball Pool Coins And Cash No ...,0
2018-02-10T03:11:31.000Z,cWIKdHJ0aLw,Factorio: Tightening The Belt: Megabase Guide EP14 - ELECTRIC ENGINES | Tutorial Gameplay Series,"This Factorio series is intended to be a guide or walkthrough for newer players as well as experienced players with tips, tricks, How To, and the Why behind ...",0
2018-02-07T18:07:36.000Z,zN_-OnOMhew,New Hack for Knives Out Working 2018!,ஜ۩۞۩ஜ▭▭▭▭▭▭▭▭▭▭▭▭▭ ········· LEIA A DESCRIÇÃO DO VÍDEO ········· ▭▭▭▭▭▭▭▭▭...,0
2018-02-08T00:47:11.000Z,323uqLuSCow,Snowboard Party: Aspen Trailer - Video Game Available Now on iOS & Android Devices,"Download the game for free now on iOS and Android devices. Download Link: http://smarturl.it/snowaspen?IQid=youtube Snowboard Party is back, and this time ...",0
3,2018-02-05T08:21:03.000Z,ukmG5iv9Z0o,Free Gift For all aliexpresusers|Limited offer|Grab Now,SORRY THE OFFER IS EXPIRED* Wholesale Fashion Store Grab The Deals https://udupifashion.wooplr.com *Sorry for the video quality network problem* ...,0
2018-02-06T03:28:03.000Z,8PCn0_ibspk,Mafia III Rivals 1 0 0 226798 Apk Data for Android,"He Youtube channel hi lo Like,Share And Subscribe ve dawn nia APK http://s3.rexdl.com/android/game/Mafia-III-Rivals-v1.0.0.226798-www.ReXdl.com.apk ...",0
2018-02-04T22:30:51.000Z,4PoAv0m7gos,The Drill: Zombies Custom Map (Call of Duty Black Ops 3 Walkthrough and Funny Moments),Easter Egg Steps: 1. Find all three power cores (Turns on power) 2. Fill all three soul boxes 3. Grab all three fuses 4. Activate elevator lift 5. Pick up suit and ...,0
2018-02-12T12:48:55.000Z,lSib5BGlQOU,Bowmasters MANCAT (BATMAN) - TOURNAMENT Gameplay Walkthrough (IOS | ANDROID),Bowmasters Turkey Girl & Shark the Sea Princess & Lil Dump (Jeremy) & Thor the Thundergod & Dart Gorsky & Robin the Quickshooter & Arnold the ...,0
2018-02-13T03:24:05.000Z,EoSIaY_cofM,Factorio: Tightening The Belt: Megabase Guide EP17 - PROCESSING UNITS | Tutorial Gameplay Series,"This Factorio series is intended to be a guide or walkthrough for newer players as well as experienced players with tips, tricks, How To, and the Why behind ...",0
2018-02-04T16:24:36.000Z,J0g75Qk1glY,8 Ball PoolAll Victory Boxes Cue Open Trick No Cheat/Hack,8 Ball Pool 3.11.1 Mod Link..... http://www26.zippyshare.com/v/xq2oCfca/file.html If You Find My Video Useful Then Don't Forget To SUBSCRIBE My Channel By ...,0
2018-02-02T18:42:41.000Z,ujMeXHQ5JqA,Fallout 4 Episoed 1 Going Home!,Ok i streamed on xbox for this.,0
2018-02-02T21:04:16.000Z,AY14617JDJA,Fallout 4 Live Play through #4 The Glowing Sea/ Hunter/Hunted,Just a friendly gamer who enjoys playing games.,0
