,published_at,video_id,title,description,relevance
0,2018-04-23T18:33:12.000Z,EzT4nQQiP-A,FREE DOWNLOAD BLUETOOTH AUTO CONNECT | APK DOWNLOAD ,"Hay sobb, kali ini saya akan membagikan aplikasi.... Silahkan yang mau comot langsung sob, gratis kok......",0
1,2018-04-26T13:49:50.000Z,InWCU4P2VWA,Talking Tom Gold Run New Update (ASTRONAUT TOM)Tom In Two New Maps*Gameplay Make For Kid #261,"Hi, All visitors If you enjoyed this video please help to : Comment, Like, Favorite, Subscribe and Share as one of you done it really helps me :) ! You've been ...",0
2,2018-04-19T01:15:03.000Z,20w-XwbREzo,TALKING TOM CAMP Gameplay Part 13 - Treehouse Level 6 Base Defense (iOS Android),CAMP Gameplay Part 13 - Treehouse Level 6 Base Defense (iOS Android) Discord - https://discord.gg/YKHKJQK Twitter - https://twitter.com/MobileGameDaily ...,0
3,2018-04-22T10:54:44.000Z,yWd40E4cLVU,Free 8 Ball Fanatic Cue Trick Working Again !!,"Hi guys, It's me Henri and today's video is how to get 8 ball fanatic cue. I also want to say thanks to Mohammad who recorded this video. He's a true 8 - baller.",0
4,2018-04-21T02:39:19.000Z,5d7xQae2Q6o,How To Download Music From SoundCloud FREE.,"This is the most easy and effective procedure to follow lifetime. Go kill the waves!   Give this video a ""LIKE"" and comment down below :) also Subscriber if you ...",0
5,2018-04-20T04:18:17.000Z,nbh_8Gggqd0,How Do I Fix Show Box?,"Showbox is not working, keeps freezing, how to fix it? . I will try and go through on this post the most common reasons why showbox can have problems 9 jan ...",0
6,2018-04-27T07:14:04.000Z,6EJeLnu4Q14,CHIPMUNK CHASED BY INK DEMONS!!! | Alvin Plays Bendy And The Ink Machine Chapter 2 | Part 1,As Alvin enters chapter 2 of Bendy and the ink machine he soon finds out there are plenty of more evil monsters around. Thankfullt he's equipped with an axe.,0
7,2018-04-22T16:40:31.000Z,Vh1LEpnkAsk,8 ball pool new coin trick with pc 100% working 2018,Read description @@@@@@@@@@@@@@@@@@@@@@ (All song used from NCSC no copy right sounds) ...,0
8,2018-04-30T16:02:04.000Z,CYH50aZbJ-M,How to hack Amazon with simple trick,"Hii guys How to hack Amazon with simple trick you must watch Technology , Smartphone Reviews , Unboxing Gadgets , Electronics , Gadget Reviews, Tech ...",0
9,2018-04-26T11:32:11.000Z,hgfrgzaH86o,Moyer (Barrel) - Bowmasters - FAST TOURNAMENT - Gameplay Walkthrough (147),Bowmasters - Moyer (Barrel) Bowmasters - https://itunes.apple.com/us/app/bowmasters-top-multiplayer/id1118431695?mt=8 We're happy to announce the ...,0
10,2018-04-22T10:02:24.000Z,1vmX6bAcFyw,Appnana hack this it work or not (Read the description below for more info),Hey guys as you can see in the video i was checking a hack for appnana if it worked or not 1) Copy this but make sure to replace the 10450 with the amount you ...,0
11,2018-04-22T04:11:11.000Z,yQuhVYodwRU,"Brawl Box Record Stream in Brawl Stars with Chi- 3,000 Brawl Boxes!","What is up guys it is Chi, and Welcome to my Mobile Gaming Channel! Link to my Discord Server is https://discord.gg/wPVEt6n My Discord User Name is ...",0
12,2018-04-24T03:38:41.000Z,yoqWr65m_zs,8 Ball Pool Free Coins Links | Miniclip Gifts Reward Links | Scratchers | Spins | Reward Links |208,8 Ball Pool Free Coins Rewards Links 8 Ball Pool Coins Links 8 Ball Pool Scratchers Links 8 Ball Pool Spins Links All Links Are Here Friends ...,0
13,2018-04-25T11:00:04.000Z,k33B5zpyjLo,Friday the 13th The Game - Part 7 Jason Gameplay - Your not leaving me!,1st kill: 2:18 [Adam Palomino] 2nd kill: 3:05 [Tiffany Cox] 3rd kill: 5:37 [Vanessa Jones] 4th kill: 5:53[Tiffany Cox] 5th Kill: 6:50 [Vanessa Jones] 6th Kill: 7:28 ...,0
14,2018-04-26T05:02:35.000Z,q2AiD0WBtz0,TEXAS HOLDEM POKER GAME HACK - TEXAS HOLDEM POKER CHEATS 2018,How to Hack Texas Holdem Poker Pokerist? We promise you that you can get free chips and gold instantly using our Texas Holdem Poker Pokerist hack.,0
15,2018-04-28T18:43:05.000Z,2LfHffMWFcQ,"DragonSoul Gameplay Walkthrough Part #9 (Android,iOS,APK)","DragonSoul Gameplay Walkthrough Part #9 (Android,iOS,APK) DragonSoul Playlist ...",0
16,2018-04-27T16:30:01.000Z,YiRKfnpKP_I,Guns of Boom Hack 2018 | Get Unlimited Gold For Android/iOS New 2018,"Guns of Boom Hack 2018 | Get Unlimited Gold For Android/iOS New 2018 New method for Guns Of Boom hack is now released, this Guns Of Boom Hack ...",0
17,2018-04-26T05:59:01.000Z,beJovD_1JwM,CITY MANIA HACK GAME GUARDIAN - CITY MANIA CHEAT CODES,"How to Hack City mania? We promise you that you can get free cash and coins instantly using our City mania hack. There is no need to do a complicated thing, ...",0
18,2018-04-30T12:13:44.000Z,3NTZ7ldpQ3Y,"DragonSoul Gameplay Walkthrough Part #10 (Android,iOS,APK)","DragonSoul Gameplay Walkthrough Part #10 (Android,iOS,APK) DragonSoul Playlist ...",0
19,2018-04-20T09:59:10.000Z,Zi-psT9YJnM,8 Ball Pool Free [ Diamond Cue ] Reward New Link,STEP.1 One APPS DOWNLOAD for this link & Sing Up New Account STEP.2 LINK = http://i.kapow.games/9mPoGPRp STEP.3 Download Apps And OPEN APPS ...,0
20,2018-05-02T10:32:14.000Z,Da9vmHsPWao,8 Ball Pool Free [ Pool Fantastic Cue ] New Free Reward Link Collect Fast,STEP.1 One APPS DOWNLOAD for this link & Sing Up New Account STEP.2 LINK = http://i.kapow.games/UrFHqgqn STEP.3 Download Apps And OPEN APPS ...,0
21,2018-04-25T19:11:00.000Z,M4K7hB7fjBY,"DragonSoul Gameplay Walkthrough Part #6 (Android,iOS)","DragonSoul Gameplay Walkthrough Part #6 (Android,iOS) DragonSoul Playlist ...",0
22,2018-04-28T21:10:12.000Z,k53rzt1RxlA,How To Get Free Gems in Golf Clash - Golf Clash Hack - Golf Clash Free Gems 2018,"Learn how to get Golf Clash Free Gems with our Golf Clash Hack that works in 2018 for PC, Xbox, Android, Mac and iOS. This is the best way to get Golf Clash ...",0
23,2018-04-19T23:00:02.000Z,laO9JgU1BjU,God of War: How Combat Works on the Hardest Difficulty - IGN Plays Live,"God of War's hardest difficulty is no joke. Watch as we attempt a series of challenges to show off the early combat segments of God of War's ""Give Me God of War ...",0
24,2018-04-28T18:00:01.000Z,JKm81GTtkH8,GRANDPA (Mobile Horror Game),DENIS MERCH!! -- http://denisdaily.com ▻ SUBSCRIBE to SIR MEOWS A LOT!! -- https://goo.gl/LjyjDR ▻ Twitter -- http://twitter.com/DenisDailyYT ▻ Instagram ...,0
25,2018-04-25T19:00:21.000Z,hsKodOwyr-0,10 Worst Fortnite RIP-OFF Video Games Ever Made,10 Worst Fortnite RIP-OFF Video Games Ever Made Watch More FORTNITE Here: https://goo.gl/3xQZmq Tweet me if you use my code! G2A.COM Cash Back w/ ...,0
26,2018-05-02T14:40:59.000Z,xlBKbKG1yQQ,Harry Potter Hogwarts Mystery Hack - Get Thousands of Gems!,What's up guys! In today's tutorial you gonna see how to hack Harry Potter Hogwarts Mystery mobile game by adding thousands of Coins and Gems to my ...,0
27,2018-04-30T17:01:16.000Z,2R39Gncxl8Q,VIRTUAL REALITY FOOT TRIES TO FLATTEN MY HOUSE!!!,Subscribe and join TeamTDM! :: http://bit.ly/TxtGm8 ▻ Follow Me on Twitter :: http://www.twitter.com/dantdm ▻ Previous Video :: https://youtu.be/1Yg63HLpWeY ...,0
28,2018-04-25T14:26:16.000Z,WRNOWNHt28o,God Of War Infinite XP/HS 9999999 - PS4 Cheats 5.55- + Download (2018),DOWNLOAD: https://www.xhardhempus.com/ps4-exploit-555.html.,0
29,2018-04-23T20:19:42.000Z,X5iZTXAg8vs,Best macOS Preview App Features,"In this video, we're going to go over some of the best features that the macOS Preview app has to offer. Read More ...",0
30,2018-04-22T14:29:03.000Z,ccSEMJgnem8,HUGE UPDATE CONAN IS BACK | Conan Exiles | Let's Play Gameplay | S02E01,"There have been HUGE updates and the game is coming out of early access soon, so let's get back to Conan Exiles - Conan Exiles Gameplay ...",0
31,2018-04-25T21:49:10.000Z,y9TrPrBA4-o,Useful Siri Commands for macOS,"In this video, we go over some useful Siri commands for your Mac. Read more - https://www.macrumors.com/guide/most-useful-siri-commands-on-macos.",0
32,2018-04-18T00:10:57.000Z,Gb5_mU5iWUg,"Executive Committee - April 17, 2018 - Part 2 of 2","Executive Committee, meeting 33, April 17, 2018 - Part 2 of 2 Agenda and background materials: ...",0
33,2018-04-18T18:39:03.000Z,DoxjmRRWxV0,Choices:- Perfect Match Chapter #9 (Diamonds used),"HUGE SPOILER ALERT!!! The Thumbnail doesn't reveal anything, if you don't wanna get spoiled you can play the chapter and then return here to watch the ...",0
34,2018-04-23T08:29:52.000Z,yaACGWMyinM,Mega Ramp Impossible Stunts 3D (by Redcorner Games) Android Gameplay [HD],Latest and Craziest Mega Ramp Impossible Stunts 3D Game taking impossible ride on impossible mega ramp. Grab your favorite vehicle and start your car ...,0
35,2018-04-24T04:47:52.000Z,WZo1nVWrCI4,PIzzaBreak | GIVEAWAY WEEK! | Come Chat! | !sr for Song Request | !Givaway | ( ▀ ͜͞ʖ▀),"Kick back and have a PizzaBreak! My name is Gage, and this is my YouTube Channel, here I upload a variety of content. My drive is to provide good quality ...",0
36,2018-04-30T01:52:32.000Z,9S4r3IShkzU,HSN | Designer Gallery with Colleen Lopez Jewelry 04.29.2018 - 07 PM,Our show host (Colleen Lopez) has hand picked a unique collection of all her favorite jewelry items. Prices shown on the previously recorded video may not ...,0
37,2018-04-22T21:20:31.000Z,MByi-HLgjdk,Neat Home Office Software with Desktop Scanner and Filin...,For More Info or to Buy Now: http://www.hsn.com/products/seo/8704994?rdr=1&sourceid=youtube&cm_mmc=Social-_-Youtube-_-ProductVideo-_-612715 Neat ...,0
38,2018-04-26T18:51:26.000Z,zSJ6dUayHyo,HSN | LYSSE Fashions 04.26.2018 - 12 PM,"Discover the perfect combination of transitional and classic must have fashion including activewear. The assortment includes tops, bottoms, and toppers and are ...",0
39,2018-04-24T17:21:43.000Z,N1JMWH8mMZ4,"[WOW]  NEW ROBLOX EXPLOIT - KRANBERRY  ADMIN COMMANDS, w/BTOOLS, KEYCARD & TELEPORTS!  [WORKS]!!",Thank You So Much 20000 Subscribers!!! Join Our Biggest Giveaway Ever: [ https://gleam.io/competitions/9mTi3--... ] [JOIN OUR ROBLOX GROUP FOR FREE ...,0
40,2018-04-18T01:52:11.000Z,NvBWXqSDzWM,HSN | Healthy You with Brett Chukerman 04.17.2018 - 07 PM,"Shop Healthy You on HSN.com https://goo.gl/mHjJfH. Discover the best ways to live happy and healthy with top innovations, expert tips, and more.Prices shown ...",0
41,2018-04-19T06:03:36.000Z,BIGcSWEb9KA,8 Ball Pool Free 7500 Coins Links | 8 Ball Pool Coins link 2018,8 Ball Pool Free 7500 Coins Reward Links Click on the link below to get coins First SUBSCRIBE My Channel and Hit The Like Button. Join My Whatsapp Group ...,0
42,2018-04-18T14:11:50.000Z,VlDufQ2Tdvo,Fishing Strike Hack | FishingStrike by Netmarble | Top Game on IOS & Android,Netmarble has ambitiously created a Next Generation Fishing Game! But before that subscribe our channel Digital Toys Studio for all latest games update.,0
43,2018-04-21T14:22:07.000Z,rgOkSZ_lNaU,SIX network | Grand Opening Event,"27 March 2018 at Grand Hyatt Erawan Bangkok, Thailand Know us more: Website: https://six.network Getting to know us: https://bit.ly/2qUozlF Facebook: ...",0
44,2018-05-02T04:50:52.000Z,TC4HXn_30oc,ARCHERY KING HACK MOD - ARCHERY KING CHEATS IOS,How to Hack Archery king? We promise you that you can get free cash and coins instantly using our Archery king hack. There is no need to do a complicated ...,0
45,2018-04-26T05:07:46.000Z,iAyaEkb5SFs,BATTLE BAY HACK MOD APK DOWNLOAD - BATTLE BAY CHEATS 2018,"How to Hack Battle bay? We promise you that you can get free pearls, gold and sugar instantly using our Battle bay hack. There is no need to do a complicated ...",0
46,2018-04-26T16:44:18.000Z,Tn7u8KYIvUs,ARCHERY KING HACK MOD APK DOWNLOAD - ARCHERY KING CHEATS IOS,How to Hack Archery king? We promise you that you can get free cash and coins instantly using our Archery king hack. There is no need to do a complicated ...,0
47,2018-04-15T11:52:41.000Z,uB8C50IcLyc,How To Get Hacked/Modded Apps And Games No Root On All Android Devices 2018 New method (must watch),How To Download Modded Games Directly On Your Android 2018 You don't need to download any other app to hack into games/apps because I'm gonna show ...,0
0,2018-04-06T10:22:51.000Z,uJjf-Q8r0Gw,Choices Stories You Play - Grab Unlimited Diamonds and Keys (Android/iOS) Choices Stories You Play,Choices Stories You Play - Grab Unlimited Diamonds and Keys (Android/iOS) Choices Stories You Play Hello. Today I would like to show you a new version of ...,0
1,2018-04-09T11:46:20.000Z,ajpkMa_3CgQ,Wartide Heroes of Atlantis Hack - Grab Unlimited Gems in Wartide (iOS/Android) Wartide Hack,Wartide Heroes of Atlantis Hack - Grab Unlimited Gems in Wartide (iOS/Android) Wartide Hack Hi. Today I would like to present you a new version of Wartide ...,0
2,2018-04-06T11:55:12.000Z,QuJGgTjYz60,Futurama Worlds of Tomorrow Hack - How to Grab Unlimited Nixonbucks (iOS/Android) Futurama Hack,Futurama Worlds of Tomorrow Hack - How to Grab Unlimited Nixonbucks (iOS/Android) Futurama Hack Hello. Today I would like to show you a new Futurama ...,0
3,2018-04-16T14:49:01.000Z,s5X6_OSLsWw,Dead Rivals Hack - Grab Unlimited Coins and Gems in Dead Rivals (iOS/Android) Dead Rivals Hack,Dead Rivals Hack - Grab Unlimited Coins and Gems in Dead Rivals (iOS/Android) Dead Rivals Hack Hello. Today I want to show you a new version of Dead ...,0
4,2018-04-06T13:03:40.000Z,94GO59OeY3o,Faily Tumbler Hack - How to Grab Unlimited Coins in Faily Tumbler (iOS/Android) Faily Tumbler Hack,Faily Tumbler Hack - How to Grab Unlimited Coins in Faily Tumbler (iOS/Android) Faily Tumbler Hack Hello. Today I want to show you an updated version of ...,0
5,2018-04-06T11:52:08.000Z,QB3RDQW7e-E,Angry Birds Match - How to Grab Unlimited Diamonds and Gold (Android and iOS) Angry Birds Match Hack,Angry Birds Match - How to Grab Unlimited Diamonds and Gold (Android and iOS) Angry Birds Match Hack Hello. Today I would like to show you a new Angry ...,0
6,2018-04-12T11:22:49.000Z,AMqqJA4JOgg,"MOD MENU INDEPENDENCE V3.3 SPRX CRACKED | [IP GRABBER, GIVE RP, PROTECTIONS ] + DOWNLOAD FREE",here mode menu https://www.mediafire.com/file/2os914vsa8jf9g6/independence+V3.3.rar semjases http://www.mediafire.com/file/wtqwnus... MODE MENU ...,0
7,2018-04-05T17:45:22.000Z,hrS5ITsFZmk,[ENDED]Crusader Kings 2 is free right now! Grab it quickly!,"http://store.steampowered.com/app/203770/Crusader_Kings_II/ If you want to support me: Get Kerbal Space Program, Dead Rising 4, and Ruiner for $12 on ...",0
8,2018-04-09T10:44:05.000Z,gwRS6JKUk1w,"Agario Hack - Grab Unlimited Coins, Mass Boost, XP Boost and Invisibility  (iOS/Android) Agario Hack","Agario Hack - Grab Unlimited Coins, Mass Boost, XP Boost and Invisibility (iOS/Android) Agario Hack Hi Everyone. I want to show you an updated version of ...",0
9,2018-04-16T14:48:28.000Z,g9Zh1gZbU4A,Little Odd Galaxy Hack - How to Grab Unlimited Coins (iOS/Android) Little Odd Galaxy Hack,Little Odd Galaxy Hack - How to Grab Unlimited Coins (iOS/Android) Little Odd Galaxy Hack Hello. Today I want to show you a new version of Little Odd Galaxy ...,0
10,2018-04-11T18:33:47.000Z,r-uKQK5zHgw,Pool Fanatic Cue Reward It Hurry Up!Grab Now!,Subscribe This Channel For Next Giveaway.... https://m.youtube.com/channel/UCtXYra8RkaWnrbkI0X9_-5g Plz Who Taken This Account Comment It..,0
11,2018-03-28T09:20:20.000Z,dSbU8CbSCeY,Hack grabcar malaysia all location,Boleh pm number tel dibawah.,1
12,2018-03-30T14:28:22.000Z,9sHChhcXHbM,Mod GrabBike V5.35.4 Terbaru 30-Maret-2018. By Durex Team.,Chat Via Telegram User Name = @X3MHUMAN.,1
13,2018-03-28T14:47:12.000Z,PumWPM6elj4,WD2249A Blasting Horn Road Rage at Platinum Suites KLCC GRAB,GRAB DRIVER BLASTING HORN ROAD RAGE AT KLCC.,1
14,2018-03-24T14:25:33.000Z,sOUcADYzpQ8,JADI GRAB OJEK ONLINE - MOTOVLOG INDONESIA,Vlog kali ini ngebahas pengalaman gue sebagai grab driver. Hmmm ternyata seru juga! Instagram: @BangYopiMotovlog Helm: KBC Glove: Furygan Jacques ...,1
15,2018-03-25T22:00:00.000Z,BuKOqhLwHDM,"""DRIVE BY BED GRAB!"" FOREGOING #2",CURSE LAUNCHER: http://beta.cursevoice.com/ follow me on: Become my patron! https://www.patreon.com/modii101 Get your very own minecraft server at: ...,0
16,2018-03-22T02:55:46.000Z,8l3LczyeCbA,GrabOn-Gigindia App Unlimited Trick-With Proof-By Technical Staff,My Whatsapp Number=9079360843 -------------------------- □https://app.grabon.in/2oVdBefUtL --------------------------- ...,0
17,2018-03-26T17:22:30.000Z,kOu5gtt8B4o,[ENDED] The Darkness 2 is free right now - Grab it quickly!,https://www.humblebundle.com/store/the-darkness-ii?partner=SantiagoSantiago (Affiliate Link) More free stuff atm: Hitman Spring Pack: ...,0
18,2018-03-22T05:22:08.000Z,EADw3YEO-fQ,Grabon App Hack || Unlimited Refer || With Proof.,Grabon App Hack || Unlimited Refer || With Proof. https://app.grabon.in/QpZ05cITtL http://www.bit.ly/GI-app.,0
0,2018-03-16T05:50:02.000Z,SkCNPo69REg,WP Harga PRO WordPress Plugins Auto Grab Market Place to Affiliate & Adsense,WP Harga PRO WordPress Plugins Auto Grab Marketplace to Affiliate & Adsense.,0
1,2018-03-07T00:11:00.000Z,Wt4p8kevAWg,SETING MAP GOJEK/GRAB/UBER,Cara seting map gojek/grab/uber agar tidak jalan muter2 and masuk ke tol.,0
2,2018-03-13T08:22:37.000Z,g7QOKS0OoHk,"How to make GPS not bad || for driver Go-Jek, grab, Uber","Kali ini gua akan bagi pengalaman dan biar GPS kalian tidak kemana"" Like, subscribe , and share video ini Semoga bermanfaat dan salam MOTOJEK STAY ...",1
3,2018-02-18T03:17:06.000Z,uq7HADS6u0Y,"To be/ existing Grab taxi / pte drivers must know, whether Grab deflate your profit?","即将或现成Grab德士或私人司机您必须知道, Grab会削低德士/私人司机的利润吗? To be/ existing Grab taxi / pte drivers must know, whether Grab deflate your ...",1
4,2018-03-02T13:56:12.000Z,Euw2Qro7aGY,XCOM 2 WOTC - Season One - Part 13 - Blast and Grab 101,"Modded LP of XCOM 2 War of the Chosen, highlighting DerBK's A Better Barracks and A Better Advent mods. Find these on the Steam Workshop. Links in ...",0
5,2018-02-28T01:01:59.000Z,W-hNmavrU-o,[Brawl Stars] LIVE! 2v2 Smash & Grab KotH Tournament :: $100 Giveaway!,"ABOUT THE STREAM Welcome to the Live Stream! Below are links to twitch, along with discord, Instagram and Twitter! I do BONUS livestreams everyday ...",0
2018-02-25T03:50:23.000Z,ovd2Z9WCH3w,StOrM3 - Spoofing In Search Of Dratini's & Dragonairs and Dragonites! - Starting @ 2:35PM CST,We Livestream Today @: 2:35PM CST PokemonGO News You Can Use Spoofing In Search of Dratini's & Dragonairs and Dragonites! We Will Be Sniping All ...,0
2018-02-20T03:55:20.000Z,hxy8LLZqSq8,Factorio: Tightening The Belt: Megabase Guide EP22 - BEACONS | Tutorial Gameplay Series,"This Factorio series is intended to be a guide or walkthrough for newer players as well as experienced players with tips, tricks, How To, and the Why behind ...",0
2018-02-27T03:42:01.000Z,agNhfAOIoQA,Factorio: Tightening The Belt: Megabase Guide EP28 - ASSEMBLER 3 | Tutorial Gameplay Series,"This Factorio series is intended to be a guide or walkthrough for newer players as well as experienced players with tips, tricks, How To, and the Why behind ...",0
2018-02-27T12:14:36.000Z,LhonuxxwGyU,RD Burman's original musicians in conversation with OTV in Bhubaneswar,OdishaTV is Odisha's no 1 News Channel. OTV being the first private satellite TV channel in Odisha carries the onus of charting a course that behoves its ...,0
2018-02-23T23:00:00.000Z,7zlnWxHAERs,10 AWESOME Tips For Kingdom Come: Deliverance (That I Wish I Knew Before I Started!),Kingdom Come: Deliverance Part 1 - Kingdom Come: Deliverance Gameplay First Look Let's Play Playthrough ------- SAVE GAME MOD ...,0
2018-02-28T16:07:26.000Z,ruotJKEsttU,Peak Rider Snowboarding - Ultra Graphics iPhone X Gameplay,"FEARLESSLY OWN THE SLOPES WITH DARING TRICKS, BIG AIR, AND RAD COMBOS Welcome to one of the most remote mountains in the world, Peak ...",0
2018-02-22T21:00:04.000Z,xFiBTgSyem8,Mount and Blade - Let's Play Kingdom Come: Deliverance Part 10,Alright i have been following this Kingdom Come: Delivernace since its kickstarter. Didn't back it back then but kept my eye on it due to the gameplay fighting ...,0
2018-02-20T08:11:35.000Z,5JKOgJ03IJo,8 ball pool live stream,hello dosto first subscribed my channel second comments your you tube name third challenge me and play 8 ball pool Note:-its not a giveway 1:-subscribe my ...,0
2018-02-27T00:56:02.000Z,D3_g67wOJE8,"Kingdom Come Deliverance - Part 7 [Gameplay, PC]","My playthrough of Kingdom Come: Deliverance on PC. Gameplay at 1080p, 60 FPS, high settings, without commentary. Part 7 Game: You're Henry, the son of a ...",0
2018-03-01T17:17:48.000Z,fO5iMmZ5I5o,All Guns Blazing || Android Gameplay|| Best Guns,"Pull the trigger on All Guns Blazing! Crime isn't a game, it's a way of life - so grab the all new social 3D crime shooter that will blow you away! Climb the criminal ...",0
2018-02-21T11:04:48.000Z,Dex4XCpDJdo,"8 Ball Poll New Legendary 2018,Fresh!! No:1 -MOD- | 8 Ball Pool 'MOD' | By Sahar Tv",8 Ball Pool User & Lover In This Vedio I Well Brought A New Idia . How To Use Legendary Cue On Free In 2018 Free Method . Downloading Method 1) Click ...,0
2018-02-21T19:00:01.000Z,Qx2JzR33L2U,GRANNY ADDED MORE TO HER HOUSE! | Granny Mobile Horror Game Update Gameplay,GRANNY ADDED MORE TO HER HOUSE! | Granny Mobile Horror Game Update Gameplay | Kindly Keyin Subscribe to Me! http://kindlykeyin.com/Subscribe ...,0
2018-02-22T18:03:31.000Z,H8ys7xZyPxM,ESCAPING CLOWN PRISON!!!,Subscribe and join TeamTDM! :: http://bit.ly/TxtGm8 ▻ Follow Me on Twitter :: http://www.twitter.com/dantdm ▻ Previous Video :: https://youtu.be/bAxTBTjqKkk ...,0
2018-03-02T23:00:01.000Z,6E9M6XnCfQA,Battlezone Combat Commander Gameplay - Smash Look!,"Battlezone: Combat Commander remasters FPS-RTS classic Battlezone II with slick new visuals, brand new achievements, Steam Workshop support and much ...",0
2018-02-17T00:00:00.000Z,ScoUgmJS1us,Minecraft Daycare - KISSING TINA !? (Minecraft Roleplay),Minecraft Daycare - VALENTINES DAY !? (Minecraft Roleplay) (Minecraft Roleplay) Proper Life: https://www.youtube.com/watch?v=cInoZ7_4YK4 TINA'S ...,0
2018-03-01T17:20:01.000Z,woN3fu5T1yk,Crazy Kitchen Seafood Restaurant Chef Cooking Game - Android Game Play,Download Now: https://play.google.com/store/apps/details?id=com.ids.crazykitchen.seafood.chef.cooking.game Have you ever experienced crazy cooking food ...,0
2018-03-01T17:27:40.000Z,IgMqbkGmlBI,The BEST Gimbal Settings Mavic Air ️,The secret behind great looking footage is to keep the movement smooth and avoid rapid movements. I will show you the best gimbal settings Mavic Air for to ...,0
2018-02-22T19:02:00.000Z,jiOwdBuAczw,Is it time to start 360 FILMMAKING? Meet RYLO,Rylo 360 Camera: http://amzn.to/2EMG3du All my camera gear: https://kit.com/JevenDovey    Watch our Travel Vlogs: http://bit.ly/2i8ne7X  My Climbing ...,0
2018-02-28T05:20:05.000Z,prM2mSz3qxk,Hustle Castle - Top 3 pro tips to amazing resource production! | Quick Tutor series | Book 5 Chp 41,"Hustle Castle Top Pro Tips is back! Resource production is the KEY to survival, growth and success in Hustle Castle. Learn how you can surpass all your peers.",0
2018-02-20T15:01:22.000Z,EeRPFlHqbDk,HIIT Smoothie Challenge 2: Kaisafit Challenge & Berry Brain Blast Smoothie,"In honor of heart health month, we're getting active for 15 minutes and enjoying a heart-healthy smoothie. Each workout is a challenge from someone I admire ...",0
2018-03-02T03:52:20.000Z,V7PC8J9_7kI,How to use PRO MODE | Huawei Honor 9 Lite Tutorial,How you can capture great images if you use Pro/Manual mode on any smartphone ? In this tutorial video I have explained all the settings that you need to know ...,0
2018-02-24T20:00:05.000Z,h5BkKakbiIc,7 Things Metal Gear Survive Doesn't Tell You,IGN shows you some tips for both the start of your trans-dimensional Metal Gear adventure and some tricks you'll keep using after a dozen hours. Metal Gear ...,0
2018-02-24T12:58:42.000Z,2oGG7JDmcFQ,Zee5 Video Download Step by step process #only for education purpose,This video is about How to download Zee5 videos. This video is only for education purpose. If you have any complain or anything about copyright issue please ...,0
2018-03-02T04:07:57.000Z,_jP8YWGZOHU,Happy Cafe hack tool - Cheats Free Gems & Coins - Happy Cafe -- New 2018,FASTEST WAY TO GET UNLIMITED GEMS - HAPPY CAFE - NO APP DOWNLOAD! Click Our Link: http://1b.yt/enJuR.,0
2018-02-27T12:00:00.000Z,6K5iUXk8Sj0,STREAM Guns Royale UMUSTPLAY,Guns Royale - Multiplayer Blocky Battle Royale by Wizard Games Incorporated: ------------------------------ ДОНАТ / DONATION: ...,0
2018-02-20T10:01:08.000Z,CH7BB0pnfBs,Talking Tom Gold Run Fullscreen^FireMan Tom One Save Me*Gameplay Make For Kid #254,"Hi, All visitors If you enjoyed this video please help to : Comment, Like, Favorite, Subscribe and Share as one of you done it really helps me :) ! You've been ...",0
2018-02-26T20:15:53.000Z,rLCaVbOtivk,Talking Tom Camp download in Android [Gameplay][No Root],"Hello Friends welcome to my gaming channel.   I upload a Gameplay, Game trailer, Game hack....etc.Subscribe my channel.   Name:-Aryan Patel ...",0
2018-02-19T09:14:13.000Z,US7q249y6f4,Talking Tom Gold Run^KUNG FU HANK*Colors Animation*Gameplay Make For Kid #253,"Hi, All visitors If you enjoyed this video please help to : Comment, Like, Favorite, Subscribe and Share as one of you done it really helps me :) ! You've been ...",0
2018-02-21T03:59:19.000Z,XPMt6iL-9_4,HSN | Healthy You with Brett Chukerman 02.20.2018 - 08 PM,"Shop Healthy You on HSN.com https://goo.gl/mHjJfH. Discover the best ways to live happy and healthy with top innovations, expert tips, and more.Prices shown ...",0
2018-03-02T23:30:02.000Z,qzy_s8Vhfw8,Talking Tom Pool Android Gameplay #13 Talking Tom Games Android/IOS Gameplay Youtube Kids,Talking Tom Pool Android Gameplay #13 Talking Tom Games Android/IOS Gameplay Youtube Kids      https://goo.gl/trngN2 - SUBSCRIBE YOUTUBE Kids ...,0
