,published_at,video_id,title,description,relevance
2018-02-08T05:05:34.000Z,-2FK0f-8A4k,ultimate ninja blazing hack lucky patcher - ultimate ninja blazing cheats app,ultimate ninja blazing hacks off - ultimate ninja blazing cheats for iphone.,0
2018-02-09T13:29:10.000Z,AvabrTuNWc4,8 Ball Pool 50 million 8 Pool Free Coins 2018,8 Ball Pool 50 million 8 Pool Free Coins 2018 Follow the simple steps to get 50m coins and cash 1) Like this video 2) Share this video to social media like ...,0
2018-02-02T19:57:33.000Z,jNBC7Iw5U5w,Puma Family Sim Online Android Gameplay HD,"Live the life of a Wild Puma in fantasy forest, raise a big cat family, take care of your cubs in Puma Family Sim Online. Play RPG Adventure game in a massive 3d ...",0
2018-02-05T16:35:40.000Z,ExGduE6Rw_M,BRAWL STARS LIVESTREAM with Ark - Trophy Pushing - The Road to 5500 Trophies!,Donate to the stream! - https://streamlabs.com/hairybrawls Subscribe to Ark - https://goo.gl/WJ5a4Q Follow me on Twitter - @Ark_YouTube We're LIVE guys! for ...,0
2018-02-03T06:26:04.000Z,dR9qCU1ChBo,"Get free King Cue + Dynamo Cue with Unlimited Aim,Force,Spin,Time",About Video:how to get free King Cue in 8bp|free Dynamo Cue in 8bp|get free king cue in 8bp TRICK -: Subscribe to my Another channel ...,0
2018-02-12T15:04:41.000Z,pKpthZYeyLA,LE MODE MENU LE PLUS DANGEREUX DE BO2,MODE MENU DESTINY:http://www.frenchmoddingteam.com/shop/application/37-bo2-destiny-ccapi-dex-cex GUI GLITCHER -------------- YOUTUBE ...,0
2018-02-14T05:32:16.000Z,rHJllJHW6Bw,Moshow App || Best Video editing Application For android like a pro Free,"MoShow instantly turns your photos into fun, attention-grabbing videos perfect for social media. From a single selfie to a week of pics, add your favorite photos ...",0
2018-02-04T09:41:52.000Z,wM8JjATHm8w,Bowmasters - LOL Vein (a gold chain) VS ALL NEW CHARACTERS - Gameplay Walkthrough,Bowmasters - LOL Vein (a gold chain) Bowmasters - https://itunes.apple.com/us/app/bowmasters-top-multiplayer/id1118431695?mt=8 We're happy to announce ...,0
2018-02-11T18:13:58.000Z,w8FO0AfBs58,Fishdom Hack 2018 | Unlimited Diamonds and Coins *iOS & Android*,Hey guys! I will show you a new method for amazing Fishdom Hack 2018! With this Fishdom cheats 2018 you will be receiveing Fishdom Free Diamonds and ...,0
2018-02-02T14:00:36.000Z,eRq3dAcx2lU,Arnold the Unstoppable - Bowmasters - TOURNAMENT NORMAL Walkthrough NEW Character,Bowmasters Turkey Girl & Shark the Sea Princess & Lil Dump (Jeremy) & Thor the Thundergod & Dart Gorsky & Robin the Quickshooter & Arnold the ...,0
2018-02-12T14:03:35.000Z,q8KeOxxg2n8,"8 Ball Pool "" How To Get Legendary Plasma Cue Reward Check it...",Subscribe My Channel https://m.youtube.com/channel/UCMZK97kLzJtH1U_wbPv5B7w You Like My Channel-? And Would Like To Support Me !,0
2018-02-10T01:50:02.000Z,3nIaIghilmM,Blast Squad Android iOS Gameplay (By Chiseled Games Limited),"Blast Squad By Chiseled Games Limited Gameplay First Look. (Android/iOS/iPhone/iPad) ▻SHARE, LIKE, SUBSCRIBE! http://bit.ly/oglgameplays ◅ Join a ...",0
2018-02-14T10:23:17.000Z,cM_7cZXxEIM,Angry Bird Star War - Unlock All Levels Hack Unlimited Gems Part 1,Plans vs Zombies: https://goo.gl/sZCcBL Bad Piggies: https: http://goo.gl/XxcVT2 Angry Bird Star War: http://goo.gl/pWo53n Anger of Stick 5: http://goo.gl/kmq92w ...,0
2018-02-12T18:54:01.000Z,xfNFNs93NxI,How To Get Safe Key And Weapon Key In Granny,I don't know did you get it or not bros.I am trying to say yo that this game granny has 4 types of room or mode whatever you say it.You can find master key ...,0
2018-02-03T09:34:25.000Z,ngUjDp24b6U,8 Ball Pool - Level 37 With Legendary Cue 1 Billion Winning Finally {No Cheats} Latest 2018,ஜ۩۞۩ஜ▭▭▭▭▭▭▭▭▭▭▭▭ ·▭········ Open This Description ········· ▭▭▭▭▭▭▭▭...,0
2018-02-05T16:30:31.000Z,94DqOy0Sq_0,FREE SKINS LEAGUE OF LEGENDS (WORKING 2018),Dont forget read the discription Only you can see the skin! its a mod (you cannot be banned) LEAVE A LIKE! Subscribe if you like my videos Comment if you ...,0
2018-02-10T22:07:02.000Z,fdx85zRwyeY,Australian hungry jacks free voucher,Just show this to to the counter person and u will get a free coke. Disclaimer this may not work.,0
2018-02-12T06:28:47.000Z,lRv7vWHOkTA,Salt: Survival On The High Seas - Pirates - Ships - Sailing - Crafting - Fishing (PC),"Rev introduces you to Salt. A brand new game just out of Early Access on Steam. Rev shows how to sail a ship, fish, and how to take on various types of pirates ...",0
2018-02-06T19:50:38.000Z,dNbxdC9ItUA,flutter butterfly cheats working 2018,10 Gaming Hacks Each Gamer Ought to Know Most Android In app purchase hacks require root but right this moment I'll show you the right way to hack in-app ...,0
2018-02-16T14:31:05.000Z,aLf3lPbCWm8,Olympus Rising Hack in Windows Phone 100% unlimited Gems,Olympus Rising Hack - Free Gems and Gold Cheats (LIVE PROOF),0
2018-02-14T10:58:47.000Z,VK1RDoO7BPk,KINGDOM COME: DELIVERANCE (HUNTING) - OPEN WORLD RPG -  LIVESTREAM (PC),Support the stream: https://streamlabs.com/startthegameforus Buy KINGDOM COME: DELIVERANCE NOW ...,0
2018-02-08T03:13:11.000Z,uhpIE9Pzjeg,8 Ball Pool 650M Coins Account For Sell | With Cues |,Contact Number..... +917273945464 HI YouTube :) Welcome to My Channel. Subscribe my channel for more fun 8 Ball Pool video And Enjoyed.. If You Find My ...,0
2018-02-04T16:14:57.000Z,UpzPsPXJIwk,Brawl Stars APK Download- Brawl Stars APK Android WORKING,Get it here now if u want be lucky : https://goo.gl/oohTcZ Brawl Stars APK Download- Brawl Stars APK Android WORKING Brawl Stars APK Download- Brawl ...,0
2018-02-03T01:21:43.000Z,hujcbL4ZVS0,PHANTOM FORCES AIMBOT HACK [NOT PATCHED] UPDATED WORKING,"Download: https://www.sendspace.com/file/k3chd2 Tags: roblox hacker, roblox hack ad, roblox hack download, roblox hack android, roblox hack apk, roblox ...",0
2018-02-09T20:02:51.000Z,PzTcQsTm_Co,BERLIN LIVE #8BP GAMEPLAY,Watch me play 8 Ball Pool!,0
2018-02-06T20:40:57.000Z,iKcS-VBe_ZY,bingo blitz credits cheats working 2018,"The Finest Video Game Hacks You By no means Discovered Welcome to the bingo blitz credits - Multiplayer Game Hacks and Cheats. Welcome to , the premier ...",0
2018-02-03T06:15:42.000Z,KTUNvsvy-MU,Bubble Island 2 Level 32 HD 1080p,Download: https://play.google.com/store/apps/details?id=net.wooga.bubbleisland2 Facebook Join Us: https://www.facebook.com/AndroidGameForFun Blogger: ...,0
2018-02-12T15:11:36.000Z,KNZWc0fRlxc,"New! Mobile Legends Free Diamond! -Mobile Legends Hack 2018,No Root Needed.",Want to know how to Hack Mobile Legends? With this Mobile Legends Hack - Free Diamonds Hack 2018 (Android iOS) you can do it in less than 5 minutes!,0
2018-02-05T12:56:30.000Z,L7W4Upj3U6g,Bowmasters - CRAZY SAM (THE Stars and Stripes) TOURNAMENT NORMAL Gameplay Walkthrough,Bowmasters - CRAZY SAM Bowmasters - https://www.youtube.com/playlist?list=PLkGFjRD8lRncYE-Q_hxJkPr238pRXblIp Bowmasters ITUNES ...,0
2018-02-05T21:59:49.000Z,L7xDNJTKk-M,BRAWL STARS DOWNLOAD ANDROID APK FREE - FULL - BRAWL STARS DOWNLOAD ANDROID APK FREE - FULL,Get it here : https://goo.gl/4YMfhc BRAWL STARS DOWNLOAD ANDROID APK FREE - FULL BRAWL STARS DOWNLOAD ANDROID APK FREE - FULL ...,0
2018-02-04T18:00:04.000Z,YbH_9LTeHAE,The Walking Dead: A New Frontier Episode 5: From the Gallows (FINALE),The Walking Dead: A New Frontier (also known as The Walking Dead: Season Three) is an episodic graphic adventure game based on Robert Kirkman's The ...,0
2018-02-15T19:21:36.000Z,40fwdAywE6g,"Tiny Dragons, Click for Cuteness Overload","First 10 minutes of the game Tiny Dragons. A decent game that can be played as a time waster, wouldn't call it a game you play for long periods of time. I would ...",0
2018-02-15T11:35:04.000Z,SYHCn8v-9R0,8 Ball Pool ( Breaker Cue ) Free 2018 Get New Link/ Reward,"STEP.1 PLEASE SUBSCRIBE MY CHANNEL PLESE STEP.2 One APPS DOWNLOAD for this link & Enter Code v4kpam STEP.3 LINK = Just tap the link, install ...",0
2018-02-13T02:29:33.000Z,_UI6EBwwWYg,Iron Blade: Medieval Legends RPG (Gameloft) Android / iOS Gameplay,Neither fate nor lineage can make a hero -- you must grab your sword and become one yourself! Forge your epic destiny in Iron Blade -- the most thrilling of all ...,0
2018-02-05T08:07:12.000Z,ENHViazzz7k,8 Ball Pool Free Coins Reward  links in Miniclip 8 bp 2018,8 ball pool free coins Reward links in Miniclip 8 bp 2018 Read below steps to get two or more Jakarta Click below link http://zipteria.com/CUxr ...,0
2018-02-02T00:59:08.000Z,T4TvA9jO8RQ,Haydee [Kinda NSFW] | F.T.A. (Blind First Impressions) - Episode #72,Haydee is an old school third person shooter metroid-vania platformer? Sounds like a hell of a lot of fun... Join the Community Discord here: ...,0
2018-02-02T06:03:36.000Z,KBtdU10PIcE,Easy Chrome Brush or Spray on Chrome,In this video I use the alsa easy chrome spray paint. Its probably the best chrome I have seen in paint form. Its versatile and easy to use. Available here ...,0
2018-02-08T20:00:00.000Z,2W40hQYNC3w,SUBNAUTICA IN VR! | Subnautica - Part 23 (Full Release),I've been meaning to do this for a very long time but I finally played Subnautica in VR!! Subnautica Full Series ...,0
2018-02-06T20:00:01.000Z,YL7e37185Ec,Springtrap Salvage - The Sims 4: Freddy Fazbear's Pizzeria Simulator - Ep 7,"Five Night's at Freddy's (FNAF) Sims 4 Theme is back with Freddy Fazbear's Pizzeria Simulator for season 3!! In this episode, we salvage Springtrap... CC via ...",0
2018-02-03T14:00:00.000Z,68uHdgftHzM,Monika is Causing Glitches Already!! | The Sims 4: Doki Doki Literature Club - Ep. 3,"Welcome to my new Doki Doki Literature Club Sims 4 series!! In this episode, we go for our first day of school & first official club meeting! Monika is also already ...",0
2018-02-08T21:00:00.000Z,DDTRZaoy3Fc,Exploding Minecraft Creeper! | 10 Strange Amazon Products,Click this link to get TubeBuddy for your own YouTube channel!  http://www.tubebuddy.com/Hi5 Thanks to TubeBuddy for sponsoring this video! We've all seen ...,0
2018-02-13T20:00:00.000Z,2qxzm_bBHjg,SCANNING THE BIG BOYS! | Subnautica - Part 26 (Full Release),"I'm not afraid of the big bad boys anymore in Subnautica, time to scan them all!!! Subnautica Full Series ...",0
2018-02-05T16:59:50.000Z,fOIneYd24Ww,Fixing Tesla Model 3's BIGGEST FLAW FOR $20,"The missing dashboard is an issue, can be solved easily for under $20, here's how. Get these updates in your inbox at https://teslanomics.co/join // Products ...",0
2018-02-15T20:00:02.000Z,NV08yKV8ZEc,THE DEATH OF SALLY! | Subnautica - Part 27 (Full Release),Sally Noooooo!!! How could this happen!?... Subnautica Full Series ...,0
2018-02-10T06:33:14.000Z,aiooTY_iNdE,How to Setup Eachine E500 FPV VTOL Wing with FrSky Taranis X9D Radio,Grab Your Eachine E500 VTOL here http://bit.ly/2nnO11V You can get the tiny SBUS receiver with Compatible Connector here http://bit.ly/2C9raf7 I have ...,0
2018-02-06T05:41:34.000Z,6LhH_rICsuM,Talking Tom Gold Run New Update 2018^KUNG FU HANK PREMIUM UNLOCKED*Gameplay Make For Kid #251,"Talking Tom Gold Run KUNG FU HANK NEW UPDATE 2018* Kung Fu Hank Run in New Road* Hi, All visitors If you enjoyed this video please help to ...",0
2018-02-05T19:59:32.000Z,j2HzbY8E4yQ,OBS Studio Tutorial 2018 (Make Your Streams Look Pro),"In this OBS studio tutorial for 2018, I show how to make your live streams look pro. I show how to add graphics in OBS, set up scenes and more to make your live ...",0
2018-02-07T10:14:17.000Z,B7Bn9DNru2k,How to Play Free Fire Battlegrounds on PC Controls With Bluestacks Emulator,"How to Download Free Fire Battlegrounds on PC, a battle royale mobile game for Android with Bluestacks Android emulator. Free Fire puts you on a remote ...",0
2018-02-14T20:34:26.000Z,40JiWm93s1I,STOP PLAYING IF YOU HAVE DONE THIS!  (ONLY IN BETA!!!!)- HARRY POTTER: HOGWARTS MYSTERY,Twitter: https://twitter.com/Goshinyhunter Contact Information: Goshinyhunting@gmail.com Discord Chat: https://discord.gg/6WF6M9k Frost Waltz by Kevin ...,0
2018-02-09T17:22:31.000Z,DZ4-qCxL5dk,Dji Mavic Air Controller Fix,If you have a Mavic Air and after updating the firmware your controller starts to beep and lock up. Leaving you with no options after trying to turn it off (with the ...,0
2018-02-15T18:37:20.000Z,cEi0Tw5gat0,Talking Tom Gold Run New Character  PRINCESS ANGELA ,ANGELA GOLD RUN: ANGELA SNOWBOARD RACE! ( FULL SCREEN ) Talking Tom Gold Run Princess Angela Tom Gold Run princess angela Talking Tom ...,0
2018-02-11T18:15:37.000Z,jqwQkUR846k,GTA Vice City Android Cheats Tutorial,"GTA VC Android Cheats. How to cheat in GTA Vice City mobile! Girlfriends cheat, Invisible Cars, Flying Cars Cheat, All Guns, Cars drive on water, more.",0
2018-02-13T21:26:08.000Z,ikrE6dRKhQE,DJI MAVIC AIR | CINEMATIC SETTINGS + FREE LUT,GET THE MAVIC AIR: http://geni.us/8DABTF ▻SNOW LUT: http://geni.us/gMo2G6S ▻MAVIC AIR LUT PACK: http://geni.us/pq9VpF ▻GEAR I USE: ...,0
2018-02-09T09:31:52.000Z,FxRBOwwRLFU,Boss Rex Hatching w/ little Vox ! | VsPVP: Center | Unofficial PVP | ARK: Survival Evolved! | EP19,Me and little Vox meat run and hatch the last rexes needed! Just another day on the ARK! VOXESTO MERCH   https://shop.spreadshirt.co.uk/voxesto-armour ...,0
2018-02-14T08:26:59.000Z,iOszXHB-CSE,"Xiaomi Mi LED TV 4 First Look | 55-Inch TV With 4K HDR Display | Price, Features, Specs, and More",Xiaomi Mi LED TV 4 has launched in India alongside the Redmi Note 5 and Redmi Note 5 Pro. Claimed to be the world's thinnest LED TV with a thickness of ...,0
2018-02-09T11:07:46.000Z,ZeFLCoM81bg,Walking Dead: Road To Survival - Quickest Tower Team?!,"Testing several popular teams to see what is the current quickest tower team! If you have suggestions, put them below and I will test next time... Line: justabox_yt ...",0
2018-02-15T07:00:00.000Z,397xbWvuZ_s,KapadVanj Ni Shariyo SONG from YD FAMILY New Urban Gujarati Film 2018 RELEASING 16 Feb,"Groove to this catchy song from YD FAMILY (Now in cineamas). Grab your ticket now!!! Music - Maulik Mehta Singer - Nakash Aziz, Arvind Vegda, Jay Chavda, ...",0
2018-02-05T10:21:32.000Z,I_rb42zDL6w,Fix Youtube Won’t Run unless you update google play services error in android,"How to fix youtube app won't run unless you update google play services error in android phone 2018 in hindi, How to solve youtube won't run update google ...",0
2018-02-05T06:07:45.000Z,pjyujrVJCe4,yahtzee with buddies unlimited rolls cheats working 2018,yahtzee with buddies unlimited rolls cheats working 2018.,0
2018-02-03T02:17:28.000Z,MXmSifl3Cm0,ROBLOX - TREASURE HUNT UNLIMITED TREASURE/COIN HACK *WORKING 2018*,Subscribe & turn on post notifications Doing this allows you to get the exploit first and use it before it does get patched!,0
2018-02-10T04:24:53.000Z,lPBzT_sj2U4,FREE Valentine's day Skins  | Year of the Varg | Don't Starve Together,"Spring is finally here, Say goodbye to the Gobbler and hello to the Year of the Varg with new hound themed items and festive decorations, Go collect the Verdant ...",0
2018-02-08T12:45:21.000Z,1ysTO2rRdOw,MoShow - Slideshow Movie Maker l photo to video maker app Android Apps on Google Play l M TECH HINDI,App Download Link Android-MoShow - Slideshow Movie Maker http://fasttory.com/DTKS ...,0
2018-02-07T01:24:13.000Z,Bx-w6ftEXj4,Talking Tom Gold Run Fullscreen^KUNG FU HANK PREMIUM UNLOCKED*Gameplay Make For Kid #252,"Talking Tom Gold Run*KUNG FU HANK* Hi, All visitors If you enjoyed this video please help to : Comment, Like, Favorite, Subscribe and Share as one of you ...",0
2018-02-09T19:46:18.000Z,gj3-m-k9tvc,HSN | Electronic Connection 02.09.2018 - 12 PM,"Discover electronics find items and brands during this hour keeping interests with new technology... There will be all different brands with in this hour, stay tuned ...",0
2018-02-05T08:25:53.000Z,paiKIzeyXbY,How to get Free USA Phone Number 2018 | Verify Any Online Account ️,"How To Get Free Unlimted USA Phone Number & Verify Any Online Account 2018. Hi everyone, today in this video tutorial I will show you how to get free US ...",0
2018-02-03T18:08:07.000Z,RFHgwfvWXL8,ROBLOX - TREASURE HUNT SIMULATOR *INFINITE MONEY* *ALL CODES*,GAME: https://www.roblox.com/games/1345139196/Treasure-Hunt-Simulator Download at: https://discord.gg/Hr4XUzC Go to text channel: #bot-abuse and use ...,0
2018-02-06T10:01:00.000Z,GTmuxRavEIY,WWE Mayhem Hack 2018 - Gold Cheats Generator,What's up WWE FANS! are you playing this game and you are tired of low amount of Gold you have? Not anymore. Let me introduce you this first real and ...,0
2018-02-14T21:24:36.000Z,WOYJC9YUPGk,FREE CHARACTER OUTFIT SKIN! - Fortnite: Battle Royale,Subscribe for more: http://www.youtube.com/user/tmartn2?sub_confirmation=1 Fortnite Battle Royal Playlist: ...,0
2018-02-15T17:28:26.000Z,pZytEBCdR1I,Hero hunters hack - Working Hero hunters cheat gems for iOS and Android,Hero hunters hack 2018! With amazing Hero hunters Cheats 2018 you can generate gold and cash Link to hero hunters hack: http://bit.ly/herohuntershacks ...,0
2018-02-05T17:34:04.000Z,vfY_5xYni08,8 ball pool mod menu hack Mod apk No Root unlimited money and cash 20181.mp4,DOWNLOAD - https://mega.nz/#!T5VCBSQR!sk-sv4ZHZRAg0_CDgNwdhgxtEdClYOVHizz9EeM20PQ PASSWORD - 123.,0
2018-02-02T03:44:42.000Z,srKpcyFDCz0,war wings hack android - war wings hack mod,"war wings hack apk - war wings hack xbox Hello guys, today i share you tutorial how to make use of War Wings Hack Cheats for Free Gold & Silver. In this ...",0
2018-02-14T20:00:01.000Z,69GuccV0b7w,The Probe: House Party Game Review,Join Allison and Rory as they explore Hentai games! They'll play and rank the games so you know whether or not to add them to your spank bank. On this ...,0
2018-02-08T21:25:29.000Z,piMGZthPBDM,how to hack 8 ball pool | no mod | no human verification,8 Ball Pool Hack will Generate Cash and Coins to your accounts. Android and iOS Compatibility. Do not hesitate and try our 8 Ball Pool Cheats right now.,0
2018-02-01T18:09:42.000Z,eqwxWX4NoMU,COOKING MAMA Let’s Cook! v1.32.0 Mod Apk Free Shopping,COOKING MAMA Let's Cook! v1.32.0 Mod Apk Free Shopping MOD: - Coins + Unlocked DOWNLOAD APK : http://velocicosm.com/8qoW COOKING MAMA Let's ...,0
2018-02-03T13:00:44.000Z,uu3u07lNSBc,Fishdom Hack 2018,Access The Fishdom Online Hack Now : http://bit.ly/2BQ8EIr Download Fishdom Game Here ...,0
2018-02-10T11:59:06.000Z,GQMbuhC0aOY,KiK Points Hack - Generate free KiK Points No Download 2018,KiK Points Hack - Generate free KiK Points No Download 2018 Link :- https://tinyurl.com/ycabw6gw Hi Welcome to this NEW Kik Points Generator for Unlimited ...,0
4,2018-01-24T10:33:54.000Z,PE4lnlJUBoI,HOW TO SETUP NAVIGATION PROVIDER ON GRAB DRIVER APP,This video will show you how to setup navigation provider like Waze or Google maps on Grab Driver App by using your smartphone.. Its very easy.. Thank you ...,1
2018-01-27T09:50:31.000Z,Qsz7wENLzKI,8 Ball Pool Trick 2500 Coins To 10M coins Without Playing,Pool Reward Apk ◇ http://zipteria.com/3kYG MONSTER LEGENDS Mod Apk:- ◇http://swiftation.com/9mex Guns of Boom Hack v2.9.0 ...,0
2018-01-22T12:38:07.000Z,dWt4FZXYn1I,8 Ball pool 3.12.4 hack | mega mod /8ball potted /,"Hello Game Developers If you want it removed this video, please Contact Us by mail (sy.yash007@gmail.com) or by leaving a comment on the video you believe ...",0
2018-01-26T02:33:27.000Z,hNaFK2HGroA,Chef Town iOS tweak mod hack,Sign up and download from forums https://bizzyz-modz.wixsite.com/staybizzy Or Add repo http://bizzyz-modz.yourepo.com.,0
2018-01-19T12:38:29.000Z,ielur71TfCo,(NO ROOT) 8 ball pool || 3.12.4 Hacked ||Mega Mod+50062 cash hack||Extended guidelines+antibann.,TO ...,0
5,2018-01-30T08:07:13.000Z,Ygtdj3bTC5s,GRAB EXPERIENCE (1st Time),Kudos to GRAB! Thank you for your assistance.. My family experienced convenience sa pag commute. The rating I gave is for the Grab driver I booked at that ...,1
2018-01-23T21:38:14.000Z,pAwLxilEeUg,10 HORRIBLE Grand Theft Auto Rip Offs!,10 HORRIBLE Grand Theft Auto Rip Offs! Follow me on Twitter - https://twitter.com/ZacCoxTV Follow my Instagram - http://instagram.com/ZacCoxTV Like ...,0
6,2018-01-24T02:32:09.000Z,ydpcVaro4_M,GRAB DRIVER SHARE 02,Sila lihat panduan pemandu yang telah diberikan oleh admin ubergrab melalui whassup. Khas untuk pemandu berdaftar sahaja. Tq Daftar ubergrab online ...,1
2018-01-18T09:46:06.000Z,r_9LaeKJH8A,How To Download Modded Apk Directly On Your Android Device,Here is the best way to directly download download modded games and apps on your android device Make sure to subscribe if you enjoy the video Subscribe ...,0
2018-01-20T18:48:16.000Z,EFQMM2a9uXM,"FFF #226 (New Mod Portal, Belts vs Bots Conclusion & More) - Factorio Friday Facts Discussion",Friday Facts Here: https://www.factorio.com/blog/post/fff-226 Stay up to date with new releases by Subscribing. Grab My Free Android App: ...,0
2018-01-28T09:39:03.000Z,3OC9j-_XDnM,Temple run 2 mod apk,What's up guys enjoy game No redirect No fake No adsfly No shorten App rar ...,0
2018-01-27T16:01:43.000Z,E6-iAGRIx3o,8 Ball Pool Berlin Hack 27 Jan 2018 || Qaiser Lodhi,Download 8 Ball Pool 3.12.4: Apk Hack: http://www.smartlodhi.com/2018/01/8-ball-pool-version-3124-level-unlocked.html How To Download My Mods ...,0
2018-01-29T13:40:03.000Z,e2PN5qpSvNM,8 Ball Pool Guidelines Mod 2018 - Unlimited Guideline Mod For Android,8 Ball Pool Guidelines Mod 2018 - Unlimited Guideline Mod For Android 8 Ball Pool Mod : http://www22.zippyshare.com/v/3HYmimzi/file.html ...,0
2018-01-23T14:30:00.000Z,VZ29byay9pQ,Marriage Already?! - RimWorld B18 Mods Gameplay part 14,RimWorld Beta 18 gameplay with over 100 mods installed! This is a modded RimWorld let's play containing over a hundred mods with more being added ...,0
2018-01-20T13:00:02.000Z,RH-3XTLriXg,Mending - RimWorld B18 Mods Gameplay part 13,RimWorld Beta 18 gameplay with over 100 mods installed! This is a modded RimWorld let's play containing over a hundred mods with more being added ...,0
2018-01-20T10:30:02.000Z,YK64G7eEs4g,Prince Of Persia Shadow And Flame Unlimited All Mod/Hack Apk 2018 Updated (NO ROOT),DOWNLOAD LINKS- APK : http://vivads.net/b8yxGV ▭▭▭▭▭▭▭▭▭▭▭▭▭▭▭▭▭▭▭▭▭▭▭▭▭▭▭▭▭    Disclaimer    If you want it removed ...,0
7,2018-01-24T15:43:13.000Z,tAap8LzjAik,Power director paid version for free grab now!!!,Guys for u n your good future as youtuber i will give u youtube paid version is for free!!! grab guys !!! love u guys      plz in coprate subscribe us # Downlod app ...,0
2018-01-19T08:28:20.000Z,_uePfY5Z_k4,8 Ball Poll New 3 Legendary Cues 2018 Fresh ! No:1 -MOD- | By I TECH  | 8 Ball Pool 'MOD',READ DESCRIPTION✰ ············ ▭▭▭▭...,0
2018-01-20T10:21:04.000Z,TlJwbeXNVJg,(NO ROOT) 8 ball pool || 3.12.4 Hacked ||Mega Mod+50062 cash hack||Extended guidelines+antibann.,TO ...,0
2018-01-27T15:32:38.000Z,COPnhZtfNMY,How to download 8 ball pool mod apk,Please like and subsribe.,0
2018-01-30T18:00:02.000Z,T3tpACvzhr4,BUILDING DAM OF ABERRATION! | ARK  Pooping Evolved Modded Aberration E3,"ARK: POOPING EVOLVED MODDED PUGNACIA & GAIA Waking up on 'Aberration', a derelict, malfunctioning ARK with an elaborate underground biome ...",0
2018-01-29T07:08:33.000Z,filY1YCgCrg,Factorio: Tightening The Belt: Megabase Guide EP2 - BOOTSTRAP CIRCUITS | Tutorial Gameplay Series,"This Factorio series is intended to be a guide or walkthrough for newer players as well as experienced players with tips, tricks, How To, and the Why behind ...",0
2018-01-24T13:00:00.000Z,77kZDu4Q_ng,Playing with Industrial Rollers - RimWorld B18 Mods Gameplay part 15,RimWorld Beta 18 gameplay with over 100 mods installed! This is a modded RimWorld let's play containing over a hundred mods with more being added ...,0
2018-01-24T14:21:29.000Z,U9cIEHBh_Bo,How To download all mod of games and apps.,Thanks for your support guys. App link https://acmarket.net Follow me on Instagram  saiompattnayak. Follow me on Facebook  saiompattnayak. JAI HIND ...,0
2018-01-19T13:00:02.000Z,FlX-H3MMpW8,Simon Says! #98 Long War 2 Legend S3- XCOM 2 Let's Play: Long War 2 Gameplay Mod,My name is Xavier (Beta Tester/Design Advisor for the Long War 2 XCOM 2 mod) and this is my Long War 2 Legend Season 3 Let's Play! Subscribe for daily ...,0
2018-01-23T20:30:00.000Z,WNLk2lki_-Y,GTA 5 Mods: POKEMON GO MOD! (GTA 5 Mod Gameplay),In today's GTA 5 gameplay video we check out a GTA 5 POKEMON GO mod!!! Be sure to subscribe and like for more GTA 5 gameplay & funny moments! GTA 5: ...,0
2018-01-18T13:00:00.000Z,3GJak0QGz5c,That's So Depressing! - RimWorld B18 Mods Gameplay part 12,RimWorld Beta 18 gameplay with over 100 mods installed! This is a modded RimWorld let's play containing over a hundred mods with more being added ...,0
2018-01-17T22:41:41.000Z,9pzLDhNeXXg,8 Ballpool hack || WORKING MEGA MOD - LONG LINE ANTI BAN.,"Hello and welcome to our channel today we are sharing a hack/mod of one of the most popular games in the world, 8 ballpool. Yes! ITS WORKING FINE.",0
2018-01-31T15:42:22.000Z,fLSaFdr0yA8,CONFLAGRANT ANKYLO & MORE BASE BUILDING! | ARK: Pooping Evolved Modded Aberration E4,"ARK: POOPING EVOLVED MODDED PUGNACIA & GAIA Waking up on 'Aberration', a derelict, malfunctioning ARK with an elaborate underground biome ...",0
2018-01-19T23:51:10.000Z,VK-5VNNRvf8,"Update & Discussion: Content Decline, Unhappy Viewers, My Apology & New Series",Stay up to date with new releases by Subscribing. Grab My Free Android App: http://tinyurl.com/xterminatorapp Check out my Factorio Steam Guide: ...,0
2018-01-27T22:52:14.000Z,PFCGSHQmJoo,HACK THE WALKING DEAD NO MAN'S LAND 2018 UNLIMITED MOVE AND HIGH DAMAGE,"HELLO, if you want it romoved this video,please contact us by email (handiandriansyah58@gmail.com)or by leaving a comment on the video you believe ...",0
