,published_at,video_id,title,description,relevance
114,2016-11-27T22:19:18.000Z,4Q8IngUTneM,AMAZING DOUBLE GRAB LUCKY CUP CLAW MACHINE WIN!,SUBSCRIBE: https://www.youtube.com/user/CarsonScheer99 YOU GUYS ROCK! :D Subscribe to MicMe TV ...,0
115,2018-03-02T06:25:45.000Z,rHW4mJNAmqg,Loods & Mall Grab - Sweetness,Novaj 新し Sensations & feelings pre-order it http://www.shallnotfade.co.uk/album/loods-mall-grab-love-is-real Follow Mall Grab https://soundcloud.com/mallgrab ...,0
116,2010-12-15T14:56:21.000Z,DwrkCGCHfXQ,Awesome Self-Defense - Wrist Grab Release Techniques,An essential part of any remotely decent self-defense arsenal is the ability to release a wrist grab. This short video demostrates some of the basic wrist grab ...,0
117,2009-02-11T03:23:54.000Z,MdLj5A4tN6M,2Pac - Grab The Mic (Unreleased),2Pac - Grab The Mic aka Starin' Through My Rearview Pt. 2 (Unreleased),0
118,2018-01-30T04:08:50.000Z,M-TgkGRNz_0,Understand more and improve your English pronunciation with the BREAK& GRAB METHOD,"Do you know what Active Listening is? I will show you how you can use Active Listening and my ""BREAK & GRAB"" method to improve your ability to listen and to ...",0
119,2018-06-24T03:16:38.000Z,Zzvn5Jmrl_M,La Stella dives into the stands to make a great grab,Tommy La Stella goes head first into the stands to make an outstanding catch against the Reds in Cincinnati About Major League Baseball: Major League ...,0
120,2014-05-28T23:03:00.000Z,1ZYFovQ3vRY,Metagain :: Fast Fall Ledge Grab,"Hey, Here's the first technique, Fast Fall Ledge Grab. **TLDW** Aside from making you grab ledge faster, it also let's you grab the ledge while you are in hit stun ...",0
121,2007-12-04T08:01:59.000Z,ml9ZB98EfzY,Ric Ocasek - Something To grab For,"From Ric Ocasek's solo debut Beatitude, sadly this song and video have long since been forgotten over the years.",0
122,2018-01-08T10:07:35.000Z,CxB9XgR84N8,[SOLD] Lil Baby x Lil Durk x Offset Type Beat - Grab The Pack [Prod. Woodpecker],https://traktrain.com/woodpecker For this beat email : llll035@hotmail.com Lease this beat for : 50$ Exclusive : 350$ Instagram : @ProdWoodpecker For other ...,0
123,2018-04-25T21:15:02.000Z,PbHJkBYjlh0,Melania Trump's Awkward As HELL Hand Grab With Donald,Melania Trump continues to refuse to hold husband's hand lovingly. Grace Baldridge and Amir Nikoui talk about how her continuous denial of basic affection for ...,0
124,2018-03-11T15:17:52.000Z,79j8fRSHp7w,JOWST & Aleksander Walmann - Grab The Moment - Symphony & Drumline Remix,The National Final in the Norwegian Eurovision final Melodi Grand Prix 2018. With a new edit of the 2017 winner song Grab The Moment. Along with Didrik ...,0
125,2018-06-27T09:30:16.000Z,cjKrKjgpafo,The EXCEL Day | Great Grand Offer | Grab Now,Best Opportunity to Buy Excel Course at just Rs 1000 only for today (Course Price Rs 3990) Product Link: ...,0
126,2016-10-08T05:30:03.000Z,su-Rt4QJZ08,"Trump Hot Mic LEAKED: ""Grab 'Em By The Pu$$y""","In newly released audio from 2005, Donald Trump was caught on a hot mic while waiting to appear on Access Hollywood. He brags about groping women and ...",0
127,2014-11-22T15:29:03.000Z,nAKm0RR0HCA,Grab The Comb - Beyond Scared Straight,"A kid named Kenneth refuses to comb an inmate's chest hair... and then the fun follows. Two of my favourite quotes: 'I'd stick my foot so far up your ass, you'd be ...",0
128,2017-06-12T06:22:16.000Z,SUDD9lFro-c,Superpowers at Grab,"Everyone wants a superpower. Some of us get to have one. At Grab, we have the power to improve millions of lives across Southeast Asia! Get the power.",1
129,2012-08-20T02:10:35.000Z,6dHWb5T4ER8,How to Get Out of a Throat Grab | Jiu Jitsu,Watch more Brazilian Jiu Jitsu videos: http://www.howcast.com/videos/503539-How-to-Get-Out-of-a-Throat-Grab-Jiu-Jitsu So the guy grabs me by the throat here ...,0
130,2018-03-16T16:21:01.000Z,RUqX3E7MZcw,"NHS' ""Please Don't Grab My Boob!"" Video","Let the good times roll! This whole crew of female skaters put together an amazing edit. So rad. Featuring Lizzie Armanto, Nora Vasconcellos, Lacey Baker, ...",0
131,2017-01-20T13:23:57.000Z,CYhRRgrVufA,Mall Grab - Pool Party Music - Hot Haus Recs,Mall Grab - Pool Party Music SUPER LIMITED UPFRONT COPIES NOW SHIPPING: https://unknowntotheunknown.bandcamp.com/album/pool-party-ep Mall ...,0
132,2012-03-31T11:14:56.000Z,eYveEdhTgBs,Grab Magic: My hack for The Boat That Hacked #mipboathack,The best designed experiences make technology invisible and give people superpowers (what I call The Superman Effect). This is what I just made over the ...,0
133,2015-06-22T09:56:44.000Z,SU8o5C2N0Ro,Grab N Drive,"The Grab N Drive is the latest concept in post driving. Designed by Exac-One and manufactured in the UK, this modular system allows an excavator operator to ...",0
134,2016-02-12T13:00:00.000Z,8oCjf2M_uAY,Rayven Justice - Grab a 8th (Audio),Music video by Rayven Justice performing Grab a 8th (Audio). 2016 http://vevo.ly/gnGa2F.,0
135,2013-04-12T11:07:23.000Z,LpHpm_b0vRY,Screen Grab - Simon's Cat | SHORTS,"""Stop, play, paws and rewind."" Don't forget to SUBSCRIBE! http://www.youtube.com/subscription_center?add_user=simonscat The Kitten Chaos US Edition and ...",0
136,2017-10-16T14:53:49.000Z,UBMG5Xas-N8,Mall Grab - Liverpool Street In The Rain,Taken from Mall Grab's Cover Mix for Mixmag. Follow Mall Grab: https://soundcloud.com/mallgrab No copyright infringement intended. Please contact me at ...,0
137,2010-04-17T18:20:34.000Z,sCTukXFOY_w,Grab It! (1999) for electric guitar and boombox by Jacob TV,"Written by Jacob TV - http://www.jacobtv.net and performed by Kevin Gallagher - http://www.guitar69.com Originally composed for saxophone and boombox, this ...",0
138,2013-04-12T11:07:23.000Z,LpHpm_b0vRY,Screen Grab - Simon's Cat | SHORTS,"""Stop, play, paws and rewind."" Don't forget to SUBSCRIBE! http://www.youtube.com/subscription_center?add_user=simonscat The Kitten Chaos US Edition and ...",0
139,2017-10-16T14:53:49.000Z,UBMG5Xas-N8,Mall Grab - Liverpool Street In The Rain,Taken from Mall Grab's Cover Mix for Mixmag. Follow Mall Grab: https://soundcloud.com/mallgrab No copyright infringement intended. Please contact me at ...,0
140,2010-04-17T18:20:34.000Z,sCTukXFOY_w,Grab It! (1999) for electric guitar and boombox by Jacob TV,"Written by Jacob TV - http://www.jacobtv.net and performed by Kevin Gallagher - http://www.guitar69.com Originally composed for saxophone and boombox, this ...",0
141,2015-07-30T13:30:34.000Z,8wRB7ASnha8,Grab Bag is the Reusable Shopping Bag that Clips to Your Cart,Get it here on BulbHead: http://bit.ly/1LSkSyH Hold as many as four plastic grocery bags in one Grab Bag! The reusable grocery bag clips to cart for easy ...,0
142,2018-06-26T00:56:58.000Z,CF_qS8MwVF8,"Keto Grocery Mukbang - Grab & Go Foods, and One Intense Week","Sometimes life gets intense and convenient keto can be hard, so today I figured I'd show some of my go to grab and go foods that can keep you rolling through ...",0
143,2016-01-27T21:59:46.000Z,lrcuIGypxDg,"KFC ""Grab a Bucket of Chicken""","Circa 1972 - “Grab a Bucket of Chicken, Have a Barrel of Fun” KFC ad campaign. I DO NOT OWN THIS. Editorial Purposes.",0
144,2015-10-19T02:26:33.000Z,8v7Agx74gsU,Mall Grab - I've Always Liked Grime,https://www.facebook.com/stillmallgrab https://soundcloud.com/mallgrab https://twitter.com/stillmallgrab https://www.youtube.com/user/madkezza2.,0
145,2017-03-12T01:02:16.000Z,IPp37uz8vUs,JOWST - Grab The Moment (Norway) Eurovision 2017 - Official Video,Add or download the song to your own playlist: https://ESC2017.lnk.to/Eurovision2017YD Download the karaoke version here: http://apple.co/2pGkdx5 Buy it on ...,0
146,2007-12-10T22:38:21.000Z,HCXA9miu1DA,Buckethead- Binge And Grab,"Binge And Grab, by Buckethead.",0
147,2012-04-11T18:54:03.000Z,p5NGq7ugM1c,Elder care bathroom safety - where to install grab bars,Helpful tips to safely enter and exit the bathtub using grab bars and a bath bench.,0
148,2013-04-18T14:42:21.000Z,PyCSZzdLBhQ,The Croods [Soundtrack] - 03 - Smash And Grab,The Croods [Soundtrack] Music By Alan Silvestri.,0
149,2017-01-20T19:33:45.000Z,MvEg0cA4Stc,MALL GRAB & KGW in The Lab LDN,Mixmag & Coors Light present The Lab LDN The sound of the Shall Not Fade label More on Shall Not Fade: https://www.facebook.com/shallnotfade/ Follow ...,0
150,2016-11-15T15:59:00.000Z,mX6BzygEQZI,Kllo - Walls To Build (Mall Grab Remix),Download in The Ghostly Store: http://www.theghostlystore.com/collections/music/products/walls-to-build-remix.,0
151,2017-02-03T11:21:54.000Z,u_bk-Ur2qQA,Mall Grab - Catching Feelings (Official Video) - Hot Haus Recs,Catching Feelings - A film by James Robinson featuring Mercy Sang Mall Grab returns to Hot Haus dropping 3 of his most sought after jams to date. Currently ...,0
152,2012-02-19T03:46:34.000Z,bEDb0CPdjpA,NANCY SINATRA - How Does That Grab You ?  1966,"Nancy Sinatra get success with her second album ""How Does That Grab you?''. This is the classic video for this great song. This is an American Top 10 Hit # 7 ...",0
153,2011-05-27T01:50:26.000Z,cy-OKLuMikk,Lethal Weapon 3 (1/5) Movie CLIP - Grab the Cat (1992) HD,Lethal Weapon 3 movie clips: http://j.mp/1JbV1C3 BUY THE MOVIE: http://bit.ly/2cyY1RX Don't miss the HOTTEST NEW TRAILERS: http://bit.ly/1u2y6pr CLIP ...,0
154,2011-01-11T00:40:28.000Z,wgwJyfMmSjU,Grab - a film by Billy Luther - Trailer,Premiering at the 2011 Sundance Film Festival.,0
155,2016-03-16T10:11:10.000Z,tjuNryGreuk,Grab Express - same day delivery in Manila,"I test out Grab Express, a same day pickup and delivery service from Grab Philippines. This video was not sponsored, reviewed or approved by Grab. In the ...",1
156,2011-07-08T11:18:42.000Z,Wys_JmrK5e4,Jerry Remy - oops grab of breast,Red Sox baseball commentators Don Orsillo and Jerry Remy can't seem to keep it together when their crew captures a fan tweaking his lady on camera.,0
157,2010-05-10T19:44:06.000Z,8pDVGuXkHwA,Hundreds - Grab The Sunset,Songname: Grab The Sunset Interpret: Hundreds Album: Hundreds http://www.hundredsmusic.com/,0
158,2009-10-30T19:17:43.000Z,7zkoLgi0pR4,"""Grab A Mop""","You should be with us in 2012, join now: http://my.barackobama.com/grabamopvid President Barack Obama - October 20, 2009 - Organizing for America Event ...",0
159,2018-03-04T14:03:57.000Z,WPBTmtlLJtU,Operation : Snatch & Grab [7th Annual Saxxy Awards] - [Action Nominee],"Thank you for voting this entry! We got a nominee atleast. ------------------------------------------------------------------------------------------------- ""The assignment was clear.",0
160,2014-07-28T13:24:12.000Z,ufTSoXbW1Pw,Installing Safety Grab Handles on Ceramic Tile  Tool Tip #25,In this video I mount some safety grab bars on ceramic tile and I show you how to mount them very securely without mounting them into the studs.,0
161,2015-03-04T13:57:03.000Z,M5NTCfdObfs,HOW TO MUTE GRAB,If you like to learn this way check out much more tutorials over at https://www.stompittutorials.com This video will teach you how to stomp your first mute grabs ...,0
162,2013-02-13T01:32:44.000Z,2Gr_SZ1AaGE,Dinosaur Jr - Grab It,A super tasty jam. Dinosaur Jr - Grab It.,0
163,2011-03-13T23:18:39.000Z,i6BKhvhSehc,"Cover Tune Grab Bag - ""Ob-La-Di, Ob-La-Da""","The Rock & Worship Roadshow 2011 presents ""Ob-La-Di, Ob-La-Da"" featuring MercyMe, Jars Of Clay, Matt Maher, Thousand Foot Krutch, The Afters & Lecrae.",0
164,2015-06-25T01:49:11.000Z,vKpXa4elASM,Install a grab bar with the Ghostud™ - the only wall anchor that acts like a stud!,"Whether facing a physical disability or meeting ADA compliance, grab bars are becoming a necessity. The Ghostud™ can help you securely mount the grab bay ...",0
165,2015-05-07T09:21:00.000Z,CA5bURVJ5zk,10 Snowboard Grabs - Snowboarding Trick List,KEVIN'S TOP GEAR PICKS SNOWBOARD: http://bit.ly/2mlOZcJ GOGGLES: http://bit.ly/2kvQzLu HELMET: http://bit.ly/2kml7vT JACKET: http://bit.ly/2km8GQy ...,0
166,2018-05-20T21:30:00.000Z,1PeUBgttSlE,It's a Grab Trailer,iOS https://itunes.apple.com/us/app/id1358352535 Android https://play.google.com/store/apps/details?id=cc.navel.itsagrab Fall and grab your way down a ...,0
167,2011-04-01T14:11:23.000Z,n5LOismc-NM,Balloon Grab,Carson lost his balloon on the ceiling. He got out a small chair reached and couldn't get it. Then got out a bigger chair reached and still couldn't get it. He then ...,0
168,2010-03-09T14:19:23.000Z,oN1TnQtRUfw,LLumar Window Film Smash & Grab Lab Test,Watch LLumar safety and security film put to the test against an automobile smash and grab attempt. Learn how LLumar film can significantly help to deter ...,0
169,2008-03-08T19:03:23.000Z,Da-nH4-C1nQ,Young Buckethead - Deli Creeps - Binge and Grab (1991),Live at The Kennel Club on 4/3/91 Directed and produced by Jas Obrecht; used by copyright holder's permission. ORDER both AMAZING DVDs showing ...,0
170,2018-01-28T20:13:47.000Z,qrk35HPs09k,GOLDEN VAULT UPGRADE!! | ROBLOX CASH GRAB SIMULATOR,"ROBLOX Cash Grab is one of the newest and best Roblox simulator games yet!! In this game, you are a game developer in a town and have to run from noob to ...",0
171,2011-05-06T19:56:50.000Z,EPo5wWmKEaI,"Pitbull - Give Me Everything ft. Ne-Yo, Afrojack, Nayer","Pitbull's official music video for 'Give Me Everything' ft. Ne-Yo, Afrojack and Nayer. Click to listen to Pitbull on Spotify: http://smarturl.it/PBSpot?IQid=PGME As ...",0
172,2011-05-06T19:56:50.000Z,EPo5wWmKEaI,"Pitbull - Give Me Everything ft. Ne-Yo, Afrojack, Nayer","Pitbull's official music video for 'Give Me Everything' ft. Ne-Yo, Afrojack and Nayer. Click to listen to Pitbull on Spotify: http://smarturl.it/PBSpot?IQid=PGME As ...",0
173,2015-11-06T22:15:17.000Z,hjbl-2yq8zw,Grab Bag Commercial - As Seen On TV,Learn More: https://www.grabbag.com/?mid=7306094 Never deal with flimsy plastic grocery bags again with Grab Bag! Earth-friendly Grab Bag is designed to ...,0
174,2009-07-03T16:16:22.000Z,6RqAduJr9Xs,The Mac Grab Utility (MacMost Now 261),"http://macmost.com/e-261 In addition to screen capture keyboard shortcuts built into Mac OS X, you can also use the Grab utility to capture the screen.",0
175,2009-04-15T01:03:35.000Z,zHxcWvO-WTo,Buckethead - Binge and Grab - Giant Robot,"Song Title: Binge and Grab, Album: Giant Robot (1994), Artist: Buckethead.",0
176,2015-01-20T07:17:57.000Z,weDdP1hwhfc,Dramatic footage shows smash-and-grab in Johannesburg traffic,Footage loaded to YouTube by user Craig Jennings shows dramatic footage of a Johannesburg motorist falling victim to a smash-and-grab robbery along ...,0
177,2017-11-14T13:28:14.000Z,SMhfE9__M08,Mall Grab - Ahmad (Original),Digital: https://avarecords.bandcamp.com/album/ill-be-in-paris-on-sunday-if-youre-about Vinyl: ...,0
178,2016-07-03T07:10:56.000Z,uZxNGQ7t0BU,Grab adhesive - grab and strength test,A few months back I recreated a video that I watched on YouTube called “the maximum torque challenge”. I was not convinced by the manufacturer's integrity ...,0
179,2014-08-25T14:29:53.000Z,jOOdJZS987Y,Unity3D - Grab and Drop Objects (Unity 4),"Pick up objects that will hover in front of you, and then drop them. Uses vectors, normal vectors, functions, and rigidbodies. This introductory video assumes you ...",0
180,2016-09-08T14:57:40.000Z,m9P5P-NyY18,banvox  - High And Grab (Official Full Stream),banvox “High And Grab“ 2016.09.09 release 01. High And Grab Spotify : http://open.spotify.com/album/3kI3f9FKW3Vh8un4Gjuxvx iTunes ...,0
181,2017-01-16T14:54:42.000Z,KPJBFpl2bPI,[Basics] Grab attach mechanics,VRTK provides a number of different mechanics for grabbing an object. Each grab mechanic has it's own pros and cons so it's worth learning when to use the ...,0
182,2016-11-09T21:43:30.000Z,sAg2gfx93Ro,"... and THIS is mifold, the Grab-and-Go Booster","This is a regular car booster seat ... ... and THIS is mifold, the Grab-and-Go Booster seat. It's more than 10x smaller than a regular booster seat and just as safe.",0
183,2014-05-16T21:44:49.000Z,RnsKoxbMbD4,Grab a Ten,"Learn to count the tricky teens with this catchy math song! To find more songs, games, and stories, check out Brainzy games: http://www.brainzy.com Brainzy ...",0
184,2009-05-04T00:43:19.000Z,fXoPOmXE8k4,Graveyard Productions - Grab My Mask (1994),Graveyard Productions - Grab My Mask (1994) The Havoc High Quality: http://www.youtube.com/watch?v=fXoPOmXE8k4&fmt=18.,0
185,2011-08-11T13:14:45.000Z,oWKdonc9iDw,Industrial Stormwater: How to Collect a Grab Sample,"The Minnesota Pollution Control Agency's Industrial Stormwater Multi-Sector General Permit requires all Permittees to conduct Benchmark Monitoring, starting ...",0
186,2015-08-24T00:06:54.000Z,thq-4q4j_VE,The Heroine Sheiks - Grab The Wheel,Siamese Pipe (2002) Rubric Records.,0
187,2018-04-06T16:30:00.000Z,Ooq0GG7OJwY,The Gun Grab Begins in Deerfield Illinois and Vermont,"We are 100% viewer funded - Make a one time donation: https://www.makersupport.com/VincentJames/tip Or Become a patron on Patreon for hidden videos, ...",0
188,2017-04-12T02:12:42.000Z,Wockoc205ug,"NEW GTA 5 ONLINE TRON UPDATE ""LAND GRAB"" ADVERSARY MODE!!  (GTA 5 Online)","GTA 5 Online Tron update Land Grab adversary mode with Typical Gamer! ▻ Subscribe for more daily, top notch videos! ▻ http://bit.ly/SubToTG ▻ Watch the ...",0
189,2014-12-06T18:08:26.000Z,GUqnUdnKLKU,"Hero of ""The Clutch & Grab Era"" - Peter Forsberg top 20 plays","The time between the lockouts 1994 - 2004 was named the clutch and grab era, the era of ""the trap"". It´s dominator was Peter Forsberg, ""The force"", ""Foppa"", ...",0
190,2017-12-03T11:38:01.000Z,M2Ys2T3mqTU,Mall Grab - Essential Mix 2/12/2017,Jordon Alexander aka Mall Grab's debut Essential Mix on BBC Radio One. Boogie on :),0
191,2012-08-17T04:06:02.000Z,6bExlWzkIHU,How to Get Out of Two-Handed Wrist Grab | Jiu Jitsu,Watch more Brazilian Jiu Jitsu videos: http://www.howcast.com/videos/503532-How-to-Get-Out-of-TwoHanded-Wrist-Grab-Jiu-Jitsu Guy grabs me by both my ...,0
192,2016-02-18T10:19:54.000Z,xuXTaW-POJQ,Duo Iten-Grab - Schubidubidu,Schubidubidu vom Duo Iten-Grab Für weitere Infos oder downloads abonnieren Sie uns doch oder besuchen Sie: www.gruezishop.ch www.gruezimusic.ch ...,0
193,2016-06-02T15:02:05.000Z,LZcsZqO1sx4,Mall Grab - I've Always Liked Grime - Unknown To The Unknown,Available now at Bandcamp: https://unknowntotheunknown.bandcamp.com/album/vinyl-repress-menace-ii-society-ep Also available at Beatport: ...,0
194,2018-01-21T10:05:52.000Z,SroETNZ1niM,How I get unlimited cash… WORKS! 2018 (Roblox Cash Grab Simulator Hack),HOW TO GET UNLIMITED/INFINITE/FREE CASH IN ROBLOX CASH GRAB SIMULATOR 2018 HOW I GET UNLIMITED/INFINITE/FREE CASH IN ROBLOX ...,0
195,2015-03-15T11:56:20.000Z,dKYT4EB5MWc,"Exodus - When Life Gets Tough, Grab onto God - Bong Saquing","Have God as your go-to. Hang on to Him, admit your insufficiency and get ready to be amazed; God is at work. http://www.ccf.org.ph/location-time ...",0
196,2016-09-23T03:51:40.000Z,Bmv9Cszgwj4,Grab to partner with nuTonomy for driverless car trial,ST VIDEO: AZMI ATHNI.,1
197,2018-03-02T14:28:21.000Z,1dO52ICUvrc,engcon Detachable Grab GRD-Q,engcon's grab cassette is retrofittable/detachable and developed to fit Q-Safe-D quick couplers on engcon Tiltrotators. The grab cassette is simply hooked in ...,0
198,2018-06-28T02:02:39.000Z,iwXBETO4co0,hot secretary in brown leather ass grab,shes fine ass hell.,0
199,2015-05-28T18:38:34.000Z,F9-n7slEctk,mifold - the Grab and Go Booster,"Pre-order your mifold now at http://igg.me/at/mifold mifold - the Grab-and-Go Booster Seat ... mifold is the most advanced, compact and portable child car safety ...",0
200,2015-07-28T10:49:43.000Z,ibQyEx3C6ZI,Grab Wagon Hire York by GGrabs | SME Video Marketing,"Grab Wagon Hire York by GGrabs is a family run grab wagon hire (Muckaway) business providing bulk delivery of compost, topsoil and aggregates in York, ...",0
201,2016-06-19T23:00:00.000Z,Jq4odFKGRYA,Yaeji - Guap (Mall Grab Cover),"No Copyright Photo - @ameaalz (Instagram), by @yung_introvert (Instagram)",0
202,2010-10-28T22:31:15.000Z,Af1fRd1yCSE,Julia Lee & Her Boy Friends / Snatch and Grab It,1947.,0
203,2015-06-18T19:24:15.000Z,G--1Hx6SH1k,Where to Install Grab Bars,"Need to install a grab bar? Chris Tait, president of HandyPro York, will walk you through the optimal locations for installing grab bars. For more information on ...",0
204,2017-11-27T03:45:59.000Z,dQguCYTop8c,AldermachXI Missed Grab Slo-Mo F13 Game,Here I slowed down a grab shown by AldermachXI in Friday the 13th the game. It appears he missed the grab because the Deborah was already past his hand ...,0
205,2016-08-29T07:44:02.000Z,Q4grqWYceyE,SABL land grab news,Short video published by ACT NOW! to illustrate its latest radio advert.,0
206,2015-03-15T11:56:20.000Z,dKYT4EB5MWc,"Exodus - When Life Gets Tough, Grab onto God - Bong Saquing","Have God as your go-to. Hang on to Him, admit your insufficiency and get ready to be amazed; God is at work. http://www.ccf.org.ph/location-time ...",0
207,2007-10-01T11:11:43.000Z,_kmY8g10kU4,"CHAIN ""Grab a snatch and hold it""",Legendary Australian Blues Band Chain. Taken at the Williamstown RSL 12/3/2006. Matt Taylor - Vocals and Harmonica Phil Manning - Guitar Barry Harvey ...,0
208,2017-07-15T07:49:13.000Z,gY53rwnuMTI,Grab Text From Image | Hindi,This video will help you grab text from an image. It can be any picture containing text. This is the simplest way to fetch text from a picture. All you need to do is ...,0
209,2018-03-05T01:52:30.000Z,cBgh8hcgB4g,Grab Handle,Installation of a Grab Handle.,0
210,2017-07-10T14:43:24.000Z,2Ramax6lcd4,Grab a Booth at the 2017 AVCA Convention!,"The 2016 AVCA Convention in Columbus was our largest yet, with over 2700 coaches and exhibitors in attendance. To reserve your booth and get the best ...",0
211,2018-02-09T15:06:00.000Z,Sqj_UxQqfJI,Grab the Sleds for the Adventure of a Lifetime,Gas up the sleds and get ready to go! Wisconsin's top-notch snowmobile trails are open and in great condition. Check our Snow Conditions Report to kick-start ...,0
212,2011-08-12T01:28:57.000Z,07So_lJQyqw,LEMON GRAB UNACCEPTABLE,its unacceptable All copyrighted things belong to their respectable owners.,0
213,2012-02-23T05:20:40.000Z,_vG64yleOts,GRAB IT! 2012 (Jacob TV),GRAB IT! for tenor saxophone and boombox was composed November 1999. Grab it! is based on voice samples from life-sentenced prisoners Video: DELIRIUM ...,0
214,2010-11-20T01:55:44.000Z,GWUWLFylu0I,Tangled - Grab a Friend in Theaters Tomorrow,Become a fan on Facebook and order here: http://on.fb.me/hKyeqw Play the Tangled Double Trouble Game: http://bit.ly/gzzOKb Tangled is now available on ...,0
215,2010-05-14T16:14:08.000Z,JHi10Tdy8ns,Grab Bar Installation on Tile Wall,Learn how to install a grab bar in your bathroom or any other room of your house. Learn more at http://www.grab-bar.com.,0
216,2016-05-07T22:03:23.000Z,Luj95FMpe5k,Chris Evans LEFT BOOB GRAB Compilation | Funny Moments,In which Chris does an endearing gesture when he dies of laughter that tumblr has joked about for the last few years Chris Evans Funny Moments 2016 ...,0
217,2013-12-05T09:40:34.000Z,Qxj_EAd18eo,Nemag clamshell grab Alumina,"Get more information: https://bit.ly/2xcGOJe The new range of enclosed type Nemag clamshell grab, which set new standards in environmentally friendly bulk ...",0
220,2016-10-12T13:05:08.000Z,eyLGO103bx4,Grab a Chair - Rahul at Spotify,"Rahul, Growth Designer, grabbed a chair at Spotify in May 2014. Welcome to Stockholm, one of the fastest growing tech scenes in the world.",0
221,2018-05-29T05:37:24.000Z,M9C61Eg6Lnw,Ryde is Grab's new challenger,"With Uber on its way out of Southeast Asia, a fresh startup called Ryde wants to ensure that Grab won't be the only game in town. ================= Let's ...",1
222,2015-12-14T16:47:56.000Z,62NNwZtbtIA,Collar Grab For Safety - Dog Training,"It is very important for your puppy to feel comfortable with being caught or grabbed when loose. At some point in your puppy's life, he might be loose and ...",0
223,2007-01-24T16:43:07.000Z,taRPwYe1EYA,Grab Your Garmin,Garmin music video featuring Steve Grimmett.,0
224,2018-03-30T23:40:50.000Z,0U-XZYJBtgo,Aidan Falk's Big Grab to Save No Hitter vs. Purdue,Michigan's Aidan Falk makes the over-the-shoulder grab on the right field track to save the No Hitter for Beaubien.,0
225,2016-09-06T16:17:08.000Z,pzER08n5L9A,Pelvis - Dance Freak (Mall Grab's Workers Union Remix),PELVREC001 out now on Pelvis Records. BUY: https://pelvisrecords.bandcamp.com https://soundcloud.com/pelvispelvis.,0
226,2009-10-04T14:47:40.000Z,voQ0xTYvWS4,MyBestEllenCollection Touch or Grab,see all kind of things Ellen can touch or grab. Please enjoy.,0
227,2013-12-03T06:32:33.000Z,DvWIX0cJuQw,Surprise grab,"Great grab, poor flash -- Lowly bronze players surprising themselves www.twitch.tv/malkatraz/",0
228,2013-01-29T23:15:02.000Z,kHVLi8LA_0Q,Michael Grab (Gravity Glue) - Stone Balance Demonstration.mp4,"Michael Grab's Point of View. Demonstrating stone balance with a gopro camcorder. Counterbalance / Point Balance Created: 26 JAN 2013 (""World Rock ...",0
229,2017-04-19T21:37:09.000Z,2QD09PmOqUs,LET THE BASS GRAB YOUR FACE (HOUSE MIX),http://www.soundcloud.com/zacharyblackery ITS A SCORCHER!!! STAY HYDRATED!!! KEEP DANCIN!!! Iont own none of this music n shit so don't sue me ...,0
230,2016-09-08T15:34:42.000Z,ZBZmr3rs3v8,IPhone Grab,Hungry Skua grabs an iPhone...and yes it drew blood.,0
231,2010-05-14T16:36:17.000Z,CpTrhgq6kMQ,Vertical Grab Bar Installation,Learn how to install a grab bar in your bathroom or any other room of your house. Learn more at http://www.grab-bar.com.,0
