,published_at,video_id,title,description,relevance
347,2012-06-02T04:35:51.000Z,r1kbn-LOpes,Cheers - The Slap and Nose Grab Fight,"A clip from the infamous fight between Sam and Diane, featuring not only the slap but the nose grabbing as well.",0
348,2016-05-18T01:30:24.000Z,7_gkmXM7q7w,HOW TO GRAB A GIRLS ASS!,We are out vlogging again and going from store to store. In this video your going to quickly see how to grab a girls ass. Previous Video WHAT A WOMAN'S ...,0
349,2009-04-20T21:51:32.000Z,HpyqSL2Vew0,Hill-Murray hockey - boob grab on live TV,"Minnesota State High School League boys hockey tournament, Hill-Murray vs. Edina. Watch for the grab at the 26 second mark.",0
350,2014-04-02T09:09:57.000Z,V_hKSR2x-aY,NAVARONE - Smash 'n Grab It (Official Music Video),"'Smash 'n Grab' It' is the first single of Navarone's second album 'Vim and Vigor', which will be released 14/05. Buy on iTunes: ...",0
351,2018-02-15T19:19:29.000Z,bWD0MginFgE,Why I Grab My Bobs!,"Listen to Me: https://www.youtube.com/channel/UCMdt0vMjj1EDqwMMo8caZ1Q After two weeks of talking about Valentine's Day stuff, I have so many things to ...",0
352,2018-01-31T08:02:57.000Z,Rlbb7Si45OM,Grab driver mod 5.31.4,Grab driver mod 5.31.4 Terlampir link downloadnya Ada beberapa mod berbeda Silahkan di coba2 saja Sudah saya coba di redmi 2s kitkat 4.4.4 work well ...,0
353,2017-09-05T17:53:51.000Z,86NsHESDiRs,Grab Mod 5.23.0 Easy ping 100% secure,Bypass AR -Bypass root -Bypass xposed -Bypass Fake Gps -Bypass tracking from GC -Easy ping -No softban -100% secure Like and subscribe dont forget !,1
354,2018-05-18T21:34:18.000Z,e1wRba6UxVM,Grab Mod Version 5.39.0 No Softban 100% New system,Like and subscribe dont forget ! Cp/wa +6281294357411 4 years already cr8 mod for malaysian driver now open for singaporean driver Subscribe dont forget ...,1
355,2017-12-07T18:29:47.000Z,VMxc-0Elt_U,MOD GRAB DRIVER VERSI 5.29.0 ALL IN 1 FIX BYPASS,"GRAB DRIVER MOD VERSI 5.29 Untuk yang mau mencoba APK MOD ini, harap di CLEAR DATA terlebih dahulu aplikasi GRAB DRIVER yang terinstal di hp ...",1
356,2018-05-12T16:10:08.000Z,Vda1USxC-84,MOD GRAB BLACK V5.39.0,Percuma bilang gunakan dgn bijak sama aja taunya dijual/belikan juga.. ingat ini mod free gak berkah dijual dibelikan.. Langsung aja udah males basa basi ...,1
357,2017-12-22T07:46:59.000Z,vNzaqqrHjbk,GRAB MOD DRIVER MALAYSIA [[ 0182265696 ]],New Version 5.30.1 already whatapps 0182265696 •bypassAR•Baypass antiroot • Baypass 100% not softban *SKIP AR Tak Jatuh* *Senang Dapat Ping* *Easy ...,1
358,2017-09-03T06:30:07.000Z,g8daE1X-eis,APK MOD GRAB ANTI PERFORMA,"Like, Coment and Subs ya kalo dapet 10000 viewer, link akan saya dibagikan :) Thanks..",1
359,2018-01-15T06:58:50.000Z,cM0DJwJCp0s,Mod Grab RRG7 Team,"Mod Grab RRG7 Team,bagi abang grabbike driver yang sedang mencairi cara agar akunnya gacor silahkan hubungi RRG7 untuk mendapatkan Mod Grab ...",1
360,2018-05-09T00:43:20.000Z,idFUz2HKbPk,Grab Mod Version 5.38.1 No Softban 100% New system,"Subscribe dont forget Cp/Whatsapp Only 081294357411/+6281294357411 -ignore ping ,AR will increase not dropping i always not uptodate to upload the ...",1
361,2018-05-09T06:47:31.000Z,vgz_fGh7WZo,mod Grab 538 transparan,aplikasi ini tdk tuk dijual/belikan gunakan dgn bijak jaga amanah ya abang2 langsung aja lah cocol bagi yg suka kalau gak suka jgn dihina saling menghargai ...,1
362,2017-07-01T18:44:24.000Z,dBDIVfxhmu4,Mod Grab Driver 5.18.0 for Msia/Sgpore Drivers,Grab Driver Apps Modification Version for Malaysian / Singapore Driver version 5.18.0 Benefits:- - Able to hold you acceptance rate if u ignore the job that you do ...,1
363,2018-06-12T04:53:56.000Z,2ficjiAN4oA,MOD GRAB DRIVER [MALAYSIA] V.5.40.0 NO LIMITED SKIP [0184089655],MOD GRAB DRIVER [MALAYSIA] V.5.40.0 NO LIMITED SKIP [0184089655],1
364,2017-08-28T11:28:44.000Z,PTBk-Ho-sPk,"Grab mod 5.22.0 Malaysian Driver easy ping,, Hold AR ,,No Softban,,100% SECURE",Like and subscribe dont forget ! Cp/wa 081294357411 ( +6281294357411),1
365,2018-04-06T06:06:41.000Z,49b25RFTEd0,Mod Grab Gacor No PF V5.36.1,Yuk ah dicocol nih mod Grab No PF V 5.36.1 Cocok instal gak cocok uninstall Grab v5.36.1 http://sprysphere.com/Br8M Gunakan dgn bijak tdk tuk dijual belikan ...,1
366,2017-12-28T05:14:25.000Z,ZCkacv7czbs,GRAB DRIVER MOD V.5.30.1,Dont forget to Subscribe https://www.youtube.com/channel/UCrRFAxxLELeIk-dh1d0vQgw Fiture - bypass root - bypass mock location - bypass forbiden apps ...,1
367,2017-11-07T07:55:45.000Z,KtRV5Tz4Jdk,Mod Grab Bike 5.29.0,Whatsapp 0838 9217 9057 Telegram 083892179057 Telegram @YY_YH_HH.,1
368,2015-09-19T17:00:00.000Z,6gRZl8jcDV4,"GRAB ONTO VEHICLES, SLAP PEOPLE & DRAG BODIES | GTA 5 PC Mods","In this GTA 5 Mods Showcase, I show 3 different Mods which all do extremely random and completely pointless things! ▻ Subscribe for more Videos!",0
369,2017-08-08T22:57:17.000Z,xdZHuFR4OLM,Grab Mod 5 18 0,Like and subscribe dont forget ! Cp/wa 081294357411.,1
370,2017-11-18T09:23:58.000Z,QDdVdXqZf5k,Mod Grab Driver Realbase Performa v5.27.2,Terima Kasih Sudah Menonton Link download mod : http://www90.zippyshare.com/v/uzwGRW5k/file.html Subscribe like dan share.,1
371,2017-11-21T11:10:16.000Z,0kXkmejV_jQ,GRAB SUPER KAYA NAIK LAMBORGHINI || GTA 5 MOD BAHASA INDONESIA,sorry kalo agak jelek keliatanya gua masih nyari app buat ngedit video wkwkwkw hello guys kali ini gua bakal main gta 5 mod lagi dan sekarang gua mau jadi ...,0
372,2017-10-20T02:46:46.000Z,6hGkofpsD44,Mod Grab Tester,"Mod Grab Tester,lagi nyoba Mod Grab Terbaru semoga gacoooorrrrrr.kalau abang mau yang lain bisa mampir ke sini http://bit.ly/2yo5Guw.",1
373,2017-12-16T14:52:53.000Z,ojXvr8ZpI5o,Grab Mod Driver •Baypass AR •,New version Grab 5.29.2 is available https://api.whatsapp.com/send?phone=60182265696 Whatapps now to get it mod #grabdriverkualalumpur ...,1
374,2018-02-01T20:16:56.000Z,Y81DYsl_Mw0,NO AUTO FOOD GRAB MOD | The Sims 4 Mods,"Hey, boo! I'm showing you the No Auto Food Grab after Cooking mod by LittleMsSam. ➫ CLICK HERE | https://www.youtube.com/itsmetroi?sub_confirmation=1 ...",0
375,2017-11-29T09:09:41.000Z,3Ii3BhsvA_o,GRAB CAR HACK JOB MALAYSIA,"Malaysia Grabcar MOOD 100% softban , igrone hold AR!! https://api.whatsapp.com/send?phone=60182265696 Whatapps now to get it mod ...",1
376,2009-12-21T22:11:17.000Z,UpFmOGOxkR4,Grab Mod,Grab mod in GTA IV.,0
377,2018-03-14T18:45:41.000Z,0AI5tJnXUK0,Tes mod grab,Cuma iseng aja..jangan diambil ati...,1
378,2017-03-06T14:42:26.000Z,no2zcXsbKT8,Master of Grab | Dodge mod/ Zed | 15. Word Best player in the Thresh dodge,"Created by VideoShow:http://videoshowapp.com/free Reméleme tetszett! Ha így van dobj egy likot, vagy iratkozz fel!",0
379,2015-10-31T02:50:33.000Z,sp27VgMNuA4,GTA V - Grab & Throw Peds Mod,"Grab nearby peds and throw them at anything: walls, cars, or make them fall to their death. They will sometimes grab onto something for their lives as shown in ...",0
380,2017-11-09T11:46:06.000Z,j2Rmvlr0nD8,APK MOD GRAB PF 5.26.1,"Cuma iseng aja, cuma suka upload aja. Kalo ada yg mau ditanya, boleh coment. Salam Satu Aspal..",1
381,2015-09-14T17:38:33.000Z,vOdzocMY1Rk,GTA 5 PC MODS -  GRAB SCRIPT,GTA 5 PC MODS - GRAB SCRIPT Download : https://www.gta5-mods.com/scripts/grabscript-v.,0
382,2017-12-15T16:59:15.000Z,YTSN__7so_M,MOD GRAB DRIVER VERSI 5.29.2 ALL IN 1 FIX BYPASS (LINK DI DESKRIPSI),"Buat temen2 yg mau nyoba bisa via email aja. Aplikasi y gratis & gak pake donate/donat ^_^ GRATIS, gua cuma minta tolong bantuan temen2 biat ngreview ...",1
383,2017-11-19T16:26:15.000Z,G0yN6MqSrCo,GM FAMILY MOD GRAB DRIVER 5.28.0,"Anti performa,Anti GAGU Gacor sepanjang aspal ---------------+++++++++----------------- http://upfile.mobi/wUOBpuKUSPM ---------------+++++++++----------------- Thx ...",1
384,2016-05-06T15:30:00.000Z,PLN4Q9j3HIE,GTA 5 PC - The Flash Saving People With GRAB ! Grab Peds MOD ! (Ultimate Flash Mod Gameplay),The Flash finally has GRAB ability ! In GTA 5 YEAH ! Now the flash can save people from getting hit by anything ! Even save those falling from the SKY ! :D The ...,0
385,2011-11-17T16:32:20.000Z,ANN97oQJIKU,Gta Sa Helicopter Grab Awesome Mod (Not By Skript47) + [Link],Heli Grab Mod by Pikasso Link : http://www.mediafire.com/?65i6farsae0h106 Enjoy The mod PS:this mod doesnt work in SAMP or MTA :\,0
386,2017-08-28T21:21:12.000Z,tL0fcgxLHAE,MOD Grab,Link MOD : https://drive.google.com/file/d/0B-pAKprIZJkbUmhUNXpRSHJfR0E/view.,1
387,2018-06-28T10:50:00.000Z,pMGEU1zDLQw,Mod grab PF 5.42.1,Cocok pake gak cocok buang No Zip... No pass Grab 5.42.1 http://zipansion.com/1qtKR Kunjung Facebook kami www.facebook.com/radjatube Salam 1 aspal.,1
388,2017-05-02T20:29:05.000Z,vKMsE3Hvsb8,Classic Grab Marth - Super Smash Bros. Melee (MOD),Subscribe! - http://bit.ly/2l6rm9q Long live the Hero-Grab-King. Playlist - https://www.youtube.com/playlist?list=PLicMRanzGjcr-P63PzIIQ_whL-b1VgMk1 ...,0
389,2017-12-18T06:05:52.000Z,pEAt17eJMiM,link download mod grab V.5.29.2,"ketarangan mod grab 5.29.2 jangan terlalu sering melewatakan orderan yang masuk pada aplikasi, pihak grab haya bisa deteksi secara manual lewat history ...",1
390,2017-11-14T13:58:18.000Z,8OJOEr2_1qQ,Tes fake gps+mod grab,Fake gps sangat membantu pekerjaan driver online yg mau pake tinggal pake yg gak mau jangan ngebuli.,1
391,2015-09-26T17:17:09.000Z,EMffq3yVYJo,GTA 5 PC MODS - EUPHORIA GRAB SIMULATION,GTA 5 PC MODS - EUPHORIA GRAB SIMULATION Download : https://www.gta5-mods.com/scripts/euphoria-grab-cooperation-simulation#comment-202370.,0
392,2018-01-31T01:06:21.000Z,QcdEDMRxKdc,LATEST GRAB MOD 5.31.4,For = -Singapore -Malaysia -Philiphine -Thailand -Bypass AR -Bypass root -Bypass xposed -Bypass Fake Gps -Bypass tracking from GC -Easy ping -No softban ...,1
393,2016-06-19T01:16:48.000Z,s7vYSHzYM_A,GTA V - Grab & Throw Peds Mod,"Hilarious stuff, download here:https://www.gta5-mods.com/scripts/grab-throw-peds.",0
394,2010-02-17T07:26:11.000Z,fk7Hs-ra0gc,POLICE  GUN GRAB TRAINING.MOD,มีปืนแล้ว ต้องรักษามันไว้ให้ได้ก่อน แล้วที่เหลือค่อยเอาปืนมารักษาชี...,0
395,2017-10-14T21:40:10.000Z,-937QVm2XRM,"5.25.0 Grab Mod Version ,, Tired work Hard ?? Anggoro MOD is the solution",For = -Singapore -Malaysia -Philiphine -Thailand -Bypass AR -Bypass root -Bypass xposed -Bypass Fake Gps -Bypass tracking from GC -Easy ping -No softban ...,1
396,2017-07-05T16:20:56.000Z,EgJFHzNh-t4,Ready mod grab 5.19,Minat hubungi saya via tele 089514944559 support grabnow Tahan performa.,1
397,2017-02-17T23:06:01.000Z,J7Dy08-VGx8,IJOY MAXO Zenith Box Mod Review - Get ready to grab THUNDER,Review for the IJOY MAXO Zenith Box Mod Get ready to grab some thunder and smash some clouds Thanks for watching and subscribing ...,0
398,2017-10-31T15:59:52.000Z,RJ813G1BTdk,MOD Grab 5.26 AntiPerfoma,Yang pentiing semangaaaat. Jangaan malees. :-),1
399,2015-11-01T02:51:51.000Z,iQTqVmnP4Gc,GTA V - Grab & Throw Peds,Grab & Throw Peds by jedijosh920 https://www.youtube.com/user/jedijosh920 Download https://www.gta5-mods.com/scripts/grab-throw-peds.,0
400,2017-11-30T17:27:44.000Z,CRt15OcBolk,MOD GRAB 5.29.0,https://www.mediafire.com/file/9theoint4wkg9ev/5_6120552177481023511.apk Link nya di atas silahkan sedot.,1
401,2018-06-10T22:52:39.000Z,MmO057ylCsE,OPEN 10 SLOT GOJEK/GRAB MOD ONLINE,"Komentar dibawah untuk link tele, No tanya2 rasakan dan nikmati hasilnya Fitur : No detek Bypass Full No Modul No delay Realbase Fake tuyul TJK wajib 5380 ...",1
402,2017-08-08T21:43:26.000Z,a23wyev1Zxw,Grab Mod 5 17 0,Like and subscribe dont forget ! Cp/wa 081294357411.,1
403,2013-07-18T00:09:49.000Z,LAZ6kzbGddQ,Grab Mod FUN -Gta IV multiplayer,Gracias por mirar y si te gusto dale una manito arriba!!!! :D ... ya sabés si te gusto mucho... aprete el boton que dice suscribir :3.........GRACIAS CHICKTWICE.,0
404,2017-04-15T11:00:01.000Z,2t7UdOyA0Og,Grab and go! - Uplink OS v 1.04(Mod for Uplink) - Let's Play Part 3,"Uplink OS is a mod for Introversion's awesome hacking simulator, Uplink. It overhauls the graphics and promises to make some gameplay improvements. I hope ...",0
405,2017-11-11T10:11:45.000Z,2R9MntLONjE,Mod Grab 527,"Selamat datang di channel YouTube saya. Jangan lupa like, share, comment dan subscribe yaa ;) Find me on : https://www.instagram.com/sergiherdianto_ I ...",1
406,2017-04-18T09:00:01.000Z,IRRIHz95Uec,LAND GRAB 2 | GTA V Ep #222 (NOU MOD),Bercea: https://www.youtube.com/channel/UC28RpfWWLPgZVV3hcxaJsPw ▻Like/subscribe/share daca mai vreti episoade incontinuare :D ...,0
407,2014-12-03T17:00:07.000Z,7-ziAblbYUU,Garry's Mod: Smash 'n' Grab with the Asdfs,I gotta get outta here follow me on twitter/facebook: http://twitter.com/Dokudokus http://www.facebook.com/DokudokusYT livestream: ...,0
408,2017-10-23T14:32:10.000Z,squhtmKegso,Jeep Mod Under $50 - Rough Country Jeep Front Grab Handle Install,Purchased a pair of Rough Country Jeep JK Front grab handles and installed them in my 2016 Jeep Sahara JKU. A somewhat comprehensive review and install ...,0
409,2018-06-19T20:56:20.000Z,7hNJOmWoG60,Mod Jaket Grab Gta sa android,Ane mau share mod jaket grab yang ane retex dari sweter.. Maaf ga ngasih tutor cara pasangnya cuma sempet bikin video pendeknya aja.. Tutor cara ...,0
410,2016-08-12T04:51:40.000Z,noRYqO_q8W4,fallout4.blog.jp MOD Review - Grab the Damn Mag by Monkatraz,Download: http://www.nexusmods.com/fallout4/mods/17299/? Review: http://fallout4.blog.jp/archives/64901659.html.,0
411,2013-12-12T20:59:03.000Z,OKxMrT4Jkw8,re 3.5 contamination mod. zombie grab from the grave (test),zombie grab from the grave http://www.survival-horror.pp.ua/,0
412,2017-11-21T20:33:07.000Z,H9lshHIpdi0,New Brutal Doom Grab Sprites,Link to sprites: https://drive.google.com/file/d/1Ya1dFhZ9ot64L_sX2fAggGqJR88JR3pZ/view?usp=sharing Moddb: ...,0
413,2017-12-15T15:51:41.000Z,pEpRl6qSs7U,Mod Grab Driver v.5.29.2  Full bypass,Linknya ada di bawah Cara donwloadnya https://youtu.be/pEAt17eJMiM Cara instal https://youtu.be/ec457JRhiGI https://youtu.be/DPYuihv3rSg ketarangan mod ...,1
414,2017-03-20T12:56:31.000Z,GDwZ2_XDC84,The Bank Heist RP -  Clowns grab the money ! - GTA 5 Online Roleplay Mod,Subscribe for more great videos  https://goo.gl/NMECpD Playing on GTA 5 online roleplay mod (RP) ( Fivereborn ) Me and my clowns out the do a bank heist ...,0
415,2017-04-28T14:08:27.000Z,WOorM7z-7Ck,GRAB Mod AutoMental,Buat nahan persentase penerimaan. order cukup dilihat saja. di detik terakhir otomatis mental.,1
416,2017-11-18T02:05:22.000Z,55l_AKlAm9U,GTA 5 Funny moments (GTA 5 Fails Compilation) Grab & Throw,GTA 5 Funny moments (GTA 5 Fails Compilation) Grab & Throw let me know in the comments below what you want to see next in GTA 5 test series & gta 5 funny ...,0
417,2011-09-25T10:17:52.000Z,CZkUAA8eTbo,Grab mod,Fallout 3/New Vegas mod that allows you to pick heavy objects up with ease and allows you to run with them.,0
418,2017-08-08T21:41:05.000Z,3R0TCN-tgIc,GRAB MOD 5 16 0,Like and subscribe dont forget ! Cp/wa 081294357411.,1
419,2016-01-18T12:42:10.000Z,54AShcRr4KE,Project Zomboid Smash And Grab Mod,Mod located here https://github.com/Gobaan/PZSmashAndGrab.,0
420,2018-03-18T19:15:51.000Z,W9GxT7Z_Zd0,My Summer Car : Gun Mod  Grab anything Mod,I will do A Video Later On showing You How to Install these.,0
421,2018-02-22T23:30:53.000Z,PeSCG07g6m0,cs 1.6 mod jb hook+grab ,like and subscribe please  For hook go console and say   Bind v +hook For grab go console...,0
422,2012-06-27T19:33:01.000Z,3QJtujVGXYw,GTA IV Grab script and blastforce mods,Fun with grab script and blastforce mods lol. Download grab script: http://adf.ly/A7rv9 Download blastforce: http://adf.ly/A7rw0 Trainer for various mods: ...,0
423,2017-11-06T08:26:46.000Z,bLlI8XLuma0,RfMod Grab 527,"RfMod Grab 527 ini sangat mantap nih bang,gacor banget.",1
424,2016-04-20T02:03:54.000Z,r8uANIA2KLU,Naruto Storm 4 - PTS Naruto Mod: Progress 2 (Fixed Awakening Grab For PTS Sasuke),Download Link For PTS Naruto: http://www.mediafire.com/download/98v80r0cjjb0u9j/NS4+-+PTS+Naruto+Mod+Progress+2.zip Download Link For PTS ...,0
425,2017-08-08T22:44:55.000Z,DvNKNJgfVsA,Grab Mod 5 17 0 2,Like and subscribe dont forget ! Cp/wa 081294357411.,1
426,2015-12-15T15:59:40.000Z,yNCiQvHe3X4,Grab Anything 1.0 - GTA V | EnRoMovies,GREAT SHOP ! Here You Can buy every GAME but CHEAPER ! ! ! https://www.g2a.com/r/thebestshop SOCIAL MEDIA: JOIN TO MY TEAM ...,0
427,2017-06-05T17:00:03.000Z,ea0FDtF4zG0,My Summer Car Mods - Grab Anything | God Mode | Satsuma Tuning and More! - My Summer Car Gameplay,"Mods are a thing in My Summer Car. I have some cool ones installed on my computer. Amongst them are mods that alter the way I have needs, in other words I ...",0
428,2016-08-11T13:30:35.000Z,gtXjfqQi110,Grab the Damn Mag showcase,Replaces the SMG reload animation with something more compatible with weapon mods.,0
429,2017-06-19T10:32:17.000Z,v8EDRrNM_9A,READY MOD GRAB 5.18,Anti PF Minat hubungi 089514944559 Aplikasi dikirim via telegram.,1
430,2016-06-30T11:49:18.000Z,EqdbhUauAvA,Grab and Scrap Items - Fallout 4 (XBox no mods),"A documentation of the items that can be picked up, but not put into your inventory. If brought back to any settlement, the items can be scrapped for resources.",0
431,2016-12-09T22:00:00.000Z,DEoPLOnMWR0,AFRICA RESOURCE GRAB [32] The Great War Mod - Hearts of Iron 4 HOI4 Paradox Interactive,Watch the whole series: https://www.youtube.com/playlist?list=PL-azHLkqdWyOY9zP0n0u7XZmAl3InQncv Enjoy my content? Support me on Patreon!,0
432,2017-11-19T14:41:27.000Z,y6vJxLeZgHk,Grab Gm Family,"Grab GM Famaly,slah satu mod grab andalan abang abang pejuang Ojek Online.silahkan di cek bang http://bit.ly/2zTxxp0.",1
433,2016-11-24T00:34:55.000Z,SsGUF1IrsKc,Fallout 4 Mod Review 100 - DONALD TRUMP MODS.. GRAB HER BY THE KITTY KAT - Boobpocalypse,Welcome to Fallout 4 Mod Review Boobpocalypse Episode 100! Trump is coming to the Commonwealth as the Donald Trump Companion and he is going to ...,0
434,2017-02-07T22:49:41.000Z,cC9Qda2zOVk,Clutch and Grab | Ep#7 XCOM 2 with Long War 2 Mod | Commander Difficulty Gameplay,"XCOM 2: Long War 2 Mod, Commander Difficulty Playthrough Episode #7 - Clutch and Grab I set out to capture or kill an enemy VIP. It's a slow start but one hell ...",0
435,2015-11-27T07:08:22.000Z,MJ1MwhDGZC0,Fallout 4 - Deathclaw no grab Mod,"A mod that removes the grab attacks of Deadclaws, making melee fights less tedious. Link: http://www.nexusmods.com/fallout4/mods/2981/?",0
436,2017-12-10T20:29:18.000Z,0W66iPnWiJs,My Summer Car: Messing with the Police with Grab anything Mod,(This video is Rated NR By ERSB ) we try to get A DUI and use A few mods to Mess with the cops.,0
437,2016-12-14T13:46:58.000Z,zEq7cJ1Vd68,Hydraulic log grab - mod. PROFESSIONAL,Hydraulic log grab - mod. PROFESSIONAL www.agriway.com.,0
438,2011-02-17T21:37:13.000Z,NJ6-8SXR1g0,MSC ADAMS modeling Bulk Grab mod iso,Bulk Grab - MSC ADAMS model.,0
