,published_at,video_id,title,description,relevance
232,2016-10-14T15:26:01.000Z,yumP-9FmNhE,"Donald Trump RAP SONG - ""Grab Them By The Pussy"" - (Brandon Carter) Access Hollywood Hot Mic Parody","""They Let You Do It"" - Donald Trump RAP SONG (Brandon Carter) Download http://bit.ly/2eaICcH Click here to attend THE RENEGADE SUMMIT ...",0
233,2017-10-30T16:51:09.000Z,hq2yNYXwtxo,"Lake Kingdom #25 Jump, Grab and Climb Some More | Super Mario Odyssey","Lake Kingdom #25 Jump, Grab and Climb Some More | Super Mario Odyssey.",0
234,2016-10-03T03:12:12.000Z,TeCQatNcF20,Glitchy Descriptor Firmware Grab - scanlime:015,"To understand a program, it helps to see it first. This episode is all glitching and USB, turning a chip's environment against it to slurp out hidden code. Get the ...",0
235,2014-05-15T12:09:51.000Z,Wv0nBT8lh7A,Stefani Five-O - How to: Indy Grab - Fruit Shoot Skills,"Stefani Five-O shows you how to do the Indy Grab, a truly classic skateboarding trick to master. Subscribe: http://www.youtube.com/user/fruitshoot Visit our ...",0
236,2018-02-22T12:47:53.000Z,Dx-ub6O6Jt8,RDX - Grab (Lyric Video) Feb. 2018,Grab performed by RDX. Produced by Blaqk Sheep Music. (C) 2018. RDX - Grab (Lyric Video) Feb. 2018 RDX - Grab (Lyric Video) Feb. 2018 RDX - Grab (Lyric ...,0
237,2017-01-30T07:36:16.000Z,e0KhOV0TIFs,"Pac Man, But Only Using Trampoline and Grab",Reuploaded because the 1st one wasn't in 60fps for some reason) Only trampoline and grab/throws allowed. Found this in the comments section of one of ...,0
238,2008-06-18T15:41:01.000Z,8QwNKF3iE8k,Ikkyo: Aikido Techniques : Ikkyo from a Lapel Grab,"Ikkyo from the lapel grab, or Katetori, is a martial arts technique that allows you to move off the line of attack and control an opponent's head, and is an essential ...",0
239,2016-11-17T12:09:27.000Z,D0nltydkI_U,Mall Grab - 2 B Reel - House Crime Records,Available to pre-order now: http://www.juno.co.uk/products/steven-bc-mall-house-crime-vol-2/621987-01/,0
240,2014-10-03T15:36:27.000Z,VTlnswdlfwE,GoPro Grab & Elbow Drag,DO NOT TRY ANY OF THIS! OG GoPro Grab + Never before done neutral-coasting-right-knee-dragging-right-hand GoPro Grab! Also an appearance by ...,0
241,2017-01-16T14:27:25.000Z,YkeWIAonku0,[Basics] How to automatically grab objects,"A commonly asked question is how to automatically grab interactable objects either when the scene first loads, when a certain event happens or when the ...",0
242,2016-11-27T03:58:07.000Z,KCLD5_NBffc,God to American People: Grab Onto Bernie Sanders with Both Hands!,Intuitive Counselor/Psychic Medium Christine Pavlina channels the Divine's message for the American people. https://www.christinepavlina.com/,0
243,2015-11-10T19:26:33.000Z,G_KsII-FNNY,Mall Grab - Happiness,Mall Grab kicks off the first vinyl release from the newly formed label Shall Not Fade. We are proud to present our premiere of Happiness over some raw footage ...,0
244,2015-06-25T13:33:44.000Z,PFpqgUXkslk,Hundreds - Grab The Sunset,"Hundreds - Grab The Sunset (Tame The Noise Version) recorded at Studio Nord, Bremen Buy ""Tame The Noise"" digitally here: http://smarturl.it/ttn-it ""Grab The ...",0
245,2015-06-25T13:33:44.000Z,PFpqgUXkslk,Hundreds - Grab The Sunset,"Hundreds - Grab The Sunset (Tame The Noise Version) recorded at Studio Nord, Bremen Buy ""Tame The Noise"" digitally here: http://smarturl.it/ttn-it ""Grab The ...",0
246,2013-02-12T07:37:02.000Z,M-W7Pmo-YMY,How to Nose Grab Snowboard - Snowboarding Tricks,KEVIN'S TOP GEAR PICKS SNOWBOARD: http://bit.ly/2mlOZcJ GOGGLES: http://bit.ly/2kvQzLu HELMET: http://bit.ly/2kml7vT JACKET: http://bit.ly/2km8GQy ...,0
247,2010-03-13T17:07:37.000Z,Z2jT3VdT4xU,Masta Killa - Grab The Microphone,"Album: No Said Date Year: 2004 Track: 2 Track Produced By: Brock Samples: ''Big Mac'' by Curtis Mayfield Lyrics: [Masta Killa] Yeah, it's like salutation, greeting ...",0
248,2015-11-08T11:25:54.000Z,V2ES_EffWbg,Mall Grab - Purity (Ft. Yaeji),"From: ""MG Sides"" (Mall Grab, 2015). More info: http://www.discogs.com/Mall-Grab-MG-Sides/release/7218651 https://soundcloud.com/mallgrab ...",0
249,2016-03-22T19:55:02.000Z,GJIhUFjEzmI,Mall Grab - Father,Buy : https://www.discogs.com/Mall-Grab-Steel-City-Dance-Discs-Volume1/release/8754572 https://www.facebook.com/grooveselection1/,0
250,2018-03-26T08:03:52.000Z,Fli77-8zp_Q,Competition watchdog not yet notified on Grab-Uber deal,"Neither Grab nor Uber has notified the Philippine Competition Commission over their deal which is supposedly the biggest of its kind in Southeast Asia, the ...",1
251,2018-06-29T07:01:53.000Z,pEOSoV8DqlI,Grab Lab. World 2. Level 24. Walkthrough.,Grab Lab. World 2. Level 24. Walkthrough. Leave the comments with the games you would like to see at my channel! Пишите какие еще игры вы хотели бы ...,0
252,2018-06-29T06:16:16.000Z,tWEzlnABdYQ,Grab Lab. World 2. Level 21. Walkthrough.,Grab Lab. World 2. Level 21. Walkthrough. Leave the comments with the games you would like to see at my channel! Пишите какие еще игры вы хотели бы ...,0
253,2018-06-29T07:13:34.000Z,_DX05eCIy3M,Grab Lab. World 2. Level 25. Walkthrough.,Grab Lab. World 2. Level 25. Walkthrough. Leave the comments with the games you would like to see at my channel! Пишите какие еще игры вы хотели бы ...,0
254,2018-06-29T06:29:41.000Z,9cVLo7cLT3o,Grab Lab. World 2. Level 22. Walkthrough.,Grab Lab. World 2. Level 22. Walkthrough. Leave the comments with the games you would like to see at my channel! Пишите какие еще игры вы хотели бы ...,0
255,2018-06-28T18:00:01.000Z,Njj9Bh_B5sU,Grab Lab. World 1. Levels 11. Walkthrough.,Grab Lab. World 1. Levels 11. Walkthrough. Leave the comments with the games you would like to see at my channel! Пишите какие еще игры вы хотели бы ...,0
256,2008-10-09T12:21:46.000Z,c7u41VlxkLE,Chain - Grab a snatch and hold it (snatch it back & hold it),"Chain - Grab a snatch and hold it . 1972 ,Their version of Junior Wells' ""Snatch It Back And Hold It"", re-appropriated here in true Aussie ratbag fashion as ""Grab A ...",0
257,2018-06-26T14:17:56.000Z,qw9THV76zv4,"Grab Academy to train 2,000 Grab drivers","Ride-hailing giant Grab implements Grab Academy, a program for drivers who did not receive formal training in driving.",1
258,2018-06-21T03:25:37.000Z,oGpGca9vOPI,Grab mod 5.39 Smile time,Tes kegacoran.. like dan subcribe apa bila ada yg bermanfaat u/ anda dlm video ini #grabmod.,1
259,2017-05-17T23:55:00.000Z,O2XVEtVuN0Y,The Top 29 Occasions to enjoy a cigar (f. Grab-A-Gar),There are literally countless occasions and reasons to enjoy a cigar. Here are just 29 of them. Drop us a comment with your best occasion for lighting up a good ...,0
260,2016-08-21T02:31:45.000Z,71VOjxrP8dw,"Smash & Grab 12 Oaks Mall, Novi,MI, recorded from cellphone",Thiefs break into Rolex watch case with hammer. Look at the right hand side employee tries to grab suspect. He then grasp free and runs toward closed door.,0
261,2017-04-15T17:17:09.000Z,JDYz1hxDqZs,JOWST - Grab The Moment (Instrumental),for entertainment purposes only subscribe and enjoy karaoke version norway - eurovision 2017 Lyrics: They read me like a book that is open While punching on ...,0
262,2013-03-19T17:58:27.000Z,jDoK_IjUfmI,GEAR GRAB MINI DOCUMENTARY,"Gulf of Maine Lobster Foundation's GEAR GRAB initiative is designed to inform, involve, and improve the lives of fishermen and the communities in which they ...",0
263,2017-07-31T15:08:59.000Z,pH7dzqNCPzc,Kid tries to grab rope ends up falling off the edge(Almost hit rocks),Kid tries to grab rope ends up falling off the edge(Almost hit rocks) Twitter:@lilkidofficial.,0
264,2015-10-05T23:46:32.000Z,CmlAXehAje0,Mall Grab - Drive,Artist: Mall Grab Release: Elegy Label: 1080p Cat: 1080V003 Free track DL: https://soundcloud.com/1080pcollection/mall-grab-drive Bandcamp: ...,0
265,2018-04-14T07:02:02.000Z,Bi7Ik8hakCI,Spotlight: Things You Need to Know About Online Dating!,"Behold the horror stories of online dating and dating apps! ""Tinder only has people looking for sex? Paktor is too expensive? No Singaporeans on Badoo?",0
266,2018-05-13T07:00:05.000Z,hOk4tArbhOA,THE REAL HOUSEWIVES OF YISHUN!,"Suspecting something is up with your spouse? Let the Housewives of Yishun get to the bottom of the case! Also, please take a moment to appreciate the ...",0
267,2018-03-04T07:00:29.000Z,qzIMUiluksM,Shit Annoying Customers Say,Share with us your most annoying customer experience! A huge thank you to our location sponsors! Flesh Imp Flagship Store Cathay Cineleisure Orchard ...,0
268,2011-09-26T16:19:46.000Z,HYt4UigHv0w,Grab Bar Installation For An Accessible Bathroom,Installing a bathtub or shower grab bar is easy with these step by step instructions and will make your bathroom more accessible to those with limited mobility.,0
269,2012-06-23T22:55:42.000Z,wxUWScCHQXQ,Self defence - Double handed throat grab,http://Ripsaw-defence.co.uk RIPSAW is a self defence system that uses Combatives and Mixed Martial Arts techniques and principles for Personal safety.,0
270,2011-06-01T12:41:26.000Z,_Pcg85iKMVs,Mobeli portable grab bars,"The patented System Mobile from ROTH is a practical helper, which has proven itself for years in everyday life for disabled and elderly people. The mobile ...",0
271,2017-03-14T15:12:31.000Z,EoVprj-0AMk,Grab On,"Hey guys. Ia sold girl scout cookies at a booth for the first time. She was nervous but did a great job. After, we came home for a much needed chill day.",0
272,2016-06-10T11:18:23.000Z,eViRL255p5g,Mall Grab - Menace II Society - Unknown To The Unknown,More info coming soon!,0
273,2010-03-30T21:27:16.000Z,dxd0Q2WQnlk,SNATCH AND GRAB IT - Julia Lee - 1946,"Snatch and Grab it by Julie Lee 1946 recorded from the original Capitol 78 RPM record and played on a Dual 1229 turntable My aunt knew Julie Lee, they use ...",0
274,2015-10-22T19:47:00.000Z,SZjPawLilKQ,H1Z1 Funny Moments #2: GRAB MY SHIT GUYS,Discord: https://discord.gg/BW5QyUG ▻Patron: https://www.patreon.com/andrewjrt ▻Twitter: https://twitter.com/andrew_jrt ▻Twitch: ...,0
275,2016-11-11T20:37:05.000Z,8Ov5v8l96ZA,GRAB HIM BY THE STINGER,Thank you to Primary for sponsoring this video! For 25% off your first purchase and FREE SHIPPING http://www.primary.com/defranco PromoCode: Defranco ...,0
276,2008-09-24T23:44:18.000Z,E5IFbAT1wtk,Tai Chi Martial Art Applications : Tai Chi: Grab From Behind Defense,The Tai Chi brush knee movement is a great defense to use when an opponent attempts to grab you from behind. Learn to take brush knee and apply it to ...,0
277,2016-11-16T22:55:35.000Z,njOvnikCw9Q,EPIC 2-IN-1 Claw Machine DOUBLE PRIZE GRAB WIN at Friendlys!,EPIC 2-IN-1 Claw Machine DOUBLE PRIZE GRAB WIN at Friendlys! Follow me on Instagram https://www.instagram.com/clawboss_/ Follow me on Twitter ...,0
278,2016-12-26T08:22:06.000Z,qILcsRvPfUo,how to grab the neighbor and players,PLS SUBCRIBE AND LIKE.,0
279,2017-03-24T08:00:04.000Z,jG1aenCW3Po,Paradis - Recto Verso (Mall Grab Remix),"Paradis - Recto Verso (Mall Grab Remix) From the Maxi Single ""Recto Versions"": https://barclay.lnk.to/ParadisRectoVersions Directed by Andrea Montano ...",0
280,2015-10-16T00:30:00.000Z,V7M00FiBWxY,Kidsmania Grab Pop with Toy Claw & Fruit Flavored Candies,"For more Play Doh/Disney Toys, subscribe!! http://bit.ly/1huxQDc Watch more Play Doh/Disney Toy videos!! http://bit.ly/1KPKqzS Follow me on INSTAGRAM!",0
281,2015-03-06T18:58:15.000Z,DhyaHHnG9z8,MALL GRAB - GUAP,https://www.facebook.com/stillmallgrab https://soundcloud.com/mallgrab https://twitter.com/stillmallgrab.,0
282,2018-01-11T13:00:02.000Z,Z7RPX2QCYao,Jeep Wrangler Grab Bars - How to Install - GraBars,If you enjoy my videos please purchase from https://shavenation.com/ and use the links below to support my channel so that I can keep making these videos.,0
283,2018-02-24T20:00:01.000Z,G7qk0wep40k,GRAB UR DOG BY THE HEAD,today we celebrate some goodgood dogs. SUBSCRIBE HERE: https://www.youtube.com/channel/UC6IijBsVf2PlWo_uq6P9wQw?sub_confirmation=1 WATCH ...,0
284,2018-03-16T04:12:33.000Z,1MAOoetvSLI,The Truth About A Gun Grab,_(ツ)_/¯ Join the Message Board/Foum: https://thecontingencyplan.createaforum.com/ Find the blood: ...,0
285,2018-05-19T03:51:57.000Z,bg4SIee38h8,Golden Knights edge Jets to grab 3-1 series lead,Reilly Smith scored the go-ahead goal in the 3rd period to lead the Golden Knights to a 3-2 victory in Game 4 of the Western Conference Final.,0
286,2011-08-14T17:09:41.000Z,5a06tGdwKGs,Looff Carousel - Grab The Brass Ring,"The Looff Carousel one of the few remaining ring tossing carousels left, let's see if we can ""grab the brass ring"" and feed the clown.",0
287,2010-03-15T20:29:32.000Z,tGgz4wZ_-MQ,Cash Grab Booth!,"Cash Grab Booth as part of Grabbin' O' the Green shopping and dining event, Downtown Howell, March 17th, 2010, from 12:00 to 8:00 p.m..",0
288,2016-09-19T15:00:53.000Z,LoGkwljVamA,Mall Grab - Kalumbo,http://www.redeyerecords.co.uk/vinyl/76981-hotshit027-mall-grab-i-just-wanna https://www.facebook.com/stillmallgrab https://soundcloud.com/mallgrab ...,0
289,2011-01-25T00:15:13.000Z,Zf16YtSOaUQ,"John Belushi - Animal House - Best Quote Ever ""Grab A Brew Don't Cost Nothing""",John Belushi at his best in Animal House Grab A Brew Don't Cost Nothing A classic quote of all time.,0
290,2016-10-12T07:51:44.000Z,Whdw_xlGS-s,Grab a Chair - Move to Stockholm,"You might have stumbled upon one of these before. Yes, it's a chair. But it's also rediculously bright summer nights, uber local craft beer, instagrammable food, ...",0
291,2013-04-30T00:01:40.000Z,yynKTqJFK5s,How Americans Grab the Remote - Overcomplicating,Lazy people need to grab the TV remote somehow. Why get up off the couch to grab it when you can build a machine to do it for you! In this video I combined ...,0
292,2017-06-13T16:06:34.000Z,Yhs9lp7XqRA,U20 Highlights: Georgia grab first ever win over Argentina,Follow World Rugby on social media: Official Website! http://www.worldrugby.org/u20 SUBSCRIBE to our YouTube Channel For More Great Videos ...,0
293,2017-05-18T20:35:03.000Z,qKw942Zn7kY,Rockbalancing Demonstration by Michael Grab (Gravity Glue) - 1405,"Stone Balance Demonstration by Michael Grab (Gravity Glue) Location: Boulder Creek, Boulder, CO Recorded: 01 May 2014 3-rock Continuous Counter/Point ...",0
294,2018-06-28T01:00:17.000Z,Wpic1wIDhvU,chips 2017 ass grab,sheriff chick ass grabbed in chips.,0
295,2017-03-12T20:37:45.000Z,UWg3KTlpS_o,"Zero Fox Given: Police Grab BASE Jumper, But She Jumps Anyways!",Subscribe here http://bit.ly/Teem-YTube for more aerial awesomeness from Teem! For licensing/usage please contact: licensing@jointheteem.com ___ ...,0
296,2017-05-17T21:06:43.000Z,ZD4htrzvGGc,RAW: Surveillance camera captures smash-and-grab jewelry store robbery at Park Meadows Mall,"A surveillance camera captured Marquis DeShawn McDonald, of Detroit, and accomplices completing a smash and grab robbery of a jewelry store at Park ...",0
297,2017-06-14T17:10:13.000Z,j3ssad0qZuU,CASH GRAB! An Original Game by Intel!,Is it a game? Or real life? Special thanks to Wifeysauce for designing the cards!! ▷ Stuff in this video: Toilet Mug: http://amzn.to/2t2NXpm Customizable Easy ...,0
298,2017-03-08T16:11:22.000Z,ALfQ6r3ajYs,GRAB 100 PEN!S CHALLENGE! (GONE WILD),Sexy Girl Touching Strangers Private Part Primera Dominicana En Tocar 100 pen!s Penes Niti2Show ...,0
299,2016-04-06T20:11:00.000Z,fR6YBZ8CTuw,Mall Grab - Let U Kno,Hokkaido Dance Club #2 https://bleep.com/release/72098-mall-grab-let-u-kno https://www.juno.co.uk/products/mall-grab-let-u-kno/607048-01/ ...,0
300,2016-12-27T19:51:25.000Z,DU6vFlvFpcs,GOBLIN Ep 7 – I Can Grab the Sword!,GOBLIN 쓸쓸하고 찬란하神-도깨비 | Starring Gong Yoo & Kim Go Eun | Watch Now on DramaFever! Watch Goblin Now! New Episodes Available!,0
301,2016-01-17T17:04:29.000Z,L7P1XkP_fbc,Mall Grab Mix Inverted Audio 199,I do not own any rights of the music. Support the artist if you like what you are hearing. https://soundcloud.com/mallgrab http://inverted-audio.com/mix/mall-grab/,0
302,2012-09-06T16:43:52.000Z,kQx9SRDAESo,Loctite PL Fast Grab Premium Construction Adhesive,Learn more about this NEW product: http://bit.ly/13hgiX1 Loctite PL Premium FAST GRAB Polyurethane Construction Adhesive is a construction adhesive that ...,0
303,2017-01-21T20:16:39.000Z,PwWux5BAczk,Grab them by the Pussy Donald Trump,Donald J. Trump is heard using vulgar terms where he bragged about grabbing women by the p---y in newly surfaced footage from 2005. Donald Trump Vulgar ...,0
304,2014-02-21T20:28:54.000Z,qRzuTjbIqco,"Souls Of Mischief - Get the Girl, Grab the Money and Run","Music video by Souls Of Mischief performing Get the Girl, Grab the Money and Run. (C) 1994 RCA Records, a division of Sony Music Entertainment.",0
305,2016-11-08T17:05:02.000Z,NPrG3dgpTXE,Grab US by the pussy - Deleted Scenes | NEO MAGAZIN ROYALE mit Jan Böhmermann - ZDFneo,"Die besten Momente eines Films findet schon man im Trailer, das ist bekannt, und die wirklich lustigsten Szenen findet man selbstverständlich immer in den ...",0
306,2011-05-31T18:52:13.000Z,i5jTH89HjTA,The Jerk (6/10) Movie CLIP - The Opti-Grab (1979) HD,The Jerk movie clips: http://j.mp/1L6RYNt BUY THE MOVIE: http://amzn.to/u0RaXH Don't miss the HOTTEST NEW TRAILERS: http://bit.ly/1u2y6pr CLIP ...,0
307,2018-06-14T23:46:52.000Z,0sW0rD5V5Ew,MUST GRAB DRUGSTORE PRODUCTS!!,"GIVEAWAY!!   - TO ENTER - TURN ON post notifications and comment ""DONE"". Thats it! I will PayPal/venmo the winner $100!! winner will be announced ...",0
308,2011-04-29T22:24:06.000Z,Bj4yn1RBxHs,"Met Undercover Snatch and Grab Squad at Soho Square - April 29, 2011",http://4TheRecord.org + http://www.youtube.com/MetPoliceFarce Full Video: http://www.youtube.com/watch?v=W8VzfnZKxqg FIT Officers = PC Glen Williams ...,0
309,2018-01-02T20:00:03.000Z,ln1Z_eZgHus,"HOW TO MAKE LO-FI HOUSE LIKE MALL GRAB, DJ SEINFELD, ROSS FROM FRIENDS, AND DJ BORING (+ SAMPLES)","Get my sample packs here: https://julienearle.bandcamp.com/ I couldn't find any good tutorials on how to make lo-fi house, so I went ahead and made one to try ...",0
310,2016-02-29T10:04:32.000Z,5t07GG_3C8c,Mall Grab - Down,Church M001.,0
311,2011-04-07T00:59:09.000Z,ywZ6KdKUEUw,Moka Only - Grab Grab Grab (Music Video),"Moka Only Grab Grab Grab Music Video from ""Airport 5"" coming April 14th through Wandering Worx Music... Buy @ http://wanderingworx.com/shop Join Moka ...",0
312,2016-10-07T21:58:38.000Z,o21fXqguD7U,"Trump Gets Caught Saying ""Grab Her by the Pussy""",It was a hot mic situation and Donald Trump had no idea it was on. He candidly talks about when you're famous you can do anything with women and is caught ...,0
313,2016-12-08T23:00:01.000Z,jjnTq4hkvnU,Grab her by the pussy-TV,"Wenn Frauen auf dem Weihnachtsmarkt im Dekobereich eine fragliche Wahl treffen, ist das doof. Wenn sie bei der US-Wahl daneben liegen, möchte Carolin ...",0
315,2018-01-19T19:00:00.000Z,DzXqscFwP9w,[Roblox] Cash Grab Simulator: REBIRTHING! Second Rebirth (+ ALL WORKING CODES),First time Cash Grab Simulator: https://youtu.be/q-DUFWT5akI Tower Battles getting started: https://youtu.be/G5A6mc7chTc Case Clicker Getting started: ...,0
316,2009-11-25T00:00:25.000Z,t-BPOEvmr0M,Melvin (2009) Behind the Scenes - Crotch Grab,Behind the scenes footage from MELVIN.,0
317,2008-03-09T14:07:19.000Z,BBeJDPwO9kY,MY AMERICAN HEART - BOYS! GRAB YOUR GUNS with lyrics,MY AMERICAN HEART - BOYS! GRAB YOUR GUNS with lyrics.,0
318,2016-01-06T18:54:32.000Z,jVlJSxrm1wg,SMASH AND GRAB ROBBERS IN MAYFAIR JEWELLERY RAID. BBC COPYRIGHT.,"They were armed with machetes and axes, they threatened members of the public, and stole more than half a million pounds worth of jewellery. Detectives are ...",0
319,2015-03-21T14:35:42.000Z,S5WnKTNURL0,My grab bag (aka crap bag) of keycaps from Signature Plastics has arrived.,"approx. 5 lbs of overruns, low quality and other odds and ends. What use are they? Well, they were fun to sort and organize. Get the keyboard you want TODAY: ...",0
320,2014-10-29T08:42:48.000Z,0JUB9_uvEvY,Parasyte - auto boob grab,"Clip from the anime, Parasyte -the maxim-. Episode 1.",0
321,2012-03-12T00:53:05.000Z,LtXL_2j60h0,"Cover Tune Grab Bag - ""Baby""",MercyMe performing the brand new Cover Tune Grab Bag from the 2012 Rock & Worship Roadshow. Tweet this and tag it #CTGB.,0
322,2016-01-17T21:00:00.000Z,iXNxA66DPVQ,ASS GRAB #1 COMPILATION 2016 Best Funny Videos,Ass grab Best Funny Video or Vines. Compilation 2016. Rejanolg is expert leader in funny fail videos and compilations. Rejanolg releases funny greatest ...,0
323,2013-12-19T03:35:42.000Z,jfyAHk2t7Jg,Grab woman's breast to take a elevator,Check out our facebook fanpage www.facebook.com/sohudiorsman for more information. In order to avoid overweight，diorsman took off his pants and shoes ...,0
324,2017-01-20T06:00:00.000Z,7TkZ4asJ0wk,Trumpet (Grab 'm By The Pussy) - Bucket Boys ft. DJ Maurice (Carnaval 2017),iTunes: http://apple.co/2iIEJNm Spotify: http://bit.ly/2iIIjaD Including English subs (CC)! boekingen: bucketboys@tv-idee.nl De hele wereld is tegenwoordig DJ.,0
325,2011-07-07T18:37:37.000Z,FlJE_HYpz14,Balls Grab,"More ballbusting stuff: http://sacolandia.blogspot.com/ Download this clip: http://www.filesonic.com/file/1388714694 Capped from ""Childrens Hospital""",0
326,2008-03-14T04:56:05.000Z,xH7YrHMaNcU,Cash Grab Complications On the Matter,B-Side to Conquest.,0
327,2016-06-14T18:09:44.000Z,jXdpHvVNCnc,Mall Grab - Can't Take It No More,https://shallnotfade.bandcamp.com/album/steel-city-dance-discs-001-12 https://www.facebook.com/stillmallgrab https://soundcloud.com/mallgrab ...,0
328,2016-10-08T01:11:56.000Z,pAWgjQFjos0,Make America Grab Em by the Pussy - Donald Trump Trap Remix,Donald Trump doesn't mince words. He's going to Make America Grab Em by the Pussy Again Also.,0
329,2016-06-13T09:13:35.000Z,ChSwNtY-gbI,The Lapelles - Grab Life By,The Lapelles - Grab Life By Listen to Grab Life By on Spotify - https://open.spotify.com/album/6cLIGNG6jhxWwFE017UJL9 Twitter - http://twitter.com/thelapelles ...,0
330,2014-05-23T18:23:42.000Z,zoMuJ8AlS7g,Freehand Arch Demonstration by Michael Grab (Gravity Glue) - May 2014,how to build a simple freehand arch. no form necessary. using the skills of stone balance only.,0
331,2017-01-23T04:13:40.000Z,KiLMFyEKdzo,GRAB LIZA BY THE P*SSY!,"in this vlog i prank fans on omegle with david & liza, try out a new face product, and get denied entry from a bar. TURN ON MY NOTIFICATIONS! ***OPEN ...",0
332,2014-12-15T15:26:33.000Z,bzVojsJ_fZY,Grab my Grip,"Share the warmth in this cold weather. Lots of info, pictures, etc.. on my website and Facebook: http://reel.tv https://www.facebook.com/royaljordanian900R ...",0
333,2012-02-07T14:32:08.000Z,0LANLqEB8Q8,How to Use a Miller Titan Rope Grab for Both Vertical and Horizontal Applications,"How to use a Miller Titan Rope Grab"" shows how to prevent workers from falling during ascent or descent for both vertical and horizontal applications.",0
334,2017-09-19T19:31:23.000Z,HgONEcyB0Ic,POWER GRAB,"POWER GRAB - The Threat to Scottish Democracy. 20 years after devolution and the creation its own Parliament, Scotland now faces its biggest challenge in ...",0
335,2017-05-18T20:23:10.000Z,RureagtPXsc,Rockbalancing Demonstration by Michael Grab (Gravity Glue) - 1404,"Stone Balance Demonstration performed by Michael Grab Location: Ebin G Fine Park, Boulder, CO 3-rock continuous counter/point balance ALL RIGHTS ...",0
336,2014-02-12T22:29:56.000Z,pxofwuWTs7c,Coding With Python :: Learn API Basics to Grab Data with Python,"Coding With Python :: Learn API Basics to Grab Data with Python This is a basic introduction to using APIs. APIs are the ""glue"" that keep a lot of web applications ...",0
337,2015-03-17T22:52:51.000Z,NqTSn6-UXM4,Mall Grab - Osaka,"https://soundcloud.com/mallgrab For a constant flow of good trax, follow: https://twitter.com/EngraveLondon.",0
338,2016-08-07T15:37:46.000Z,Pj6VQrFaSfs,Marth Grab Range,Support me on Patreon so I can make more content www.patreon.com/Barstooly Melee content ▷ https://www.youtube.com/watch?v=ux_NWWUwoNo.,0
339,2006-05-29T11:18:33.000Z,2tJlg4SG5lE,grab,asian doctor.,0
340,2016-05-19T19:00:46.000Z,P70FeCe06QI,PROM BOOB GRAB (BTS),"WATCH EVERY PROM EVER! ▻▻ https://youtu.be/t1llvyaXRWc PIMPS OF PROM! ▻▻ https://youtu.be/_hZRfOMwyiw Behind the scenes moments, bloopers, ...",0
341,2012-08-31T15:20:07.000Z,D6LhpALvG2A,Construction Adhesive: Loctite Power Grab Heavy Duty,"Learn more about this product: http://bit.ly/UWPes2 Loctite Power Grab Heavy Duty Clear Exterior Construction Adhesive is a premium quality, high strength, ...",0
342,2016-01-02T14:26:15.000Z,VqATh4roFEY,Mall Grab - Happiness,Shall Not Fade SNF001 Buy - https://shallnotfade.bandcamp.com/album/alone-ep.,0
343,2018-03-17T15:05:04.000Z,zb6-xz-geH4,Cambridge Analytica: Whistleblower reveals data grab of 50 million Facebook profiles,"The British data firm described as “pivotal” in Donald Trump's presidential victory was behind a 'data grab' of more than 50 million Facebook profiles, ...",0
344,2009-11-07T04:31:06.000Z,rXHtjsWkNME,MercyMe - Cover Tune Grab Bag - Footloose,Another MercyMe Cover Tune Grab Bag as a reward for watching the Live Broadcast. For more from MercyMe visit www.mercyme.org/blog.,0
345,2018-03-26T18:00:04.000Z,jHBGg91uVEA,Stampy's Funland - Gold Grab,See the original video - https://youtu.be/wf2omN4WLSQ Welcome to Stampy's Funland. In this series I play lots of my differen't mini-games in my funland. Twitter ...,0
346,2009-04-12T22:12:28.000Z,lIT-emDhdHs,2009 Masters Boob Grab on 15,Someone gets a little too carried away after Mickelson's shot on 15 at Augusta. Check out TrollCalls.com.,0
