,published_at,video_id,title,description,relevance
0,2018-04-22T09:38:43.000Z,D4QxqZ9pOSc,22apr2018 grabcar driver of SLT5391R quarrel with grab passenger,grab driver of SLT5391R quarrel with grab passenger the grab driver of slt5391r was upset with the lady rider for booking a 2nd grab car after waiting for 5 mins.,1
1,2017-10-29T08:18:01.000Z,pO3ZFntIz4Y,Is it worth as Uber/Grab driver in Malaysia? Honest thoughts tips and tricks,"I'm a part-time Uber and Grab driver. Yup, I drive for both. Here's my opinions if you can actually earn money from this platform and some advises I can give.",1
2,2018-05-18T06:00:57.000Z,JlxgrLH6hu4,The Future of Grab - Your Everyday App,"Read more here: https://grb.to/myfutureyt Soon, you can wake up, book a GrabCar to get to work, pay for your favourite nasi lemak during lunch, deliver gifts to ...",1
3,2018-04-26T03:42:48.000Z,l2a8QccHZm4,Headstart: 'Choosy' drivers to bear brunt of destination-masking: Grab,Subscribe to the ABS-CBN News channel! - http://bit.ly/TheABSCBNNews Visit our website at http://news.abs-cbn.com Facebook: ...,1
4,2018-03-26T23:23:18.000Z,PF7XQju1yRo,Uber Agrees to Sell Southeast Asian Operations to Rival Grab,"Mar.26 -- Bloomberg's Eric Newcomer discusses Uber's agreement to sell its Southeast Asian operations to Grab on ""Bloomberg Technology.""",1
5,2017-11-11T07:28:09.000Z,_xzFv3F32NE,Grab Premium Kuala Lumpur to Port Dickson in BMW RM210,"While planning my recent reviews trip, I started researching the best way to get to Port Dickson and was instantly shocked at the rates the car and driver services ...",1
6,2018-06-24T21:48:40.000Z,j6vq3sW8oWE,Rated K: Manong Grab Driver with Tourette Syndrome,"Grab driver Marlon Fuentes reveals the challenges of having Tourette syndrome, asserts that his affliction does not affect his performance as a driver, and takes ...",1
7,2018-06-26T10:59:53.000Z,2aIpi-6X2I8,Myanmar national remanded over Grab driver’s murder,"Investigations into the murder of Grab driver, Aiman Nosri, led to the arrest of a Myanmar national who works at the Selayang wet market on Tuesday.",1
8,2018-05-24T09:44:46.000Z,U7xkQEZjomQ,Taxi driver association wants Grab to be shut down,PETEKMA president Mohd Syahrir Abdul Aziz who met with the Council of Eminent Persons today called for the government to permanently shut down the ...,1
9,2017-07-13T05:46:59.000Z,M_7QkpAkfUM,how to use Malaysia grab care,how to use Malaysia grab care Getting Started. Book in Just 2 Taps. Key in your pick-up and drop-off locations to get your estimated fare. Get a Driver. Grab will ...,1
10,2018-06-24T07:41:38.000Z,ie86SlC8H7o,"Grab driver killed, found upside down in car","A Grab driver, believed to have been strangled, was found upside down in the back seat of his Perodua Myvi car at a car park in Taman Selayang Makmur here ...",1
11,2018-01-22T05:20:45.000Z,_-Xr1yBJr5M,UBER & GRAB Singapore earnings 0530 to 1100 22nd January 2018,Hello my name is Benny! And I'm creating a YouTube channel to guide or show SG uber and grab drivers who are interested to earn money like I do shown in ...,1
12,2016-10-13T05:48:29.000Z,i0mXCyDxTeY,how to take a grab car in singapore,"If this is your first time taking grab car, click https://invite.grab.co/yori26026 to download the app and get $8 off for your first trip.",1
13,2018-06-26T10:58:48.000Z,yghw0qdW5-4,Grab launches academy for drivers' skills training,Video and editing by RYAN LEAGOGO/INQUIRER.net.,1
14,2018-05-24T15:23:57.000Z,3qPOO8o37lI,Petekma wants Grab banned,"Malaysian Taxi, Limousine and Rental Car Drivers and Operators Association (Petekma) has appealed to the new government to ban ride-hailing service Grab ...",1
15,2016-09-10T06:19:45.000Z,tW-MnJqtVuo,How to use Grab App (FREE GRAB PROMO CODE),"bit.ly/grabforty If you download the app here, this is what will happen. First you get a 40PH Peso discount when you use the app and I too will get a 40PH Peso ...",1
16,2018-06-27T12:29:22.000Z,BiYEVyEcbII,Grab Driver Murder,"At the Selayang Magistrates Court, three workers of a frozen food shop at the Selayang wet market, were remanded for seven days. This to facilitate police ...",1
17,2017-11-08T09:52:49.000Z,t-kB00qMBrI,Delivery Boy Job - GRAB Rider - Video Job Description,"To Apply, give a Missed Call on 08039118134. (Please add Zero before the number) OR use the Application Links below: Mumbai: https://goo.gl/UEQQdN ...",1
18,2016-08-10T06:51:23.000Z,CEC91RUooEU,"Use Grab Bali, Not Taxis | Cheapest Airport Transfer, Better Than Uber, Private Driver","If you're looking for the best and cheapest way to travel in style during your stay on Bali, look no further than your phone and the app Grab. I've been a huge fan ...",1
19,2018-06-25T02:15:56.000Z,xigOH0mZPbg,Cops Intensify Probe On Grab Driver Murder,"Police are intensifying a probe into the murder of a 27-year-old Grab driver, who was found in his vehicle with strangulation marks on his neck, at a parking lot in ...",1
20,2018-06-26T12:14:18.000Z,xxyOSbeeJr8,"Grab's passenger wait time solution? Add more cars on the road, says Cu",Video and editing by RYAN LEAGOGO/INQUIRER.net.,1
21,2018-04-11T21:00:00.000Z,NIMKmOxrmbI,Grab CEO Anthony Tan on pitching to Softbank and a potential IPO | CNBC Conversation,Anthony Tan reflects on the lessons in leadership he has learned and the potential for his company to go public. Subscribe to CNBC Life: http://cnb.cx/2wAkfMv ...,1
22,2018-03-29T04:37:20.000Z,wFCDid1uvEU,Grab and Uber Merger: What Really Happened,LEAKED video of Grab and Uber merger discussions #GrabUber Watch our other MOF vids! ➤ http://bit.ly/JoinTheMinistry Remember to SUBSCRIBE AND HIT ...,1
23,2016-06-13T22:58:56.000Z,5Sa20gEeaNo,"Everyone vs. Uber | Jean Liu President, Didi and Anthony Tan CEO, Grab | Code Conference 2016",Didi Chuxing President Jean Liu and Grab Group CEO Anthony Tan talk with The Verge's Walt Mossberg and Recode's Kara Swisher about operating ...,1
24,2017-08-14T03:10:08.000Z,j68j5XgBS1g,How to Use GRAB via ShopBack 🚘,Get P5 Cashback from your GrabCar and GrabShare rides! Here's a quick video on how to book your ride #TheSmarterWay with ShopBack! Try it out here: ...,1
25,2017-06-12T06:22:16.000Z,SUDD9lFro-c,Superpowers at Grab,"Everyone wants a superpower. Some of us get to have one. At Grab, we have the power to improve millions of lives across Southeast Asia! Get the power.",1
26,2016-03-16T10:11:10.000Z,tjuNryGreuk,Grab Express - same day delivery in Manila,"I test out Grab Express, a same day pickup and delivery service from Grab Philippines. This video was not sponsored, reviewed or approved by Grab. In the ...",1
27,2016-09-23T03:51:40.000Z,Bmv9Cszgwj4,Grab to partner with nuTonomy for driverless car trial,ST VIDEO: AZMI ATHNI.,1
28,2018-05-29T05:37:24.000Z,M9C61Eg6Lnw,Ryde is Grab's new challenger,"With Uber on its way out of Southeast Asia, a fresh startup called Ryde wants to ensure that Grab won't be the only game in town. ================= Let's ...",1
29,2018-03-26T08:03:52.000Z,Fli77-8zp_Q,Competition watchdog not yet notified on Grab-Uber deal,"Neither Grab nor Uber has notified the Philippine Competition Commission over their deal which is supposedly the biggest of its kind in Southeast Asia, the ...",1
30,2018-06-26T14:17:56.000Z,qw9THV76zv4,"Grab Academy to train 2,000 Grab drivers","Ride-hailing giant Grab implements Grab Academy, a program for drivers who did not receive formal training in driving.",1
31,2018-06-21T03:25:37.000Z,oGpGca9vOPI,Grab mod 5.39 Smile time,Tes kegacoran.. like dan subcribe apa bila ada yg bermanfaat u/ anda dlm video ini #grabmod.,1
32,2017-09-05T17:53:51.000Z,86NsHESDiRs,Grab Mod 5.23.0 Easy ping 100% secure,Bypass AR -Bypass root -Bypass xposed -Bypass Fake Gps -Bypass tracking from GC -Easy ping -No softban -100% secure Like and subscribe dont forget !,1
33,2018-05-18T21:34:18.000Z,e1wRba6UxVM,Grab Mod Version 5.39.0 No Softban 100% New system,Like and subscribe dont forget ! Cp/wa +6281294357411 4 years already cr8 mod for malaysian driver now open for singaporean driver Subscribe dont forget ...,1
34,2017-12-07T18:29:47.000Z,VMxc-0Elt_U,MOD GRAB DRIVER VERSI 5.29.0 ALL IN 1 FIX BYPASS,"GRAB DRIVER MOD VERSI 5.29 Untuk yang mau mencoba APK MOD ini, harap di CLEAR DATA terlebih dahulu aplikasi GRAB DRIVER yang terinstal di hp ...",1
35,2018-05-12T16:10:08.000Z,Vda1USxC-84,MOD GRAB BLACK V5.39.0,Percuma bilang gunakan dgn bijak sama aja taunya dijual/belikan juga.. ingat ini mod free gak berkah dijual dibelikan.. Langsung aja udah males basa basi ...,1
36,2017-12-22T07:46:59.000Z,vNzaqqrHjbk,GRAB MOD DRIVER MALAYSIA [[ 0182265696 ]],New Version 5.30.1 already whatapps 0182265696 •bypassAR•Baypass antiroot • Baypass 100% not softban *SKIP AR Tak Jatuh* *Senang Dapat Ping* *Easy ...,1
37,2017-09-03T06:30:07.000Z,g8daE1X-eis,APK MOD GRAB ANTI PERFORMA,"Like, Coment and Subs ya kalo dapet 10000 viewer, link akan saya dibagikan :) Thanks..",1
38,2018-01-15T06:58:50.000Z,cM0DJwJCp0s,Mod Grab RRG7 Team,"Mod Grab RRG7 Team,bagi abang grabbike driver yang sedang mencairi cara agar akunnya gacor silahkan hubungi RRG7 untuk mendapatkan Mod Grab ...",1
39,2018-05-09T00:43:20.000Z,idFUz2HKbPk,Grab Mod Version 5.38.1 No Softban 100% New system,"Subscribe dont forget Cp/Whatsapp Only 081294357411/+6281294357411 -ignore ping ,AR will increase not dropping i always not uptodate to upload the ...",1
40,2018-05-09T06:47:31.000Z,vgz_fGh7WZo,mod Grab 538 transparan,aplikasi ini tdk tuk dijual/belikan gunakan dgn bijak jaga amanah ya abang2 langsung aja lah cocol bagi yg suka kalau gak suka jgn dihina saling menghargai ...,1
41,2017-07-01T18:44:24.000Z,dBDIVfxhmu4,Mod Grab Driver 5.18.0 for Msia/Sgpore Drivers,Grab Driver Apps Modification Version for Malaysian / Singapore Driver version 5.18.0 Benefits:- - Able to hold you acceptance rate if u ignore the job that you do ...,1
42,2018-06-12T04:53:56.000Z,2ficjiAN4oA,MOD GRAB DRIVER [MALAYSIA] V.5.40.0 NO LIMITED SKIP [0184089655],MOD GRAB DRIVER [MALAYSIA] V.5.40.0 NO LIMITED SKIP [0184089655],1
43,2017-08-28T11:28:44.000Z,PTBk-Ho-sPk,"Grab mod 5.22.0 Malaysian Driver easy ping,, Hold AR ,,No Softban,,100% SECURE",Like and subscribe dont forget ! Cp/wa 081294357411 ( +6281294357411),1
44,2018-04-06T06:06:41.000Z,49b25RFTEd0,Mod Grab Gacor No PF V5.36.1,Yuk ah dicocol nih mod Grab No PF V 5.36.1 Cocok instal gak cocok uninstall Grab v5.36.1 http://sprysphere.com/Br8M Gunakan dgn bijak tdk tuk dijual belikan ...,1
45,2017-12-28T05:14:25.000Z,ZCkacv7czbs,GRAB DRIVER MOD V.5.30.1,Dont forget to Subscribe https://www.youtube.com/channel/UCrRFAxxLELeIk-dh1d0vQgw Fiture - bypass root - bypass mock location - bypass forbiden apps ...,1
46,2017-11-07T07:55:45.000Z,KtRV5Tz4Jdk,Mod Grab Bike 5.29.0,Whatsapp 0838 9217 9057 Telegram 083892179057 Telegram @YY_YH_HH.,1
47,2017-08-08T22:57:17.000Z,xdZHuFR4OLM,Grab Mod 5 18 0,Like and subscribe dont forget ! Cp/wa 081294357411.,1
48,2017-11-18T09:23:58.000Z,QDdVdXqZf5k,Mod Grab Driver Realbase Performa v5.27.2,Terima Kasih Sudah Menonton Link download mod : http://www90.zippyshare.com/v/uzwGRW5k/file.html Subscribe like dan share.,1
49,2017-10-20T02:46:46.000Z,6hGkofpsD44,Mod Grab Tester,"Mod Grab Tester,lagi nyoba Mod Grab Terbaru semoga gacoooorrrrrr.kalau abang mau yang lain bisa mampir ke sini http://bit.ly/2yo5Guw.",1
50,2017-12-16T14:52:53.000Z,ojXvr8ZpI5o,Grab Mod Driver •Baypass AR •,New version Grab 5.29.2 is available https://api.whatsapp.com/send?phone=60182265696 Whatapps now to get it mod #grabdriverkualalumpur ...,1
51,2017-11-29T09:09:41.000Z,3Ii3BhsvA_o,GRAB CAR HACK JOB MALAYSIA,"Malaysia Grabcar MOOD 100% softban , igrone hold AR!! https://api.whatsapp.com/send?phone=60182265696 Whatapps now to get it mod ...",1
52,2018-03-14T18:45:41.000Z,0AI5tJnXUK0,Tes mod grab,Cuma iseng aja..jangan diambil ati...,1
53,2017-11-09T11:46:06.000Z,j2Rmvlr0nD8,APK MOD GRAB PF 5.26.1,"Cuma iseng aja, cuma suka upload aja. Kalo ada yg mau ditanya, boleh coment. Salam Satu Aspal..",1
54,2017-12-15T16:59:15.000Z,YTSN__7so_M,MOD GRAB DRIVER VERSI 5.29.2 ALL IN 1 FIX BYPASS (LINK DI DESKRIPSI),"Buat temen2 yg mau nyoba bisa via email aja. Aplikasi y gratis & gak pake donate/donat ^_^ GRATIS, gua cuma minta tolong bantuan temen2 biat ngreview ...",1
55,2017-11-19T16:26:15.000Z,G0yN6MqSrCo,GM FAMILY MOD GRAB DRIVER 5.28.0,"Anti performa,Anti GAGU Gacor sepanjang aspal ---------------+++++++++----------------- http://upfile.mobi/wUOBpuKUSPM ---------------+++++++++----------------- Thx ...",1
56,2017-08-28T21:21:12.000Z,tL0fcgxLHAE,MOD Grab,Link MOD : https://drive.google.com/file/d/0B-pAKprIZJkbUmhUNXpRSHJfR0E/view.,1
57,2018-06-28T10:50:00.000Z,pMGEU1zDLQw,Mod grab PF 5.42.1,Cocok pake gak cocok buang No Zip... No pass Grab 5.42.1 http://zipansion.com/1qtKR Kunjung Facebook kami www.facebook.com/radjatube Salam 1 aspal.,1
58,2017-12-18T06:05:52.000Z,pEAt17eJMiM,link download mod grab V.5.29.2,"ketarangan mod grab 5.29.2 jangan terlalu sering melewatakan orderan yang masuk pada aplikasi, pihak grab haya bisa deteksi secara manual lewat history ...",1
59,2017-11-14T13:58:18.000Z,8OJOEr2_1qQ,Tes fake gps+mod grab,Fake gps sangat membantu pekerjaan driver online yg mau pake tinggal pake yg gak mau jangan ngebuli.,1
60,2018-01-31T01:06:21.000Z,QcdEDMRxKdc,LATEST GRAB MOD 5.31.4,For = -Singapore -Malaysia -Philiphine -Thailand -Bypass AR -Bypass root -Bypass xposed -Bypass Fake Gps -Bypass tracking from GC -Easy ping -No softban ...,1
61,2017-10-14T21:40:10.000Z,-937QVm2XRM,"5.25.0 Grab Mod Version ,, Tired work Hard ?? Anggoro MOD is the solution",For = -Singapore -Malaysia -Philiphine -Thailand -Bypass AR -Bypass root -Bypass xposed -Bypass Fake Gps -Bypass tracking from GC -Easy ping -No softban ...,1
62,2017-07-05T16:20:56.000Z,EgJFHzNh-t4,Ready mod grab 5.19,Minat hubungi saya via tele 089514944559 support grabnow Tahan performa.,1
63,2017-10-31T15:59:52.000Z,RJ813G1BTdk,MOD Grab 5.26 AntiPerfoma,Yang pentiing semangaaaat. Jangaan malees. :-),1
64,2017-11-30T17:27:44.000Z,CRt15OcBolk,MOD GRAB 5.29.0,https://www.mediafire.com/file/9theoint4wkg9ev/5_6120552177481023511.apk Link nya di atas silahkan sedot.,1
65,2018-06-10T22:52:39.000Z,MmO057ylCsE,OPEN 10 SLOT GOJEK/GRAB MOD ONLINE,"Komentar dibawah untuk link tele, No tanya2 rasakan dan nikmati hasilnya Fitur : No detek Bypass Full No Modul No delay Realbase Fake tuyul TJK wajib 5380 ...",1
66,2017-08-08T21:43:26.000Z,a23wyev1Zxw,Grab Mod 5 17 0,Like and subscribe dont forget ! Cp/wa 081294357411.,1
67,2017-11-11T10:11:45.000Z,2R9MntLONjE,Mod Grab 527,"Selamat datang di channel YouTube saya. Jangan lupa like, share, comment dan subscribe yaa ;) Find me on : https://www.instagram.com/sergiherdianto_ I ...",1
68,2017-12-15T15:51:41.000Z,pEpRl6qSs7U,Mod Grab Driver v.5.29.2  Full bypass,Linknya ada di bawah Cara donwloadnya https://youtu.be/pEAt17eJMiM Cara instal https://youtu.be/ec457JRhiGI https://youtu.be/DPYuihv3rSg ketarangan mod ...,1
69,2017-04-28T14:08:27.000Z,WOorM7z-7Ck,GRAB Mod AutoMental,Buat nahan persentase penerimaan. order cukup dilihat saja. di detik terakhir otomatis mental.,1
70,2017-08-08T21:41:05.000Z,3R0TCN-tgIc,GRAB MOD 5 16 0,Like and subscribe dont forget ! Cp/wa 081294357411.,1
71,2017-11-06T08:26:46.000Z,bLlI8XLuma0,RfMod Grab 527,"RfMod Grab 527 ini sangat mantap nih bang,gacor banget.",1
72,2017-08-08T22:44:55.000Z,DvNKNJgfVsA,Grab Mod 5 17 0 2,Like and subscribe dont forget ! Cp/wa 081294357411.,1
73,2017-06-19T10:32:17.000Z,v8EDRrNM_9A,READY MOD GRAB 5.18,Anti PF Minat hubungi 089514944559 Aplikasi dikirim via telegram.,1
74,2017-11-19T14:41:27.000Z,y6vJxLeZgHk,Grab Gm Family,"Grab GM Famaly,slah satu mod grab andalan abang abang pejuang Ojek Online.silahkan di cek bang http://bit.ly/2zTxxp0.",1
75,2017-09-05T06:59:41.000Z,CZXmh4D2T4k,Bypass Syimlink Server (Grab Config),Official : https://forum.surabayablackhat.org/d/162-bypass-syimlink-server-grab-config Fanspage : https://facebook.com/jxc.id Facebook ...,1
76,2017-10-18T23:02:50.000Z,XCej7sFpqHg,DRIVER GRAB / GOJEK FULL ORDER ( NO TUYUL / NO ROOT / ORIGINAL APP ) Part 1,"cara agar aplikasi driver online menjadi gacor, dan melubernya orderan. https://www.youtube.com/channel/UCsKE-DjMPqw7hVoKVohvVfA.",1
77,2017-12-13T17:47:10.000Z,WQNmjfNURKQ,Fake GPS Driver Online Go-Jek/Grab(edit GPS advance),"Fake GPS driver online Support Android OS 6.0 - 7.1.2 NOUGAT Link di akhir video : ""Catat link,kemudian copy kan ke address bar browser dengan ...",1
78,2017-11-05T05:00:14.000Z,pmYohqInkn8,FAKE GPS PRO for Gojek Grab Uber Premium | EP ANDROID,"Download app bottom for donate please like comment n subscribe aplikasi fake location premium / fake gps aplikasi tuyul untuk gojek, uber, grab . untuk ...",1
79,2018-01-06T14:38:37.000Z,GOvgmKW74dQ,GRAB DRIVER DAN XPOSED,Link lagi on proses. Link mirror for download simple Cek this blog. Download http://brisktopia.com/BTh8 link { http://brisktopia.com/AXnt } link ...,1
80,2017-12-17T20:35:57.000Z,kRD3lIyoNGk,TUTOR PF Grab Driver 5.29.2,No Comment... Like&Suscribe! Thx.,1
81,2018-02-14T13:07:27.000Z,CN-l-LCDFBM,CARA-CARA DOWNLOAD APPS GRAB DRIVER,Link utk install aplikasi Grab Driver ANDROID https://play.google.com/store/apps/details?id=com.grabtaxi.driver2 iPhone iOS - http://partners.grab.com/ios/latest/,1
82,2018-02-24T14:30:10.000Z,zfoIZA_gDsY,Tutorial On How To Use The Grab Driver App For iOS,This is a basic tutorial on how to use the Grab Driver app for iOS Apple devices. Thank you so much for watching!,1
83,2018-04-03T13:36:40.000Z,_IcQkbDyljI,"How to fix your Grab App, Android users only,","Pag di umobra, Grab system na may problem,",1
84,2017-12-24T04:08:31.000Z,0i0uvwYMOyI,TUTORIAL TOP UP GRAB DRIVE VERSION 5.30.1,SALAM SATU ASPAL Tutorial ini membantu para DRIVER GRAB ataupun GOJEK melakukan topup sampai mendapatkan orderan. karena saya juga sebagai ...,1
85,2015-09-02T18:48:50.000Z,5b6DQw-9Y7Y,HDSD Grab Driver,This video is about HDSD Grab Driver.,1
86,2017-07-12T10:59:22.000Z,x5tnol7ZEqM,Review GRAB EXPRESS Metro Manila Delivery within 1 hour,Hi. My name is Praise and welcome to my channel. Here is my review of Grab Express when I utilized this service in my online business . I love to eat and to try ...,1
87,2018-04-24T16:33:22.000Z,xD3YY8ruWxk,Grab Sanctions Drivers for Excessive Cancellations,Ride-sharing app Grab announced it is sanctioning nearly 500 drivers in the Philippines who cancelled at least 10 percent of their rides over the last week.,1
88,2018-04-23T12:56:45.000Z,sFZPxOmqIYA,Grab sanctions nearly 500 drivers for excessive ride cancellation,"Grab says it sanctioned nearly 500 drivers last week, following an internal probe into mounting complaints of cancelled ride bookings. Full story: ...",1
89,2018-03-13T10:57:34.000Z,QEI5HP3YFOc,Grab driver's windscreen vandalised,GEORGE TOWN: A ride-hailing Uber female driver suffered a rude awakening after her windscreen was smashed by a motorcyclist with a rock here on March 8.,1
90,2017-07-05T11:30:42.000Z,nvfVvTpnte8,"How to install Uber, Grab app on BlackBerry 10 devices?",1. 2. Play services Patcher 3. Google Play Services 8.4.89-cobalt-Build5.,1
91,2018-05-28T06:12:40.000Z,qn56yW4GC0w,FEMALE GRAB DRIVER QUITS CORPORATE JOB,"FEMALE GRAB DRIVER QUITS CORPORATE JOB Meet Pia, a former BPO employee who quit her safe and secure job to venture into the world of being a Grab ...",1
92,2018-05-08T16:18:13.000Z,VLuH_TvKO1k,Grab Phillpines to fine rider cancellations,Soon riders will have to pay Grab Philippines for cancelling bookings.,1
93,2018-05-04T09:02:22.000Z,ORFzv3uiCyU,MANILA BEST GRAB DRIVER!,I've used Grab so many times but i've never come across a driver as lit as this Kuya!,1
94,2018-05-05T11:30:31.000Z,R3X-xnbsqpA,Uncle driver last day as Uber/Grab driver (Funny),Please share and like our videos. Visit our FB at: https://www.facebook.com/singaporeincidents/,1
95,2018-04-25T05:36:14.000Z,eBL91PoRfU8,Grab drivers won't see rider destination starting April 27,"To address mounting complaints, Grab Philippines said its drivers will no longer see the destination of their passengers before accepting bookings starting ...",1
96,2018-04-18T07:35:36.000Z,zkzn3YwLRKs,"HAPPENING NOW: April 18, 2018 | Grab Philippines Holds A Press Briefing",Grab Philippines holds a press briefing. www.cnn.ph. Courtesy CNN Philippines.,1
97,2018-04-22T01:01:48.000Z,nE5QV8AjzgU,LTFRB ORDERS GRAB PHILS TO EXPLAIN P2 MINUTE TRAVEL CHARGE   Motoring News,"Grab Philippines has been under fire for allegedly charging their customers for the travel duration, which is not included in the December 2016 order regulated ...",1
98,2018-04-09T12:23:20.000Z,u3q4FfnBdd8,"Following Singapore, Philippines regulator forces Grab to delay closing Uber’s app | by Duterte Lat","Following Singapore, Philippines regulator forces Grab to delay closing Uber's app | by Duterte Latest News. ▻ Grab has given the Uber app a stay of execution ...",1
99,2018-03-28T09:20:20.000Z,dSbU8CbSCeY,Hack grabcar malaysia all location,Boleh pm number tel dibawah.,1
100,2018-03-30T14:28:22.000Z,9sHChhcXHbM,Mod GrabBike V5.35.4 Terbaru 30-Maret-2018. By Durex Team.,Chat Via Telegram User Name = @X3MHUMAN.,1
101,2018-03-28T14:47:12.000Z,PumWPM6elj4,WD2249A Blasting Horn Road Rage at Platinum Suites KLCC GRAB,GRAB DRIVER BLASTING HORN ROAD RAGE AT KLCC.,1
102,2018-03-24T14:25:33.000Z,sOUcADYzpQ8,JADI GRAB OJEK ONLINE - MOTOVLOG INDONESIA,Vlog kali ini ngebahas pengalaman gue sebagai grab driver. Hmmm ternyata seru juga! Instagram: @BangYopiMotovlog Helm: KBC Glove: Furygan Jacques ...,1
103,2018-03-07T00:11:00.000Z,Wt4p8kevAWg,SETING MAP GOJEK/GRAB/UBER,Cara seting map gojek/grab/uber agar tidak jalan muter2 and masuk ke tol.,1
104,2018-03-13T08:22:37.000Z,g7QOKS0OoHk,"How to make GPS not bad || for driver Go-Jek, grab, Uber","Kali ini gua akan bagi pengalaman dan biar GPS kalian tidak kemana"" Like, subscribe , and share video ini Semoga bermanfaat dan salam MOTOJEK STAY ...",1
105,2018-02-18T03:17:06.000Z,uq7HADS6u0Y,"To be/ existing Grab taxi / pte drivers must know, whether Grab deflate your profit?","即将或现成Grab德士或私人司机您必须知道, Grab会削低德士/私人司机的利润吗? To be/ existing Grab taxi / pte drivers must know, whether Grab deflate your ...",1
106,2018-02-09T02:00:01.000Z,Xs65UnUkrec,TenkiuFaCai with Grab,"Sometimes, the best greeting is the simplest one. No need for pow-der-ful, flowery language. #keepitsimple #tenkiufacai Click http://grb.to/TenKiuFaCai for more ...",1
107,2018-01-24T10:33:54.000Z,PE4lnlJUBoI,HOW TO SETUP NAVIGATION PROVIDER ON GRAB DRIVER APP,This video will show you how to setup navigation provider like Waze or Google maps on Grab Driver App by using your smartphone.. Its very easy.. Thank you ...,1
108,2018-01-30T08:07:13.000Z,Ygtdj3bTC5s,GRAB EXPERIENCE (1st Time),Kudos to GRAB! Thank you for your assistance.. My family experienced convenience sa pag commute. The rating I gave is for the Grab driver I booked at that ...,1
109,2018-01-24T02:32:09.000Z,ydpcVaro4_M,GRAB DRIVER SHARE 02,Sila lihat panduan pemandu yang telah diberikan oleh admin ubergrab melalui whassup. Khas untuk pemandu berdaftar sahaja. Tq Daftar ubergrab online ...,1
110,2017-12-09T23:16:21.000Z,JJPgDq-2Uz8,CARA REPORT/FEEDBACK RIDER GRAB,Sila lihat panduan pemandu yang telah diberikan oleh admin ubergrab melalui whassup. Khas untuk pemandu berdaftar sahaja. Tq Daftar ubergrab online ...,1
111,2017-12-12T00:45:12.000Z,5gRFR7pGxTg,MOD ANTI GAGU GRABBIKE FREE,LINK MOD GRATIS DI BAWAH INI : https://drive.google.com/file/d/18FysncNkRsGRumXoS37hVzIA9fHX9kt0/view?usp=sharing.,1
112,2017-12-13T16:25:04.000Z,JeI9dGpXNYw,GRAB DRIVER MALAYSiA,Malaysia GRAB.,1
113,2017-12-11T05:01:54.000Z,ABupeY2pFhw,UPDATE TERBARU APPS GRABCAR. WEEKLY STATEMENT,Sila lihat panduan pemandu yang telah diberikan oleh admin ubergrab melalui whassup. Khas untuk pemandu berdaftar sahaja. Tq Daftar ubergrab online ...,1
114,2017-11-22T09:55:41.000Z,NFHi29HGxqI,Tuyul UBER/GOJEK/GRAB XSPOSED MODULE,"1. Hp sudah Terinstal XPOSED 2. Buka XPOSED dan lanjutkan ke Menu download, Cari (FAKE MY GPS) silakan Unduh terlebih dahulu Dan Install 3.",1
115,2017-11-30T10:29:10.000Z,cZxgK-S2_zM,"5 Tips when riding taxi, uber, or Grab after watching this driver",What can you say about the service of this uber taxi driver? Read more here: http://www.thetrendingfacts.com/2017/11/will-you-follow-these-5-safety-tips.html ...,1
116,2017-11-12T12:40:49.000Z,SHtHp2LLVmk,Hack GrabCar Apk 2017 Work 1000%,Hack Grab Apk 2017 Di Jamin Gacorr Dan Tarif Tinggi. Links: Bagi Yang Minat SUBSCRIBE 1000 Link Di Bagikan. Salam Grab Car.,1
117,2017-11-17T19:25:13.000Z,shmRNzk3nJM,ganti backround jd transparan grab driver,bacground.,1
118,2017-11-08T22:55:53.000Z,tfsOmApyS8s,GRABCAR WALLET NEW UPDATE (NOV 2017),Sila lihat panduan pemandu yang telah diberikan oleh admin ubergrab melalui whassup. Khas untuk pemandu berdaftar sahaja. Tq Daftar ubergrab online ...,1
119,2017-11-11T12:31:54.000Z,bqHmjT3u244,"Setting Hp Xiaomi GOJEK,GRAB, UBER tetap stand by",Video ini berisi tentang cara setting hp xiaomi agar aplikasi ojek online tetap berjalan dan stand by saat kita memainkan aplikasi lainnya.,1
120,2017-11-10T11:18:53.000Z,3joYM0W46OY,A Day in the Life of a Grab Driver,"Driving the online ride-hailing industry one passenger at a time, Grab Driver Azwar Mubarok gives us access to his daily routine.",1
121,2017-11-03T05:09:12.000Z,Cftlak-YAWs,"Grab More, Get More!","Redeem your Grab rides worth up to RM15! Just Grab more, and you'll earn more GrabRewards points. #RollingInIt #TeamGrabLebih #GrabRewards.",1
122,2017-09-26T09:59:39.000Z,YIrmGO2aD_M,GrabCar driver leaves passenger in car with engine running and blocks other vehicles,Stomper Shah felt compelled to give a GrabCar driver a 1-star rating after he suddenly parked the car in front of a carpark exit and left Shah there for three to five ...,1
