,published_at,video_id,title,description
1070,2017-11-01T08:41:01.000Z,oB_SKtQEZFI,Tamil girls love    whatsapp status   viral video songs,Tamil girls love. WhatsApp status viral video songs The hilarious stuff sometime put together in one compilation as to that it becomes impossible to not laugh.
1071,2017-11-01T11:21:53.000Z,y66xGspkvyM,Fishing By neay Jerm fishing Trap Using Electric raditional Fishing in Cambodia,Fishing By beating Jerm fishing Trap Using Electric raditional Fishing in Combodia The hilarious stuff sometime put together in one compilation as to that it ...
1072,2017-10-31T04:18:59.000Z,OvhbPunF89s,The Walking Dead: A New Frontier - Ties that Bind (Pt 1) - #LiveStreamLetsPlay,Broadcasted live on Twitch -- Watch live at https://www.twitch.tv/mjlakomiak.
1073,2017-11-03T01:08:52.000Z,lOPLl8uw9qk,Rick Trying to Say They for 10 Hours,lol So funny that i'll have to give myself some prrromotions! https://www.patreon.com/user?u=6044898 http://steamcommunity.com/groups/20fadhilstenthhour ...
1074,2017-11-05T11:58:03.000Z,BbB0eGtxCu0,"Donald Trump Trying to Define Puerto Rico, an Island Surrounded by Big Water for 10 Hours",lol So funny that i'll have to give myself some prrromotions! https://discord.gg/zuwCn5 https://www.patreon.com/user?u=6044898 ...
1075,2017-10-16T16:01:14.000Z,BejRtngXUXA,Grab Your Ideal Client's Focus thru MOVEMENT,http://DavidBridgeJr.com/Multiply?t=movement How you can use it to get more clients for your professional practice without being dumb and cheesy is in this ...
1076,2017-10-20T15:57:37.000Z,IucAB-bcGzE,Editing MAGIC with MONEY in Premiere Pro (Zach King),EASIEST GLITCH EFFECT EVER ▻ https://youtu.be/ri4OGRNez4E https://www.squarespace.com/cinecom - Learn how to copy money like Vinemaster Zach ...
1077,2017-10-23T15:06:02.000Z,Sh7uzr8XMWI,A Complete Walkthrough How to Bring Peppers Indoors to Overwinter,Grab your pepper plants and bring them indoors. Here is how! This will be a complete walk through so you can go out and get it done now before jack frost does ...
1078,2017-10-16T03:01:07.000Z,-I_Y4hPErws,HUGE Barbie Estate Sale Haul ~ Dolls Galore 80's & 90's ~ Toy-Addict,This is a long one friends. You might want to grab a snack before we begin! Blog: http://www.Toy-Addict.com Toy-Addict EBay Store: ...
1079,2017-10-15T16:00:04.000Z,zlN7vq2Th5U,KOREAN FIRE NOODLE CHALLENGE W/ SHAWN RAINEY! ,Eating the super hot Korean Fire Noodles with Shawn Rainey. GRAB YOURSELF SOME FIRE NOODLES! http://amzn.to/2gcWXXr Tune into OLD NERD ...
1080,2017-10-20T11:15:26.000Z,H7PG8lA4ewE,Red Sky July - Jet Trails,"'Jet Trails' is the first track Red Sky July's latest full studio album 'The Truth And The Lie', grab your copy here: http://redskyjuly.com/albums/"
1081,2017-10-27T14:17:07.000Z,CZGUZ1Z8Hc8,LOOK WHAT WE FOUND!,The water is so clear and beautiful. There were so many seashells to grab! Evelyn was loving the beach! She is definitely a beach baby. Check out the links ...
1082,2017-10-13T18:00:01.000Z,Dp_GfsA6o1o,HiFiBerry Amp2 for Raspberry Pi,"The HiFiBerry Amp2 is an amazing audio amplifier for the Raspberry Pi. Capable of being powered by a 12 to 24 volt power supply, it has an output power of 60 ..."
1083,2017-10-24T02:41:30.000Z,PJbwwtTSXuc,October Beauty Favorites,Becca Ultimate Coverage Longwear Concealer vs NARS Radiant Creamy Concealer https://youtu.be/PDBGjynAyuQ Time for October Beauty Favorites!
1084,2017-10-20T18:00:02.000Z,dRjHT145HgI,Umidigi S2 Review and Unboxing - Bezel-less Android Smartphone Hands On,"Here's my hands on Umidigi S2 Review and Unboxing. No re-uploaded footage. No tricks, The Umidigi S2 is OUT NOW! Grab yours here: https://goo.gl/K9q4U3 ..."
1085,2017-10-15T00:10:16.000Z,Fwq9wHxz72o,Back to basics! | Vlog #124,"Please watch: ""HOW I SPENT MY FIRST SUMMER VACATION | #100DAYSOFSUMMER vlog"" https://www.youtube.com/watch?v=IXKgqHNKNC4 --~-- *NEW ..."
1086,2017-10-22T16:51:43.000Z,Rn-J1idthWE,Crow Hollow Cursed Tree Encounter for D&D (DM’s Craft #181),Scotty's favorite glue gun (affiliated link): http://amzn.to/2gYKRhV Red LED mini light (Affiliated Link): http://amzn.to/2yGCEbb Minwax Polycrylic Water Based ...
1087,2017-10-25T10:42:23.000Z,KRUJUks8cis,Switzerland Snowfall Moment Video|| Happy Travelling With Children,"Switzerland's ravishing landscapes demand immediate action – grab boots, leap on board, toot bike bell and let spirits rip. Skiing and snowboarding in ..."
1088,2017-10-26T16:08:20.000Z,GBoCQXaJxMY,"FLAT To The MAT - AMDetails Detailing, Orders and The New Unit.","The second week back trying to film the life of AMDetails through my eyes and well, its been FLAT to the MAT! ▷   Subscribe for more detailing and vlog videos?"
1089,2017-10-24T07:27:38.000Z,IGFrqtasq0g,NetNobody - LA LIGHTS (CLEAN VERSION),SOCIALS: Twitter: http://www.twitter.com/jiruberutoUSA http://www.instagram.com/jiruberutoUSA FIXED MISTAKE AT 1:31: NEW VERSION: ...
1090,2017-10-26T16:54:55.000Z,g_zfZeqxVfo,A FAREWELL TO FATS  | Old Nerd Radio - 10.26.2017,OLD NERD RADIO: On Anchor.fm https://anchor.fm/oldnerdradio On Stitcher http://www.stitcher.com/s?fid=155764&refid=stpr On iTunes ...
1091,2017-10-19T17:43:31.000Z,0J29ah_c93I,CAUGHT SERVING POPEYE'S CHICKEN! | OLD NERD RADIO | 10.19.2017 ,Tune into this special broadcast of the Old Nerd Radio podcast. Hear it 7 days a week at https://anchor.fm/oldnerdradio OLD NERD RADIO ...
1092,2017-10-21T19:12:19.000Z,aA8wvy6PhqE,"SO MANY CHEESECAKES, SO LITTLE TIME! | OLD NERD RADIO | 10.21.2017","For foodie stuff, Nerdy stuff, and retro pop culture, tune in 7 days a week to OLD NERD RADIO at https://anchor.fm/oldnerdradio. Download the Anchor.fm app ..."
1093,2017-10-13T18:52:44.000Z,dr7gkSHao9k,Rebuilding The Pittsburgh Steelers | Baker Mayfield = Aaron Rodgers | Madden 18 Connected Franchise,SUPPORT MY PATREON PAGE HERE → https://www.patreon.com/PAPAC4 SUBSCRIBE ▻ http://goo.gl/jLTmlT ♢ PATREON SUPPORTERS ♢ [aka CERTIFIED ...
1094,2017-10-19T11:00:03.000Z,yNcg6qPGdX0,Chrissy Teigan Gets Touchy Feely For Michael Strahan 'Bad & Booty-est Moments' | Wild 'N Out | MTV,Chrissy is willing to do whatever it takes to win. Check out 'Wild N Out's' top 15 Bad and Booty-est Moments tonight! #MTV #WildNOut #WNO #ChrissyTeigan ...
1095,2017-10-25T16:00:03.000Z,YW6-hzPp510,Burger King Spicy Chicken Nuggets REVIEW ,Went over to BK to try their new Spicy Nuggets. Tune into OLD NERD RADIO! https://anchor.fm/oldnerdradio NEW VIDEOS EVERY WEDNESDAY AND ...
1096,2017-10-22T16:00:09.000Z,wNp41Rr0zHk,EATING PORTLAND FOOD CARTS! ,"I'm attending the EAT MOBILE food cart event here in Portland, OR. Tune into OLD NERD RADIO! https://anchor.fm/oldnerdradio NEW VIDEOS EVERY ..."
1097,2017-10-18T16:00:02.000Z,CJSDAKOJmd0,Jack In The Box Sausage & Egg Breakfast Pocket REVIEW  #jackinthebox,"Stopping in to Jack In The Box for their new, limited-time Sausage & Egg breakfast Pocket. Tune into OLD NERD RADIO! https://anchor.fm/oldnerdradio NEW ..."
1098,2017-10-16T15:14:39.000Z,j7QTsGjgBLQ,Legends of Roblox | Roblox Toys Series 2 | Jazwares Roblox Toy Unboxing,"My eighth Roblox Toys Unboxing and the second of the new series 2 Roblox Toys, this toy and a few others was kindly sent to me by Roblox & Jazwares."
1099,2017-10-22T01:53:22.000Z,CiK4gFfnCjI, NERD TV: LIVE AND IN COLOR! | 10.21.2017  [REPLAY],"Another Saturday night chat with the Cronies! Food reviews, Walking Dead Season 8, Stranger Things 2, and other groovy things. SUPERCHAT to make a ..."
1100,2017-10-17T15:32:01.000Z,Dy9lJy-lPKk,Hunted Vampire | Roblox Toys Series 2 | Jazwares Roblox Toy Unboxing,"My ninth Roblox Toys Unboxing and the third of the new series 2 Roblox Toys, this toy and a few others was kindly sent to me by Roblox & Jazwares. Hunted ..."
1101,2017-10-17T05:15:02.000Z,jlXw7WpdM2Y,"Gemini-What in the magic....?| OCTOBER 16-22,2017","Thank you for your likes, shares, comments, and subscriptions! Thank you all so much for hanging in there. I really appreciate it. THE OTHER SIDE Vimeo: Love ..."
1102,2017-10-13T08:13:41.000Z,E8JGjlC9-Po,Bulk Image Download Tool | Bulk Product Handling in Excel Tool | Alternative for Excel Online seller,"Skype ID - ujbandara email - ujbandara@gmail.com Freeware bulk image downloader, picture download free downloader neodownloader lite. Bulk image ..."
1103,2017-10-12T21:33:02.000Z,Uc6FVsxUnDw,My Geek Box Unboxing (September 2017),My Geek Box Unboxing for September 2017. Another random assortment of items. We've also got a discount code for you guys! If you're interested in checking ...
1104,2017-10-21T02:11:33.000Z,ZwAhtXTeW34,IMEXPOSINGHUH SNAG MONTAGE #4 | NBA 2K18,SMASH THAT SUB BUTTON    TWITTER @ImExposingHuh TURN ON VIDEO NOTIFICATIONS LETS HIT 3K BEFORE 2K19 !! SUB TO MY THUMBNAIL ...
1105,2017-10-23T11:20:45.000Z,BRJ4AJtyvwM,AG magic tricks | like Zach king magic tricks,"Everybody must have watched Zach king magic.. I thought of making magic tricks like him and here they are, in my video... If you liked it make sure you like the ..."
1106,2017-10-13T00:10:31.000Z,wVMLGO3rJB8,How to Exploit/Hack in Any Roblox Game! (Level 7 Script Executor!),New Discord: https://discord.gg/MsZBP6S ▻This is a video showing how to Exploit/Hack any roblox game using Lvl 7 aka as Script Executor. This a roblox ...
1107,2017-10-17T17:55:37.000Z,cFekE0HSCKI,Katani Show   beautiful girl show her long long hair HairStyles,Katani Show beautiful girl show her long long hair HairStyle The hilarious stuff sometime put together in one compilation as to that it becomes impossible to not ...
1108,2017-10-19T02:16:35.000Z,HtDLQ5D1CJU,Warframe | Tutorial: (Almost)Free Halloween Stuff,"Yeah sorry I clickbaited the title, you'll actually need 2 credits to get these Halloween exclusive items... :c Anyhow Like, Comment(Something nice), Subscribe."
1109,2017-10-17T15:17:18.000Z,tUDvthL7keA,Girls playing very funny game,Girls playing very funny The hilarious stuff sometime put together in one compilation as to that it becomes impossible to not laugh. I am trying to deliver the best ...
1110,2017-10-15T10:06:35.000Z,xzS8qjFTHzE,Top funniest prank video 2017,Top funniest prank video 2017 The hilarious stuff sometime put together in one compilation as to that it becomes impossible to not laugh. I am trying to deliver ...
1111,2017-10-21T09:31:08.000Z,N8V4tXE8Udc,80 Sweet Best Messages to Send to Your Girlfriend,80 Sweet Best Messages to Send to Your Girlfriend The credit goes to the rightous person i.s www.orangefaceSounds.com Any issues please message and ...
1112,2017-10-22T13:13:12.000Z,LE9VT51M8R8,Funny video 2017   Indian Funny Videos Compilation    Whatsapp Videos You Can't Stop Laughing,Funny video 2017 Indian Funny Videos Compilation Whatsapp Videos You Can't Stop Laughing The hilarious stuff sometime put together in one compilation as ...
1113,2017-10-18T08:58:11.000Z,IGsIOBx17sA,Bhojpuria religious song Bolbam 2018 Bum Bum Bhole,Bhojpuria religious song Bolbam 2018 Bum Bum Bhole The hilarious stuff sometime put together in one compilation as to that it becomes impossible to not ...
1114,2017-10-21T13:17:12.000Z,fQq044QffFs,The Hottest Chilli,The Hottest Chilli The hilarious stuff sometime put together in one compilation as to that it becomes impossible to not laugh. I am trying to deliver the best funny ...
1115,2017-10-15T19:44:43.000Z,a6wXiJ5YNpg,Japan  Family Movie  #13 Compilation 2017,Japan Family Movie #13 Compilation 2017 The hilarious stuff sometime put together in one compilation as to that it becomes impossible to not laugh. I am trying ...
1116,2017-10-17T13:59:52.000Z,ViEx5IjAe9E,Beautiful Hair Style of College Girl,Beautiful Hair Style of College Girl The hilarious stuff sometime put together in one compilation as to that it becomes impossible to not laugh. I am trying to ...
1117,2017-10-15T12:05:20.000Z,L_S4SOo98xs,Girl's outside Bath just a prank,Girl's outside bath just prank The hilarious stuff sometime put together in one compilation as to that it becomes impossible to not laugh. I am trying to deliver the ...
1118,2017-10-20T09:55:10.000Z,TX3LQq_IltY,5 Everyday SIMPLE Updo's,5 Everyday SIMPLE Updo's This will hopefully give you the inspiration to create a simple and easy hairstyle just in minutes. The hilarious stuff sometime put ...
1119,2017-10-16T17:16:45.000Z,GBfiK6Mg4w8,New funny video 2017 ★ People Doing Stupid Things ★ Funny videos Fails 2017 NEW 2017,New funny video 2017 ☆ People Doing Stupid Things ☆ Funny videos Fails 2017 NEW 2017 The hilarious stuff sometime put together in one compilation as to ...
1120,2017-10-19T18:05:41.000Z,6qPKK6zYd7A,Flatiron hair style Part 2,Flatiron hair style Part 2 The hilarious stuff sometime put together in one compilation as to that it becomes impossible to not laugh. I am trying to deliver the best ...
1121,2017-10-14T11:20:43.000Z,1a09lvQ_DUg,Funny Japanese Highschool vines compilation,Funny Japanese Highschool vines compilation The hilarious stuff sometime put together in one compilation as to that it becomes impossible to not laugh.
1122,2017-10-17T17:32:59.000Z,a_WQBfGihHU,A girl doing funny pranks on people,A girl doing funny pranks on people The hilarious stuff sometime put together in one compilation as to that it becomes impossible to not laugh. I am trying to ...
1123,2017-10-22T18:43:59.000Z,RfvDZuUh4e0,pakistani funny videos compilation 2016  desi funny videos,pakistani funny videos compilation 2016 desi funny videos The hilarious stuff sometime put together in one compilation as to that it becomes impossible to not ...
1124,2017-10-20T16:38:12.000Z,k8JQXuKZmu8,First time haircut of girl,First time haircut of girl IT'S Really terrible going for the very first hair cut and that for the girls. The hilarious stuff sometime put together in one compilation as to ...
1125,2017-10-14T13:57:55.000Z,pfk6zMkJJa4,World Greatest Indonesian Head Massage   An Nisa Barber,World Greatest Indonesian Head Massage An Nisa Barbara The hilarious stuff sometime put together in one compilation as to that it becomes impossible to not ...
1126,2017-10-23T12:49:40.000Z,l2Db9bKtJjw,Sylvester 'Manafort' Stallone Trying to Lie for Donald Trump for 10 Hours,lol https://www.patreon.com/user?u=6044898 #10Hours.
1127,2017-10-17T15:02:30.000Z,g_27JCTCgtY,Girl doing lot of fun,Girl doing a lot of fun The hilarious stuff sometime put together in one compilation as to that it becomes impossible to not laugh. I am trying to deliver the best ...
1128,2017-10-15T10:28:35.000Z,q5SUHFUXO6Y,Amazing Beautiful Girl Fishing   Beautiful Girl Catches Big Fish By Hand in Battambang Province #12,Amazing Beautiful Girl Fishing Beautiful Girl Catches Big Fish By Hand in Battambang Province #12 The hilarious stuff sometime put together in one compilation ...
1129,2017-10-18T13:54:34.000Z,asTQSsL39Ys,Beautiful Girl Fishing   Amazing Fishing at Battambang   How To Catch Fish   Cambodia Traditional,Beautiful Girl Fishing Amazing Fishing at Battambang How To Catch Fish Cambodia Traditional The hilarious stuff sometime put together in one compilation as ...
1130,2017-10-21T10:31:42.000Z,b0sf7T0Zkvw,Indonesian Head Massage   three Woman on one Man,Indonesian Head Massage three Woman on one Man The Best massage in the world The hilarious stuff sometime put together in one compilation as to that it ...
1131,2017-10-17T21:57:49.000Z,qWIDLM10rtI,Top Most Beautiful Kurdish And Yazidi Women hd image download videos,Top Most Beautiful Kurdish And Yazidi Women hd image download videos The hilarious stuff sometime put together in one compilation as to that it becomes ...
1132,2017-10-20T06:55:14.000Z,TM6h6eSf_s8,Lifetime African American Movies  New Black Movie   Based On A True Story 2017,Lifetime African American Movies New Black Movie. Based on a True Story 2017 The hilarious stuff sometime put together in one compilation as to that it ...
1133,2017-10-22T13:26:23.000Z,BOoSDhx3VSA,India & Pakistan Most Funny 2017 Whatsapp Video Clips   Funniest Videos 2017,India & Pakistan Most Funny 2017 Whatsapp Video Clips Funniest Videos 2017 The hilarious stuff sometime put together in one compilation as to that it ...
1134,2017-10-15T15:45:51.000Z,RgGjs7xFxdI,Most beautiful girls dance in the world 2017,Most beautiful girls dance in the world 2017 The hilarious stuff sometime put together in one compilation as to that it becomes impossible to not laugh. I am trying ...
1135,2017-10-19T10:31:55.000Z,R_olK-vWEW8,Double cheeked up,ok this is epic.
1136,2017-10-22T10:42:19.000Z,JTHTLzwie-o,Wow ! beautiful girl cooking   village food factory,Wow ! beautiful girl cooking village food factory The hilarious stuff sometime put together in one compilation as to that it becomes impossible to not laugh.
1137,2017-10-17T15:24:28.000Z,Hf9ALTIyJVM,Funny video compilation 2017,Funny video compilation 2017 The hilarious stuff sometime put together in one compilation as to that it becomes impossible to not laugh. I am trying to deliver the ...
1138,2017-10-14T15:35:19.000Z,8FDKoew2MCo,Japan beautiful girls play game at school Compilation,Japan beautiful girls play game at school compilation The hilarious stuff sometime put together in one compilation as to that it becomes impossible to not laugh.
1139,2017-10-24T05:49:23.000Z,R-cx4vwbyeg,Girl Farting In Jeans,Girl Farting In Jeans The hilarious stuff sometime put together in one compilation as to that it becomes impossible to not laugh. I am trying to deliver the best ...
1140,2017-10-15T08:01:08.000Z,kHIJtAafAjQ,Japanese Beautiful girl in the coffee shop Compilation,Japanese Beautiful girl in the coffee shop Compilation The hilarious stuff sometime put together in one compilation as to that it becomes impossible to not laugh.
1141,2017-10-15T20:13:43.000Z,-bVzP0JotLY,Japanese Girl on Train Compilation,Japanese Girl on Train Compilation The hilarious stuff sometime put together in one compilation as to that it becomes impossible to not laugh. I am trying to ...
1142,2017-10-01T23:25:31.000Z,o61NgVU81yI,Win a Countdown Grocery Grab!,October Special Monthly Competition! The biggest comp of the year is back again! This is your chance to be in charge of your own supermarket trolley and ...
1143,2017-10-06T15:29:48.000Z,i5W1BOOKTRs,"""Play The Pumpkin Cash Grab"" at The First Council Casino","The finest gaming destination in Northwest Oklahoma! Let the winning begin on our gaming floor, home to 1200 of today's hottest slot machines, and live ..."
1144,2017-10-06T10:39:09.000Z,kg-YGuKZMOE,[MVCI] Thanos/Haggar - HP command grab combo using HSD glitch,LOL at the Lv3 scaling.
1145,2017-10-05T09:51:27.000Z,W-cJ79TJpvk,7 Facts About Coffee That Will Make You Want to Grab Yourself a Cup,"7 Facts About Coffee That Will Make You Want to Grab Yourself a Cup ******************************************************************** ✑Sorry Viewers, I can not ..."
1146,2017-10-06T18:00:06.000Z,t63BgutVjCY,Halloween Makeover! App Games Friday!,Happy Friday! Today I am checking out an app game called Halloween Makeup Me! Have you guys played this app game before? Let me know in the comment ...
1147,2017-10-10T20:00:01.000Z,DB41xDUcBuQ,"""Meeting Great Nanna"" ~ Grab 5 Scrapbooking Process Video + + + INKIE QUILL","Get those unused washi tapes a'rollin! Today I tackle washi as one of the ""ingredients"" to my Grab 5 challenge. Stay tuned for a different layout using these same ..."
1148,2017-09-28T23:12:28.000Z,hIEhMZqP09g,Xiaomi Redmi 4x | 4/64Gb | Unboxing!,"Grab the 4/64 version on gearbest for just 134,05 euros on Gearbest! https://www.gearbest.com/cell-phones/pp_635898.html?wid=21."
1149,2017-10-05T11:54:42.000Z,EuBxZgV2wmY,SECRET about free Paytm Cash !!!,dosto is video me maine aapko paytm free cash se related jaankari di hai 1) aap free paytm cash grab kar sakte he 2) aapko kitna free paytm cash milta hai 3) ...
1150,2017-10-04T02:39:50.000Z,UMdCBp9bpSQ,How to Blow Two Clutches in 1 Day,"Crovette ZR, Supercharged Foxbody and BMW M6 at the quarter mile track laying down some times. The ZR1 is still having traction issue on the Cup2 tires."
1151,2017-10-09T11:30:00.000Z,3KS0yRgt6ck,Top 10 Free New FONTS,these are my picks for fonts for late 2017 all these fonts are fresh and free to use I put all these fonts in one place to grab them easily. Fonts google drive link: ...
1152,2017-10-09T05:54:11.000Z,4ZrMT1RLReI,WWE HELL IN A CELL LIVE SHOW REACTION,Join in and grab a snack! WWE HELL IN A CELL LIVE REACTION SHOW Support the stream: ▻▻▻ *BEST DONATION LINK* HERE▻▻▻ ...
1153,2017-10-11T10:15:16.000Z,pHqO_D4jLS4,"Playing with 1000 mini magnetic balls! (pt. 3, Kinetic sand, Bucky balls and Oddly satisfying ASMR!)",Give the people what they want! … More magnets and bucky balls with plastic men? Part 3! This time I introduce some oddly satisfying kinetic sand! It's super fun ...
1154,2017-09-28T11:46:31.000Z,YQJz1aNBkv0,FIND THE KEYS | Animated Bendy and the Ink Machine Rap!,"Chapter 3 is here! And along with it is this monolithic project I've been working on since May! ('Just a simple lyrics video' I told myself...) Being an animator, I ..."
1155,2017-09-27T16:43:27.000Z,RjunBX_w0HM,"No Fuss, No-Knead Sourdough Bread (using sourdough starter) | ASMR Cooking | In Carina's Kitchen","This is a an easy, foolproof method of making a beautiful sourdough loaf without needing to be a professional baker. And you can make it in a normal oven - all ..."
1156,2017-10-02T22:39:08.000Z,X4-z8JI7IOM,My Chucky Doll Collection UPDATE,This is a positive channel of love and acceptance. Bullies will be blocked. WANT MORE CHUCKY VIDEOS? CLICK HERE: ...
1157,2017-10-10T17:16:07.000Z,BM79R44UYFY,Lil Uzi Vert - Dark Queen [Official Visualizer],Win a chance to celebrate the holidays with Uzi - http://www.liluziofficial.com/win Lil Uzi Vert - LUV is Rage 2 - OUT NOW Download/Stream ...
1158,2017-09-27T16:00:05.000Z,dZNu-svitC0,FIFA 18 | HUDDERSFIELD TOWN CAREER MODE | #1 | A NEW JOURNEY BEGINS,Welcome to the very first episode of our FIFA 18 RTG Career Mode with Huddersfield Town! It's my first series on FIFA 18 and if you're new to the channel then ...
1159,2017-10-09T16:06:03.000Z,xlgmSOp8j1U,Youfoodz Review by a Nutritionist!,I ordered 1 week of Youfoodz meals for lunch & dinner. Youfoodz is a meal prep service that delivers fresh (not frozen) meals in Australia. I show each meal up ...
1160,2017-10-01T13:33:09.000Z,-gTPwlNtjXw,HOW TO MAKE A HAT IN JERSEY STITCH - TUTORIAL STEP BY STEP FOR BEGINNER [LOOM KNITTING DIY],INSTAGRAM:@Valena_DIYhttp://urlz.fr/7rzz  FACEBOOK : Valena DIY  http://urlz.fr/7rbv  SUBSCRIBE TO SUPPORT THE CHANNEL !   Thank you for ...
1161,2017-10-11T04:56:06.000Z,J89jq7Bsmdk,TOP EAGLES MUT TEAM ON YOUTUBE? -- EAGLES SQUAD BUILDER | MUT TUESDAY | MADDEN 18 Ultimate Team,Follow Me on Twitter: BeastMode_TV Support My Patreon: www.patreon/com/PAPAc4 Subscribe if you're new #Madden #Madden18 #MUT ...
1162,2017-09-30T23:29:51.000Z,TC_CQGD4a9A,Seminole Moment: James Blackman's Game-Winning TD Pass to Auden Tate vs. Wake Forest (2017),TWITTER: https://twitter.com/SeminoleMoments FACEBOOK: https://www.facebook.com/SeminoleMoments DONATE: https://www.paypal.me/davidraider88 ...
1163,2017-10-10T18:14:04.000Z,kJ6tnuFhp8A,"3rd days old baby monkey, Newborn baby monkey breastfeeding milk, Monkey Camp part 1945","3rd days old baby monkey, Newborn baby monkey breastfeeding milk, Monkey Camp part 1945 Welcome to all visitors here! thank you very much for watching ..."
1164,2017-10-04T01:18:36.000Z,9wwH5yCTTu8,MAI NATSUME MAKES JUBEI RAGE QUIT?! Blazblue Central Fiction online matches #8,"I'm really gonna start uploading Blazblue more, Its really fun. I also gotta start practicing with another character ( Makoto or Bullet) instead of using Mai all the ..."
1165,2017-10-07T14:51:11.000Z,1vS8OfwlIPQ,Save All Day - Dari Mata Sang Garuda (Pee Wee Gaskin cover) @Arcaf Cafe,"Yogyakarta, Indonesia Cameraman: @niko_satia @a.poromarto Organized by: Amikom Music Organization."
1166,2017-10-09T10:53:33.000Z,LpXwM3m9XIg,Kettlebell HIIT Workout - 8 mins amap,"A massively neglected area of health and fitness is mindset. We use our skills and experience from the military, fitness industry and our members to develop and ..."
1167,2017-10-12T14:42:16.000Z,6awI5xytTvI,"""PHENOMENAL"" AJ STYLES WWE THEME TUTORIAL | TECHNICAL JATIN |",This sheet I will give you after 500 subscribers original song by CFO$
1168,2017-10-09T07:10:27.000Z,QRlQ7ascK4Q,How To Download Wire Shark on window 8.1,Hi Guys! In this video i will showing you How To Download Wire Shark on window 8.1. Enjoy The Video And Please Fallow Me. Download PC Games on ...
1169,2017-10-05T12:32:55.000Z,S8nLKelEbi8,Abomination And Savage Hulk VS Giganta And Annoying Orange In A MUGEN Match / Battle / Fight,This video showcases Gameplay of Abomination And Savage Hulk VS Giganta And The Annoying Orange In A MUGEN Match / Battle / Fight Become A New ...
1170,2017-09-29T04:42:05.000Z,5LgDTQjW3D0,Raiden And Shao Kahn VS Ip Man And The Annoying Orange In A MUGEN Match / Battle / Fight,This video showcases Gameplay of The Annoying Orange And Ip Man The Wing Chun Grandmaster VS Raiden The God Of Thunder From The Mortal Kombat ...
1171,2017-10-10T01:58:59.000Z,Q0CbN8sfihY,Star Wars: The Last Jedi Trailer (Official),Watch the new trailer for Star Wars: The Last Jedi and see it in theaters December 15. Get your tickets now: http://www.fandango.com/lastjedi Visit Star Wars at ...
1172,2017-10-10T22:51:50.000Z,SfCsb4Ck75w,RiceGum - Frick Da Police (Official Music Video),"Download on Apple Music: http://apple.co/2zhldMU LYRICS A thirty minute vid, I'm who you're obsessed with You look like your sister is the girl that you have ..."
1173,2017-09-29T17:38:37.000Z,lF9ZzjJvUR0,RONDA ROUSEY HOT BOTTY,SUBSCRIBE TO THE CHANNEL!
1174,2017-09-23T14:05:24.000Z,xYK4u-TMKFg,Taxi Driver and Grab Driver Fight!,subscribe for more latest Viral news Taxi Driver and Grab Driver Fight! Taxi driver and Grab driver quarreling with each other at Tanah Merah Ferry Terminal.
