,published_at,video_id,title,description
541,2018-03-11T02:27:27.000Z,7IZ3x9ifKXY,Sailor Moon & Dragon Ball Z Funko Pop Haul w/ Toys R Us Gamestop PX Previews & NYCC Exclusives!,"Sailor Moon & Dragon Ball Z Funko Pop Haul! We're adding some Pop Vinyls to our collection from two of our favorite anime series', and included are some ..."
542,2018-02-27T02:58:11.000Z,8B98tX6SeCg,FAN MYSTERY BOX UN-BOXING & CHAT!! | 2.26.2018  [REPLAY],Support the channel with a SUPERCHAT donation and you'll be the coolest kid in school! THANKS!  Want to send something for me to talk about on the ...
543,2018-03-05T14:30:31.000Z,Li2nySOtkmE,PlanetWatch Game Official Trailer 2018 | MuseWearables | 1080p,"Planetwatch GAME - Follow our hero, a space adventurer who took it upon himself to save a beautiful planet from the exploitation of an Evil Galactic Corporation!"
544,2018-03-06T02:59:16.000Z,xbn8xlxM0HE,Drinking Coffee To Stay Alive! | LIVE Chat @OldNerdReviews | 3.5.2018  [REPLAY],Make a donation to the channel HERE https://streamlabs.com/oldnerdreviews Another live chat night of fun with the Crony Community. Love to have you!
545,2018-03-11T06:47:25.000Z,ws1Ek0n_IRw,"SUPREME KHILADI Bollywood Hindi dub | New release Movie | Sai dharam tej, Ravi Kishan,Rashi khanna.",Subscribe and like also comment...... Film:- SUPREME KHILADI. Actor:- sai dharam Tej. Actres:- Rashi khanna. Producer:- Aditya music India pvt.Ltd. Director ...
546,2018-03-02T04:48:16.000Z,5xrmJ_0ibkU,Yoga for Feet & Ankles  | 24 min | Vitalita Yoga,"This short yoga practice is just what you need at the end of a long day; if you've got swollen ankles, sore feet or plantar fasciitis, your feet will rejoice! Kick off your ..."
547,2018-03-01T17:00:04.000Z,dIfu7JhCWzI,LIVE Chat Time on Twitch | 2.28.2018 @OldNerdReviews [REPLAY],"JOIN US LIVE ON TWITCH! https://www.twitch.tv/oldnerdreviews Tried to do American Truck Simulator, but it didn't want to cooperate. We just be chattin' about ..."
548,2018-03-04T17:48:51.000Z,yrfIA34fJ90,NEW Dollar Tree Haul,"Thank you for Watching & Subscribing! Please Like,Share & Comment Check Out My Most Popular Video: https://goo.gl/M7iJmx Learn Tips and Techniques, ..."
549,2018-03-10T19:56:30.000Z,8xqD8g3PFzc,Roblox Jailbreak Live Stream - Sorry Toy Codes all won on the Live Stream!,TO SPONSOR ➜ https://fraser2themax.com/sponsor Come join me in my Roblox Jailbreak Live Stream starting at 5pm GMT / 6pm CET / 12pm EST / 9am PST ...
550,2018-02-25T00:48:05.000Z,NOhEnog9NpU,"Trump Administration Considering Confiscating Guns from ""Dangerous People""","President Trump confirmed on Friday that he would support stricter firearms regulations, including a proposal to strengthen the federal background check system ..."
551,2018-03-06T14:31:06.000Z,aDoAtFF7yKI,FMV |Lee Taeyong |NCT| Ligts down low,Idol:Lee Yaeyong(NCT) Credits: bxyit Phan Vkook #NCT #FMV #Taeyong #NCT127 #NCTU #NCT2018 #FMVTaeyong.
552,2018-02-26T08:37:55.000Z,StNu6omekfU,AR15-School shooting-Parkland shooting-Assault rifle-SHTF,What is the answer to stop mass shootings? We know the government is not the answer when minutes count you are on your own we as a people need to be ...
553,2018-03-11T04:51:58.000Z,nBVy84Ttvbk,"SGD15,000 worth of NutriFirst prizes will be given away at the IFBB Singapore Nationals 2018","SGD15,000 worth of NutriFirst prizes will be given away at the IFBB Singapore Nationals 2018. Thank you very much NutriFirst! You have been our valued ..."
554,2018-02-25T03:16:53.000Z,zCUQBn7_oRQ,(1100 GH/s free) cloud mining || Without Investment Top 5 free & best Cloud Mining Website,"Hello Friends Welcome To ZT Advise. Friends, in this Video, i have shown 5 FREE Mining Websites using which you can Easily Mine/Earn many different ..."
555,2018-03-06T13:31:32.000Z,tk3DOdCTGhA,HYPE HORN - Early Bird Pokemon Opening #100 Episode  FASTEST OPENINGS IN YOUTUBE,In today's Early Bird opening #100 EPISODE!! HOPE YOU GUYS ENJOY! I really appreciate you guys watching! THANKS!! If you enjoyed this video make sure ...
556,2018-03-09T17:14:13.000Z,hKSOdkcpeT8,Franklin's electric vehicles save his family gas and money,Franklin and his family have two electric vehicles and they love them both! Learn more about how they save money every month by driving electric at ...
557,2018-03-03T18:10:05.000Z,NYTB33MzL30,Ddd,เพลงเราจะลุกเดินก้าวไป พร้อมซับเพลงไทย เวอร์ชั่นอุลตร้าแมน เพราะและ...
558,2018-03-08T01:16:20.000Z,VZ0TmaPH9Rc,Google Play: Keep building (Stories from successful startup founders),"Hear from four successful founders about their story in the mobile industry, how they got to where they are today and what has inspired them along the way."
559,2018-03-02T22:14:56.000Z,dRANu6OJ3mI,park jimin|| fuck it (+for alexis my queen),watch in HD! -listen with headphones please!- idol: park jimin song: fuck it- dys.fck (pitched a bit+ my audio) time: 2 days coloring; mine asdfghj fancams: off the ...
560,2018-02-25T21:15:40.000Z,pRVsEMcm8Zo,GTA Online - Gang Attack #13 (Grand Theft Auto V),Follow me on Instagram ▻ https://instagram.com/7gamen3rd/ Twitter ▻ https://twitter.com/7gameN3RD Facebook ▻ https://www.facebook.com/7gameN3RD ...
561,2018-03-05T01:00:38.000Z,tP1viXDUsuo,CS Executive | Increase coverage of Capital Markets & Securities Law |,Buy my Video Lecture of CS Executive for December 2018: Company Law (old) ...
562,2018-03-09T00:50:31.000Z,U5gb6j2fhGs,3 Squishy PACKAGES!!!,( ˊ̠˂˃ˋ̠ )꜆ OPEN ME～(^з^)-♡ We are opening 3 SQUISHY PACKAGES!! WOW!! LINKS: The Yummibear snowman: ...
563,2018-03-07T06:48:44.000Z,R8TeXuCGU-g,Twisted Murder admin SCRIPT,"SCRIPT: loadstring(game:HttpGet(""https://pastebin.com/raw/ukz6NfP0"", true))() SERVER SIDED COMMANDS: kill (plr) | kills a person loopkill (plr) | loop kills a ..."
564,2018-03-04T07:30:00.000Z,HA5ZyRkAnIE,Ambrish And Sumalatha Lip To Lip Kissing Scenes | Honkong Nalli Agent Amar Kannada Movie | Scene 19,"Watch the kannada Best super Scenes of Ambarish Movie ""Hongkongnalli Agent Amar"" Best Action Movie Scnes Stars: Ambarish, Ambika, Umashree, Anuradha ..."
565,2018-02-24T23:22:33.000Z,LoHgc1vcUi8,Teddy Bear vs Train,Teddy bear vs Train new experiment to show that what happened when train cross over the teddy bear.
566,2018-02-27T23:48:29.000Z,gERWXsALPTo,Keijo - Kyoko Shirayuki Teaches - The Butt Flash - Full Training,What I do is watch the Animes for you and pick out the Best Moments! Hope You Guys Like these moments & hopefully I made your day just a little better ...
567,2018-02-21T05:28:29.000Z,N-84MneQzAU,when jk just wanted to grab V's hand [ run moments ],"music "" last first kiss "" original by One direction. used in BGM cover by Madilyn bailey Copyright Disclaimer Under Section 107 of the Copyright Act 1976, ..."
568,2018-02-22T21:08:48.000Z,JkrgU5Y75ug,Grab your snorkel!,"Feb 22, 2018! Pow town!"
569,2018-02-13T16:00:04.000Z,UBnW6OQWnfI,The Domke Daily 116: Run-On Skimboarding Frontside Grab 360 Air,LIKE & SUBSCRIBE!
570,2018-02-22T21:33:00.000Z,2LCdn3xNSUs,New Jason Grab?!|Friday the 13th the game,Here's the actual tweet ...
571,2018-02-10T14:12:38.000Z,qy7ufVtxt8Y,When Grab Driver Meet Her Destiny,"Tesa (bride) is grab driver. When she work, she meet Ken. Story goes, and finally they love each other and decide to married in Bali. Video by Mariyasa Film ..."
572,2018-02-11T15:26:13.000Z,X5Z85v2F54g,How to get rid of all time wasting grab in your life!,"With the proliferation of technology in our lives we're bombarded with information, solicitations, and messaging. This guy tells How to Commit ""Social Suicide"" to ..."
573,2018-02-13T10:00:56.000Z,QPAC9wMmQlk,Star Wars Battlefront II - Mission9 - Cache Grab,"목소리 없음, BGM 없음, 편집도 거의 없음. 영상만 담은 게임 채널. ionseok.tistory.com."
574,2018-02-19T23:18:16.000Z,CwvCxdACfh0,Keijo - Kotone Fujisaki - Biting Ass or ASS GRAB and TROW,What I do is watch the Animes for you and pick out the Best Moments! Hope You Guys Like This Moments & watch Your Anime Moments in HD 1080p ...
575,2018-02-20T15:19:38.000Z,QdOAnFMcoQ4,World Series of Poker: Grab Your Seat (Horizontal),https://playwsop.com/ WORLD SERIES OF POKER Play Now ▷ https://playwsop.com/ Facebook: https://www.facebook.com/WorldSeriesofPokerGame Twitter: ...
576,2018-02-21T18:00:03.000Z,olw-r8Na2r0,Arma 3 | Snatch and Grab,Some more good ol' Arma 3 :D We are just friendly HVT's trying to get home! Subscribe Today! ▻ http://bit.ly/1DafckP Like me on Facebook ...
577,2018-02-18T17:00:03.000Z,cxVaOWiThM8,Banquet Sausage & Gravy Deep Dish REVIEW (Eating The Dollar Stores) ,GRAB THE MERCH! https://www.zazzle.com/old_nerd_reviews Another episode of Eating The Dollar Stores. Trying the Banquet Sausage & Gravy Deep Dish ...
578,2018-02-20T04:00:00.000Z,gGSNVI0Jknk,Family Guy - Steve Rips Out Meg's Heart,Family Guy - Steve Rips Out Meg's Heart.
579,2018-02-14T23:15:27.000Z,I64b82OEjNE,Des Moines Police Bodycam Video of Officer Fatally Shooting Woman - WARNING: GRAPHIC CONTENT,Disclaimer: This video content is intended for educational and informational purposes only) ** Des Moines police released a graphic video Tuesday showing an ...
580,2018-02-12T10:39:44.000Z,_VCfy2GHj3I,"SOLD - 8 Plumpton Avenue, Mt Roskill - Sven Higham and Glenn Higham",This property has now been sold All Reasonable Offers Considered Property Number - 752550: http://www.barfoot.co.nz/752550 Grab this opportunity with both ...
581,2018-02-17T09:03:06.000Z,COpPq9mzYXA,BFB 7 but only when Four is on screen,"THE THUMBNAIL'S SOURCE FILE IS OUT, GRAB IT!: https://drive.google.com/drive/folders/1YxAwy4fv7hmAniAHc7Y6Y0MsLknyB_-j Join my Discord server: ..."
582,2018-02-10T13:25:01.000Z,GmNKChGrwbM,HOW TO CREATE A SUCCESSFUL ETSY SHOP | How to set up shop on Etsy,LOOKING FOR A FREE ETSY SHOP CRITIQUE??? - I GOT YOU COVERED GIRL! - GRAB A FREE PERSONAL ETSY SHOP VIDEO RIGHT HERE ...
583,2018-02-16T01:39:20.000Z,K2cImcfNFKI,How to Shoot a Hyperlapse on the Panasonic GH4 and GH5,"What's up! FilmSpotz here. In this tutorial, I will be showing you how to shoot a time lapse on the GH4 and GH5. Grab a free copy of my eBook guide."
584,2018-02-21T19:36:16.000Z,49NHtMuLLJ0,METAL BOX FORT ON WATER!! (SINK OR FLOAT?),WILL THE INDESTRUCTIBLE METAL BOX FORT FLOAT OR SINK IN THE WATER? CHECK OUT THIS EPIC VLOG! Today Carter Sharer and the whole Sharer ...
585,2018-02-20T19:22:33.000Z,7hQoh7rRI0I,A MATTER OF FACTS  | JT Music Fact Rap Challenge,So the awesome JT Music put out a challenge to make a rap out of interesting trivia... And that's the sort of thing I just can't resist! So here's my rebuttal.
586,2018-02-22T00:14:36.000Z,JEyqrLmclRM,Keijo - Nozomi Kaminashi - Your Putting on Muscle on All The Right Places !,What I do is watch the Animes for you and pick out the Best Moments! Hope You Guys Like This Moments & watch Your Anime Moments in HD 1080p ...
587,2018-02-09T22:30:00.000Z,laV4oH0qo2o,LEGO Minecraft The Polar Igloo | LEGO Review & Speed Build,"A review of the LEGO Minecraft set The Polar Igloo (21142). This set contains a Stray, Polar Bear, Baby Polar Bear, and Alex. BRICK 101 features fun videos that ..."
588,2018-02-15T16:45:10.000Z,0hzFZSWSBfM,Golf R Detailing Project - Plus BMW 520D Gtechniq Coatings,This week we hand over a freshly Detailed Golf R after Gtechniq Coatings. We project manage a Golf R for a customer who is away for the week. Plus carry out a ...
589,2018-02-21T15:11:55.000Z,-NcXvql2DSY,"What-Eva! I Do What I Want! Box from The Border Geek - TMNT, Star Wars, Predator, Oh My!","""What-Eva! I Do What I Want!"" is the entire reason behind this box from The Border Geek. XD One of our best buddies has sent us another box of goodies, ..."
590,2018-02-14T17:00:05.000Z,wHW6hFcOvDI,Bad News Bears Triple Play Collection REVIEW ,Talking about and putting in my two cents about the Bad News Bears collection of movies. GET YOUR OWN! http://amzn.to/2EAVRPx OLD NERD RADIO: On ...
591,2018-02-20T12:53:29.000Z,JWVhxYcD3PU,GROVE HAUL,"Hey guys! I wanted to share my recent purchases from the Grove Collaboration, I have been really loving the things I purchased from this all natural cleaning site ..."
592,2018-02-24T14:00:04.000Z,xPQsIZdk_W0,D Frost Wonder Review - Testing As Seen on TV Products,D Frost Wonder Review - Testing As Seen on TV Products Here's my review of the meat thawing tray called D Frost Wonder. What they claim: No need to wonder ...
593,2018-02-16T22:40:03.000Z,IsO39HstcUg,CHILLING! | Old Nerd Chat | 2.16.2018  [REPLAY],"CHECK OUT THE MERCH! https://www.zazzle.com/old_nerd_reviews Having some afternoon fun with the Crony Community. SUPERCHAT to make a donation, ..."
594,2018-02-21T19:25:33.000Z,0Kk2e0jedSc,"DIY crafts,how to make Paper Flowers","DIY crafts,how to make Paper Flowers tutorial. Hello, Friends Welcome to my You Tube Channel Hand ctaft at home. In this video i will show you diy crafts,how to ..."
595,2018-02-13T05:22:43.000Z,mQPpLn_xAkE,OLD NERD REVIEWS CHAT & DISCO! | 2.12.2018  [REPLAY],"Getting down and boogieing with the Old Nerd. SUPERCHAT to make a donation, get your question answered, and help support the channel. THANKS!"
596,2018-02-14T23:53:41.000Z,HZZnjkLwSOE,Funko Vnyl for Valentine's Day - Because There's No I in Vynl Since They Are Always Together!,"Funko Haul for Valentines Day and it's Vynl! Why Vynl for Valentine's Day? Well because there's no I in Vynl since they always come together! Yeah, we're dumb ..."
597,2018-02-19T19:12:04.000Z,8s8CG7IDbEI,Mila and Emma | Mila Trying To Make Food or Cooking Something | Emma and Mila Viral Videos,Mila and Emma | Mila Trying To Make Food or Cooking Something | Emma and Mila Viral Videos Your sandwiches are gross Mila-Emma WE NEVER HAVE ...
598,2018-02-13T05:22:43.000Z,mQPpLn_xAkE,OLD NERD REVIEWS CHAT & DISCO! | 2.12.2018  [REPLAY],"Getting down and boogieing with the Old Nerd. SUPERCHAT to make a donation, get your question answered, and help support the channel. THANKS!"
599,2018-02-23T05:08:20.000Z,yrHe8N-uDyM,RUSSIAN BOTS! EXPOSED! - BOILER ROOM LIVE STREAM - Jay Dyer,jaydyer #boilerroom #satire Be sure to subscribe and follow me on my backups: My Site: https://jaysanalysis.com My Patreon: https://www.patreon.com/JayDyer ...
600,2018-02-10T00:32:34.000Z,LqdBQP3HjVs,Athlete Story - The show giving you inspiration from world class athletes and lessons from sports,"You may have just landed here and wonder if this channel is for YOU... Before introducing myself, let me just tell you the main things you will get here on my ..."
601,2018-02-15T10:51:00.000Z,0lwjg9XiWUY,DIY Sprinter Van Conversion | Installing Ceiling Walls and Floors,"After installing all the electric (goo.gl/YiMUu1) and insulation (goo.gl/awYRRR) we started installing the ceiling, walls, and floor. One of the toughest problems ..."
602,2018-02-18T20:06:14.000Z,5ewfoh4WREY,Kourtney Kardashian shows off what Scott Disick is missing!!! - Subscribe,Check out our Instagram @ https://www.instagram.com/belikewaternews Check out our Twitter @ https://twitter.com/fu_beatz This Video is owned by Be Like ...
603,2018-02-12T20:17:29.000Z,IfOrUIrwYrw,5 AMAZING Inventions - Dot Watch - You NEED to See #274 (New Future Technology 2018) [CRAZY HD],Crazy Satisfying - http://bit.ly/CrazySatisfying . Watch the list of Top 5 Future Technology Inventions You NEED To See in 2019 to 2050 [CRAZY HD] - 5 ...
604,2018-02-17T22:46:16.000Z,NQtj6gw71yY,RACK AND PINION: Essential for FIRST Lego League,GoFundMe Page: https://www.gofundme.com/help-us-go-to-fll-world-competition In this video we show you how you can use a Rack and Pinion for your robot.
605,2018-02-12T02:41:46.000Z,JcSCs3Gauzo,"Zac & Dan On Moving Forward After Failure, Icelandic Wonders & The Psychedelic Experience",Our boys Zac and Dan are back on the show with us today! Doc kicks it off with asking them about the Commonwealth Games qualifiers and we learn all about ...
606,2018-02-22T12:00:00.000Z,F0v2QX242GI,ArrowZ on Roblox (Code for Exclusive Free F2TM Bow in the Description),SUBSCRIBE HERE! ➜ https://fraser2themax.com/subscribe Be sure to hit the bell and join my notifications squad! Roblox ArrowZ By Fresh Devs ...
607,2018-02-23T16:54:03.000Z,BWkXEZeuOYQ,"Appy Fizz review | Price, Ingredients, Side Effects Everything","Namaskaar Dosto, Is video mein appy fizz ka review kiya gya hai, aur price, ingredients, nutrition info, effects bhi btaye gye hai.. Watch Red Bull review: ..."
608,2018-02-10T18:28:10.000Z,3Xpip0dQhKg,"Huge Scrapbook Paper Haul, K & Co 360 Stack Flip Through","Huge Scrapbook Paper Haul, K & Co 360 Stack Flip Through. I unpack a box of two K and Company 360 page stacks. Then I turn the pages on one K and Co ..."
609,2018-02-18T21:21:15.000Z,KvpDUx6q5cg,3dsboy08 disstrack,"yuh, this goes to 3dsboy08 now that i think about it, this goes out to gayboy69 yuh ay get ready you hecking skid ay 3dsboy has a small pp he can't ever pay his ..."
610,2018-02-17T01:06:06.000Z,QMNb5oW6wFE,BONDI SANDS LIQUID GOLD SELF TANNER REVIEW | ASHLEY GAITA,I also forgot to mention in the video that this product does NOT stain your sheets. I applied before bed and slept on my white sheets and they were in perfect ...
611,2018-02-21T11:35:26.000Z,W_IfQjJ-NbY,How to Find and USE Chords from ANY SONG! | FL Studio Tutorial!,Today I show you how to find chords from any song and use them for yourself in your project! Thank you for watching How to Find and USE Chords from ANY ...
612,2018-02-12T08:22:13.000Z,ulASTVYpXxQ,Indian Aunties | Types of Indian Aunties.,Hey guys. Hope you have a hearty laugh with this one. Insta- gurl_nex_door.
613,2018-02-18T19:44:48.000Z,BcdRwbiuQvM,(Stove kill) Friday The 13th The Game All Jasons Do Stove Kill,"All Jason's Do Stove Kill Leave a like if you enjoyed the video, share if you feel you need to, and subscribe if you enjoyed the carnage and wish to see more!"
614,2018-02-22T08:21:50.000Z,4lSW8NGKTlw,"how not to drive cars, road rage,car crash videos and car dashcams of usa, russian and29 cuntries","driving lessons, first time driving, how to drive a car, bad driving, extreme driving, truck driving skills, truck driver, dashcam, truck driving, fail compilation, car ..."
615,2018-02-13T19:01:33.000Z,K7rij-9-wzg,FAKE ID KE SIDE EFFECTS ||  2018 (HD),Please Do Subscribe to our Channel Thankyou.
616,2018-02-14T22:09:56.000Z,1XdbxUbIn6A,Trailer of a new Holliwood Movie,Trailer of a new Holliwood Movie The hilarious stuff sometime put together in one compilation as to that it becomes impossible to not laugh. I am trying to deliver ...
617,2018-02-20T19:47:20.000Z,1TzSxbWms88,25 hextech chest opening.,"Hello sumoner, leave a like comment and subscribe for future streams. You can find me in https://www.patreon.com/AhriCharm and instagram-Ahri Crarm."
618,2018-02-18T23:11:12.000Z,c3x4YC7EUE4,Keijo - The Ass of Vajra - Iron Fit Ass,What I do is watch the Animes for you and pick out the Best Moments! Hope You Guys Like This Moments & watch Your Anime Moments in HD 1080p ...
619,2018-02-09T18:30:01.000Z,xv0lO1r1ZuU,Crazy Black Guy Trying to Use Shadow Clone Jutsu for 10 Hours,lol So funny that i'll have to give myself some prrromotions! https://discord.gg/GpyXUu6 https://www.patreon.com/user?u=6044898 ...
620,2018-02-12T17:09:07.000Z,cbuHXzP9kLA,Anime fanservice moments,"Akiba trip episode 3. Copyright Disclaimer under section 107 of the Copyright Act of 1976, allowance is made for “fair use” for purposes such as criticism, ..."
621,2018-02-15T06:39:03.000Z,W5Li0XyreWM,"Pump and Dump Bot Cracked Version Yobit, Bittrex, Cryptopia & Poloniex",Скачать бота по ссылке: https://vk.cc/8j6ZLf Download bot the link: https://vk.cc/8j6ZLf ---------------------------------------------------------------------------------------...
622,2018-02-11T22:27:45.000Z,wVtcX0aASMQ,Opening of 10 revel orbs.,"I opened a 10 revel orbs in my own account. Dont forget to like, coment and subscribe."
623,2018-02-12T04:23:38.000Z,Iw7cVnRTBfk,ROBLOX Tutorial - How to Disable Core GUI's,Hey guys! Today I'm going to teach you guys how to disable core gui's on Roblox. If you have any problems please contact me on discord or roblox. If you did ...
624,2018-02-18T01:19:20.000Z,fo-LdW_XCIM,Keijo - Kazane Aoba Explains What The Wedgie Does !,What I do is watch the Animes for you and pick out the Best Moments! Hope You Guys Like This Moments & watch Your Anime Moments in HD 1080p ...
625,2018-02-22T23:39:30.000Z,Scv3qWqntsw,Keijo - Kyoko Shirayuki - The Missile Lady of Kyouko,What I do is watch the Animes for you and pick out the Best Moments! Hope You Guys Like This Moments & watch Your Anime Moments in HD 1080p ...
626,2018-02-19T22:48:21.000Z,32yvMNHuAqY,Keijo - Kotone Fujisaki - Vibe - Ring Hip - The SCARY Ass !,What I do is watch the Animes for you and pick out the Best Moments! Hope You Guys Like This Moments & watch Your Anime Moments in HD 1080p ...
627,2018-02-20T08:18:34.000Z,cV7PGjlGclg,Tangents are drawn from any point on the hyperbola `(x^2)/9-(y^2)/4=1` to the circle `x^2+y^2=9`...,Doubtnut डाउनलोड करें - https://doubtnut.app.link/nuexktj3WN - Doubtnut ऍप पर आप कक्षा ६ से १२ के NCERT के मैथ/गणित...
628,2018-02-20T08:10:58.000Z,cZUUlDCMebA,Find the product of the length of perpendiculars drawn from any point    on the hyperbola `x^2-2...,Doubtnut डाउनलोड करें - https://doubtnut.app.link/Jq16Sus2WN - Doubtnut ऍप पर आप कक्षा ६ से १२ के NCERT के मैथ/गणित...
629,2018-02-20T08:17:28.000Z,EB5TEjdfOmo,Statement 1 : If from any point  ltmath gt  ltmrow gt  ltmi gtP lt/mi gt ltmrow gt ltmo gt( lt,Doubtnut डाउनलोड करें - https://doubtnut.app.link/FMiB0NM2WN - Doubtnut ऍप पर आप कक्षा ६ से १२ के NCERT के मैथ/गणित...
630,2018-02-20T08:12:27.000Z,jFdYT-ms7LA,"From any point on the line `y=x+4,` tangents are drawn to the auxiliary circle of the ellipse `x...",Doubtnut डाउनलोड करें - https://doubtnut.app.link/vqIKfir2WN - Doubtnut ऍप पर आप कक्षा ६ से १२ के NCERT के मैथ/गणित...
631,2018-02-12T02:17:13.000Z,74SuF3IM-Uc,ALISSA VIOLET ASS LEAKED!!,SHE ACCIDENTALLY SHOWS HER ASS. BUT DONT GET CK FUSED SHES WEARING A BIKING UNDERNEATH SO SHES NOT NUDE.
632,2018-01-29T19:11:46.000Z,BSqRUfMH_Xk,Betts Grab N' Grip Promo,The Billy Bay Grab N' Grip by Betts. For more information visit our website www.bettstackle.net.
633,2018-02-03T23:17:55.000Z,vfbrusUTrR0,Grab & Go Diaper Changing Clutch Station - Removable Pad & Pillow,"https://www.sewingtink.com/product/grab-go-diaper-clutch-changing-pad-pillow/ This portable diaper changing clutch is convenient, light weight, durable, ..."
634,2018-02-03T23:17:55.000Z,vfbrusUTrR0,Grab & Go Diaper Changing Clutch Station - Removable Pad & Pillow,"https://www.sewingtink.com/product/grab-go-diaper-clutch-changing-pad-pillow/ This portable diaper changing clutch is convenient, light weight, durable, ..."
635,2018-02-01T15:37:18.000Z,gxC5bwETKjY,BELL GRAB LIFE_PROMO,PRODUCTION : RAWLENSE FILMS AGENCY : METROPOLITAN CLIENT : UBL BRAND: BELL LARGER CAMPAIGN : GRAB LIFE.
636,2018-02-03T06:58:04.000Z,Dz6cGDAmgCU,"Jonathan Raduns - Selling to Hotels, Grab & Go and Food Markets",Learn more: http://retailsummit.live/portfolio-item/jonathan-raduns/
637,2018-02-02T13:27:20.000Z,mQe5zSN4uXw,Women’s March: “How To Grab Women By The Pussy”-Manual By Salvadoran Discussed With Ex-USSR Citizen,"How to Grab Women by the Pussy: ""The Art of the Feel"" Paperback – September 14, 2017 by Ronald J Crump (Author),   Dan Curtin (Editor),   Frank Morroco ..."
638,2018-01-30T10:33:53.000Z,FdYeYAxErpI,I can grab rim with two hands but can't dunk,http://www.slamdunkcrazy.today/vertical-jump/ I can grab rim with two hands but can't dunk We've all been there. You're the shortest guy on the court -- or at ...
639,2018-02-08T12:59:35.000Z,RJtM-MYcMsw,"Rockstar's  ""Money Grab""  with GTA Online is clearly working",Link to article: https://www.gamespot.com/articles/gta-5-players-are-spending-lots-on-microtransactio/1100-6456644/
640,2018-01-28T10:30:00.000Z,R6VBZ1Immy8,BREAKING - Hands off our taxes! Irish MEP slates Brussels ‘POWER GRAB’ and vows ‘we will RESIST’,THE EU is launching a “veiled power grab” on Irish corporate tax revenue - with Brussels warned by one Dublin politician to expect a “strong front” and ...
641,2018-02-03T18:10:56.000Z,rt8Mi2njee0,How to grab HTTP Server Banners with CURL,"Twitter: @webpwnized Thank you for watching. Please help! Up vote, subscribe or even support this channel at https://www.youtube.com/user/webpwnized ..."
642,2018-01-25T19:04:17.000Z,jo1H_Zce2wg,[ENDED]Amnesia Collection is Free right now! - Grab it quickly!,https://www.humblebundle.com/store/amnesia-collection?partner=SantiagoSantiago (Affiliate Link) If you want to support me: Civilization VI for $12 on Humble ...
643,2018-01-31T12:22:41.000Z,H0KYV64T6DU,TWO 30$ GRAB BAGS FROM DELITEFUL BOUTIQUE!!,go and grab you one today! Great deal! Though I likee my 50$ one a lil more!!!
644,2018-02-05T07:58:53.000Z,y5N8boZ_M9g,Battlefront 2: Campaign PART 10: Cache Grab (PC),Battlefront 2 campaign game play part 10. Mission 9: Cache Grab I don't know about you but nothing that Lando Calrissian can do will make up for what he did to ...
645,2018-02-03T21:52:10.000Z,5pIetkm-I1I,$378 Clothing Haul for $20! : Plato’s Closet Grab Bag Sale,"Plato's Closet Grab Bag Haul Feb 2018 *all proceeds went to Gabriel's house foundation! If you would like to donate, the link is below: DONATE HERE: ..."
