,published_at,video_id,title,description
1601,2017-04-25T20:41:03.000Z,zoLksPXzwgw,Writing Stories: From Idea to the End - More Plotting #4,"Subscribe! http://www.youtube.com/channel/UCH-R5gJp7k3EODBrlZ14CEg?sub_confirmation=1 Drae Box is an writing tutor, book marketing consultant and ..."
1602,2017-04-27T21:41:58.000Z,RK9K7EhozLw,From Idea to the End: Writing Stories #6 - Act 2 Plotting,We continue plotting today - filling in the nitty-gritty of what happens in each chapter now we know the purpose of each chapter :) Subscribe!
1603,2017-04-18T22:24:20.000Z,Qm73dBFKkGU,I Got a FREAKIN' LIGHTSABER!!! And Other Assorted Birthday Goodies Haul,"I got a FREAKIN' LIGHTSABER, you guys! My 33rd birthday was recently, so today I thought I'd share the lovely presents that Jason and Adrianna picked up for ..."
1604,2017-04-27T18:30:00.000Z,CakMT3W67oY,Roblox Swordburst 2 (Early Access) | Kid Gaming Channel,Trying out Roblox Swordburst 2 (Early Access) I have no clue what I am doing but it looks like a fun game :D ☆ Roblox Swordburst 2 Early Access by Swordburst ...
1605,2017-04-24T17:52:12.000Z,_THRkwt1Kag,Hitler gets disconnected from the Rainbow Six Siege-Servers - Fab5,"So, we tried something different this time. Don't know if it will work out xD If it does and you want a second part, you will get one, but that's what you'll get for now."
1606,2017-04-19T23:30:13.000Z,9aw2inoYQio,Black Desert Warrior LvL 60 vs Wizard LvL 60.97 EU 2K,"Black Desert Online - Warrior Open World PvP ......................................................................................................... Warrior, attack enemies with your sword,..."
1607,2017-04-03T07:51:17.000Z,h4xIGn7hIUo,Malaysia- Inside Grab (Car) Playing Bangladeshi Song,With jaan er dostora.
1608,2017-04-01T04:41:23.000Z,FoTrdzj2RvE,Tangled: The Series - Rapunzel's Enemy - Good Will Gopher Grab - Clip,suscribe for receive more videos of your favorite Disney Channel Series.
1609,2017-04-03T15:46:42.000Z,7eVYwcuq8i4,Grab It By The Tail,4.2.17 ::: The Power Of Habit: Grab It By The Tail We all exercise faith on some level in our lives. We can reach greater heights in our faith when we make God's ...
1610,2017-04-01T07:12:17.000Z,IgFb2-K045Q,Hot teletubby Dipsy appears to grab Lorraine Kelly's breast,The Teletubby Dipsy appeared to accidentally grab Lorraine Kelly's breast while appearing on her TV show on Friday morning. During a segment celebrating 20 ...
1611,2017-04-03T00:21:53.000Z,PqTI1zIbLTA,SF@ARI: Pollock lays out to make the grab in center,A.J. Pollock lays out to make the catch on a sinking line drive off the bat of Conor Gillaspie in the 9th and limit the Giants' scoring Check out http://MLB.com/video ...
1612,2017-04-13T19:03:51.000Z,bMDQrR2tukI,JOWST - Grab The Moment (Norway) - in RCT3,There is my light design for JOWST - Grab The Moment.
1613,2017-04-04T13:33:53.000Z,FmBVAnLjQcs,Weird grab,"I don't even know. It looked like I dash danced, and then did a Pivot grab."
1614,2017-04-14T12:07:50.000Z,VgzWi14CHM0,Land Grab #1: Episode - 25,Land And Grab.
1615,2017-03-31T19:00:03.000Z,rH9nk4f7YMw,GRAB YOUR SCUBA GEAR! - Opening a Pokemon Kingdra EX Box! - Pokemon Opening!,We gotta DIVE to FIND and OPEN a NEW Pokemon Kingdra EX Box! Grab your snorkel gear and join me in this Pokemon Opening of a Kingdra Pokemon TCG ...
1616,2017-04-03T15:41:32.000Z,fFrUYBLYqhM,Cassadee Pope Instagram Story Grab 4/2/2017,Cassadee Pope Instagram Story Grab 4/2/2017.
1617,2017-04-06T02:38:08.000Z,eyzYYVxYZPE,LEGO City Undercover Remastered Part 17 Smash 'n' Grab Blackwell's Mansion Robbery (Xbox One),LEGO City Undercover Remastered Part 17 Smash 'n' Grab Blackwell's Mansion Robbery (Xbox One). A little breaking and entering never hurt nobody ...
1618,2017-04-11T18:01:56.000Z,Lj-tt7bXFXE,[GTA News Flash] Land Grab Adversary Mode Released!,Twitch: http://www.twitch.tv/Gtamen Channel art stolen from: https://twitter.com/Sistoska Thumbnail stolen from: Twitter: http://www.twitter.com/Gtamen Music: ...
1619,2017-04-11T10:28:01.000Z,cIpS_SazSnI,"NEW ""LAND GRAB"" MODE GAMEPLAY! (GTA 5 Online DLC)","NEW ""LAND GRAB"" ADVERSARY MODE EVENT GAMEPLAY! - Deadline styled TDM Gamemode! Enjoy the video! ▻Subscribe ! : http://goo.gl/7ltfE6 ▻SHARK ..."
1620,2017-04-04T23:03:17.000Z,m5BIEU1Sbd4,Laura Marano Instagram Story Grab 4/4/2017,Laura Marano Instagram Story Grab 4/4/2017.
1621,2017-04-07T22:19:39.000Z,oLduA9OcNrg,Julianne Hough Instagram Story Grab 4/6/2017,Julianne Hough Instagram Story Grab 4/6/2017.
1622,2017-04-04T17:00:01.000Z,MJIb0AsVJrA,The Ultimate Lakka Raspberry Pi 3 Retro Gaming Console Setup Tutorial Guide,"In this video, I'll show you the complete setup guide for the retro gaming system Lakka on the Raspberry Pi 3. Grab your own Raspberry Pi 3 Kit here: ..."
1623,2017-04-11T17:00:05.000Z,mj37cZqQ1YQ,"Complete Recalbox Raspberry Pi 3 Setup Tutorial - ROMS, SSH, UPDATES and KODI",In this video I'll show you how to install and completely setup RecalBox on the Raspberry Pi. Grab your own Raspberry Pi 3 Kit here: http://amzn.to/2m0SW8r So ...
1624,2017-04-02T18:37:53.000Z,LhCmOYAm7mc,Rayman - Space Mama's Play [Sax Cover] | subversiveasset ft. Danilo Ciaffi,"This is Space Mama's Play, the debut Rayman piece for saxophone & orchestra arranged by Danilo Ciaffi and featuring subversiveasset. This piece is available ..."
1625,2017-04-09T00:19:09.000Z,J_I9v_afsiU,The BAM! Box INDESTRUCTIBLE Unboxing (March 2017),"The ""Indestructible"" BAM! Box was definitely a step up from the previous box, featuring such franchises as Marvel superheroes, Vampirella, Logan, and an ..."
1626,2017-04-14T17:10:02.000Z,kTYyrM5wrbc,15 Minute HIIT Workout At Home,Complete this 15 Minute High Intensity Workout early in the day to give yourself a big boost of energy for the rest of the day! Keep moving and take short water ...
1627,2017-04-06T11:07:55.000Z,E7Gd_Mn0EJQ,"S1.EP7- ""Let's talk about sex"" featuring Cynthia Garrett","Episode 7 of Candid Conversations is finally here! In this episode, Cynthia Garrett (author, actor, motivational speaker, and host of the #1 Christian women's talk ..."
1628,2017-04-07T13:06:44.000Z,9lvlKBJ1Tss,Harley Davidson Case Study - How A Cult Brand Was Made - A Case Study for Entrepreneurs,"In Case Study #21 Tom Ellsworth, aka: The Biz Doc, shares the story of Harley Davidson and how they don't just sell motorcycles, they sell admission to the ..."
1629,2017-04-11T16:33:11.000Z,TBGwdJNILQM,GTA 5  LAND GRAB adversary mode  OUTFIT FREE 1.39 2017,"GTA 5 NEW LAND GRAB GLOW OUTFIT FREE 1.39 2017 -~-~~-~~~-~~-~- Please watch: ""GTA5 DUPS FOR 18K EACH ( DUPLICATION GLITCH ) THE END"" ..."
1630,2017-04-13T16:56:01.000Z,qcdgfSwh81s,Hilarious Examples of brutal Honesty,Hilarious Examples of Honesty That Will Make You Laugh.Most people try not to be insulting and rather not be really honest just to not hurt anybodies feelings.
1631,2017-04-12T17:39:58.000Z,Hlz-sQjmdQI,How To Build A Garden Shed.  Or Is It A Tiny House? Complete Step By Step Guide. (Part 1),"The long awaited How To Build A Garden Shed. Or Is It A Tiny House? Complete Step By Step Guide is finally here. In this episode of UK Here We Grow, Tony ..."
1632,2017-04-13T17:40:33.000Z,FQddmGbFSeU,How To Build A Garden Shed.  Or Is It A Tiny House? Complete Step By Step Guide.  (Part 2),"The long awaited How To Build A Garden Shed. Or Is It A Tiny House? Complete Step By Step Guide is finally here. In this episode of UK Here We Grow, Tony ..."
1633,2017-04-14T12:42:59.000Z,tK8_DmoCAnQ,Land Grab #2: Episode - 26,Upload# PS4 Land Grab 2.
1634,2017-04-14T18:01:07.000Z,_M1OZbMaPTM,How To Build A Garden Shed.  Or Is It A Tiny House? Complete Step By Step Guide.  (Part 3),"The long awaited How To Build A Garden Shed. Or Is It A Tiny House? Complete Step By Step Guide is finally here. In this episode of UK Here We Grow, Tony ..."
1635,2017-04-12T22:29:47.000Z,ZEPBHNl0wx4,Toca Life: Hospital (By Toca Boca AB) - New Best App for Kids,Subscribe for more video https://bit.ly/2IMX4Fr Experience the excitement of a busy medical center with Toca Life: Hospital! Welcome newborn babies into the ...
1636,2017-04-14T23:11:27.000Z,bTOEVV7NoaE,How to watch TV in bed like a Pro! The Purple Powerbase,Get a glimpse of what its like to watch TV from Purple's Adjustable Powerbase. Just follow these steps to become an in bed TV watching pro. 1)Find the perfect ...
1637,2017-04-12T18:30:00.000Z,8dfqaNmS5uk,Roblox Escape the Subway Obby by FatPaps (Oh no! More Zombies!!!),"On no, more Zombies, what is it with this world, you escape the Zombies in the shopping mall, only to find your stuck in a subway with more in #Roblox Escape ..."
1638,2017-04-07T17:00:04.000Z,xiQX0YXYuqU,Raspberry Pi Emulator for Windows 10   Full Setup Tutorial and Speed Optimization,In this video I'm going to teach you how to setup a Raspberry Pi Emulator for Windows 10 using the latest Raspbian Pixel and some speed optimization tricks.
1639,2017-04-12T15:47:56.000Z,XYeykQsqfKY,The Night Game - The Outfield,"""The Outfield"" by The Night Game is available to buy and stream now on Real Johnson Records here: https://fanlink.to/jZx Follow The Night Game here: ..."
1640,2017-04-02T18:30:00.000Z,RNLojvd_uAg,Kid Gaming Vlog #9 / Q&A / Meet One of My Cats / Competition Winner / Fan Shout Out / F2TM,"Welcome to the latest Kid Gaming Vlog from F2TM. In this one I answer more questions, you get to meet the 1st of my two cats, I talk about my collab vid with ..."
1641,2017-04-04T18:30:00.000Z,jktyupondec,Roblox Survive The Disasters 3 oh I mean 2,"When I recorded this was pranked bro, no really I totally 100% believe it was Roblox Survive The Disasters 3 and not Roblox Survive The Disasters 2, honest :D ..."
1642,2017-04-03T18:30:00.000Z,-EM0gOwJZiM,Roblox Duck Duck's Eggcellent Adventure - Easter Egg Hunt 2017,"Looking for a fun egg hunt before the official Roblox Easter Event starts, then check out Roblox Duck Duck's Eggcellent Adventure. ☆ Roblox Duck Duck's ..."
1643,2017-04-04T23:00:01.000Z,BPJVQQIWRz4,Roblox Egg Hunt 2017: The Lost Eggs - My First Egg the Sand Shark Egg w/ Nathorix & MadaVoid,"Part of a series of videos on the Roblox Egg Hunt 2017: The Lost Eggs, in this one I get the Sand Shark Egg. Hey welcome to my first video in my Roblox Egg ..."
1644,2017-04-05T11:03:11.000Z,10gXFqtHrYs,Roblox Egg Hunt 2017: The Lost Eggs #2 | Martian Egghunter / Eggverse / Peep-a-boo Found + 2 More,"Part of a series of videos on the Roblox Egg Hunt 2017: The Lost Eggs, in this one I get the Martian Egghunter egg, The Eggverse egg, Top of the World Egg, ..."
1645,2017-04-05T18:30:00.000Z,VYzB3J4DrA0,Roblox Egg Hunt 2017: The Lost Eggs #3 | Frostbitten Egg / Seal Egg Found w/ MadaVoid,"Part of a series of videos on the Roblox Egg Hunt 2017: The Lost Eggs, in this one I get the Frostbitten Egg and the Seal Egg. Hey welcome to the third video in ..."
1646,2017-04-01T21:15:13.000Z,1qZw6muOX0E,Playing Roblox Games / Roblox Live Stream Now / F2TM Live Stream #9,"Welcome to my Roblox Live Stream, I am back after MadaVoid being in the hot seat last week. Read the rules, don't ask for Mod, no need for super chats, just ..."
1647,2017-04-14T18:30:00.000Z,CnPha37lDCQ,Nerf Gun Battles on a Whole New Level in Roblox Nerf FPS 2017,"If having a Nerf gun and being good at using it in real life qualified you for the army, then we are all in the army, right! LOL ok this is more like a paintball fight but ..."
1648,2017-04-13T18:23:44.000Z,nZ-viWDR0Hc,Random Roblox Games in this Roblox Live Stream / F2TM Live Stream #11 /w MadaVoid,"Welcome to my Roblox Live Stream. Read the rules, don't ask for Mod, no need for super chats, just subscribe and like is all the ""payment"" I want xD, thanks."
1649,2017-04-06T18:30:01.000Z,qR_v-sTQMoQ,Close Eggcounters / EGG9000 Found | Roblox Egg Hunt 2017: The Lost Eggs #5,"Part of a series of videos on the Roblox Egg Hunt 2017: The Lost Eggs, in this one I get the Close Eggcounters and EGG9000. Hey welcome to the fourth video ..."
1650,2017-04-07T11:00:01.000Z,FBg4VPIxIpg,Pompeiian Egg / The Obsidian Egg Found | Roblox Egg Hunt 2017: The Lost Eggs #6,"Part of a series of videos on the Roblox Egg Hunt 2017: The Lost Eggs, in this one I get the Pompeiian Egg and The Obsidian Egg. Hey welcome to the 6th video ..."
1651,2017-04-06T05:32:35.000Z,lEgs-Z4wTI0,Grinding out Largemouth at the USA Parkway Ponds,"As the title implies, it was a grind it out kind of day. Was able to have some fun for sure but needless to say there was some heartbreak involved. Enjoy the video ..."
1652,2017-04-08T22:59:42.000Z,J9k1C7JDDwk,Playing Roblox Murder Mystery 2 (MM2) / Roblox Live Stream / F2TM Live Stream #10,"Welcome to my Roblox Live Stream. Read the rules, don't ask for Mod, no need for super chats, just subscribe and like is all the ""payment"" I want xD, thanks."
1653,2017-04-08T07:26:23.000Z,oxnNCgAUnsQ,NEW Michael's Haul - Lots of Treasures,"Thank you for Watching & Subscribing! Please Like,Share & Comment Check Out My Most Popular Video: https://goo.gl/M7iJmx Learn Tips and Techniques, ..."
1654,2017-04-10T19:30:00.000Z,SoJdr5t2FVY,Eggcano / Lost in Transit Egg + 2 More Found | Roblox Egg Hunt 2017: The Lost Eggs #13,"Part of a series of videos on the Roblox Egg Hunt 2017: The Lost Eggs, in this one I get the Eggcano, Lost in Transit Egg, Ruby Egg and S.S. Egg - The Mighty ..."
1655,2017-04-09T13:10:49.000Z,Pb0zaeMiNqw,The Pirate Egg / Unstable Egg + 2 More Found | Roblox Egg Hunt 2017: The Lost Eggs #10,"Part of a series of videos on the Roblox Egg Hunt 2017: The Lost Eggs, in this one I get the Unstable Egg, Aqua Pal of Egglantis, The Eggtopus and The Pirate ..."
1656,2017-04-10T14:00:09.000Z,w3KoOVf3FjE,EBR Egg / The Amber Egg Found | Roblox Egg Hunt 2017: The Lost Eggs #12,"Part of a series of videos on the Roblox Egg Hunt 2017: The Lost Eggs, in this one I get the EBR Egg and The Amber Egg. Hey welcome to the 11th video in my ..."
1657,2017-04-09T18:30:00.000Z,EpizEbvHOTk,SnowSpheroid / The Abyssal Egg Found | Roblox Egg Hunt 2017: The Lost Eggs #11,"Part of a series of videos on the Roblox Egg Hunt 2017: The Lost Eggs, in this one I get the SnowSpheroid and The Abyssal Egg. Hey welcome to the 11th video ..."
1658,2017-04-06T15:59:59.000Z,2eLaa98V4oI,My first truly CUSTOM keyboard - WASD Custom V2 Mechanical Keyboard Review,"I got the people at WASD Keyboards to let me customize a fully decked-out WASD Custom V2 keyboard and use it as my daily driver. It's pretty awesome, though ..."
1659,2017-04-02T18:00:00.000Z,5RmzRsbfFnw,WIN! 2 X $3 Word Games Texas Lottery Scratch Off Tickets,Scratching 2 X $3 Word Games Texas Lottery Scratch Off Tickets. Will I find a big win? Stay tuned. Join me on Facebook: ...
1660,2017-04-08T11:00:01.000Z,AgbegXJYp0Q,Humpty Dumpty / Faster Than Light Egg + 3 More Found | Roblox Egg Hunt 2017: The Lost Eggs #8,"Part of a series of videos on the Roblox Egg Hunt 2017: The Lost Eggs, in this one I get The Eggteen-Twelve Overture, Humpty Dumpty, Dust Deviled Egg, ..."
1661,2017-04-06T03:56:34.000Z,RerSFxFQifM,Buy Redmi Note 4 for Rs. 1 via Mi Fan Festival 2017 (Hindi),"You can now buy Redmi Note 4 for just Rs. 1, however this is a flash sale and only few limited units will be made available. Check this video to know more."
1662,2017-04-08T18:00:06.000Z,nyl9LzfImkY,Roblox Egg or Roblox Admin Egg from Inception Time :D | Roblox Egg Hunt 2017: The Lost Eggs #9,"Part of a series of videos on the Roblox Egg Hunt 2017: The Lost Eggs, in this one I get The Roblox Egg from Inception Time while he was in a Roblox Live ..."
1663,2017-04-11T13:00:03.000Z,Qm23KX_CWxE,The Answer Egg / Pegguin / Mummy Egg +2 More Found | Roblox Egg Hunt 2017: The Lost Eggs #14,"Part of a series of videos on the Roblox Egg Hunt 2017: The Lost Eggs, in this one I get The Answer Egg, Eggvalanche!, Pegguin, Mummy Egg and ..."
1664,2017-04-07T18:30:00.000Z,8cF2Bqh5mS0,Egg of Ra / The Sands of Time Found | Roblox Egg Hunt 2017: The Lost Eggs #7,"Part of a series of videos on the Roblox Egg Hunt 2017: The Lost Eggs, in this one I get the Egg of Ra and The Sands of Time. Hey welcome to the 7th video in ..."
1665,2017-04-15T03:27:11.000Z,JxEF3_AZbQw,Beautiful beaches in Trat - Hitchhiking around Thailand  Part 12,"TimezoneJunkies #Hitchhiking #Thailand #Hitchhike . Before heading to the little island Koh Mak, we stayed two nights in Trat were we rented a motorbike and ..."
1666,2017-04-07T04:49:06.000Z,uCevofJHi4M,[RLS] BTHC: Borderlands 2 - Part 31 (Lost and Found Kind of..),"So today i am playing Borderlands the handsome collection: Borderlands 2 hope you all enjoy. Borderlands the handsome collection is out now on PS4, Xbox ..."
1667,2017-04-10T11:35:15.000Z,N7icBExPFLQ,CWA RagePro- Season 3- Episode 9- CWA European Invasion Tour- ALL STAR WEEKEND!!!,Ladies and Gentlemen I present to you CWA RagePro ============================================== Follow Me on Social Media Kik: ...
1668,2017-04-06T04:29:48.000Z,t8sopgaW7p0,Grab it here where buy oculus rift,Virtual reality or where buy oculus rift.
1669,2017-04-01T06:51:19.000Z,tdAG08sRdOg,Its a miracle woman falls off 10 stories.. building and survives,Its a miracle she shouldn't be alive.
1670,2017-04-04T00:00:01.000Z,HS_G5w4QGw8,Fight In England With Bites And Eye Pokes,"This is a fight from England. Lots of great lessons from this 1 v 1. Like always, it's not a good idea to ever get in a fight, but let's learn from other people's mistakes ..."
1671,2017-03-27T02:14:35.000Z,I4TbjQyi_Yo,How to pronounce grab? Pronunciation of grab,Pronunciation of grab in american accent Pronunciation of grab in british accent Pronunciation of grab in irish accent Pronunciation of grab in scottish accent ...
1672,2017-03-30T21:26:23.000Z,JX6uzzwo4ew,"A heartwarming story, grab the tissues - Stray Rescue of St.Louis","We couldn't do what we do, at this capacity, without our tremendous foster families. They are the strongest, most loving people. Thank you to all who foster."
1673,2017-03-29T20:27:47.000Z,x2tqhR0im6c,Norway Eurovision Song Contest ESC 2017 Review Reaction JOWST Grab the Moment,Norway Eurovision Song Contest ESC 2017 Review Reaction JOWST Grab the Moment Will Norway grab the moment in 2017? Watch and find out!
1674,2017-03-30T19:47:03.000Z,5gQlJ9IFvqI,Flashback: Big Meech: I Could Grab $1 Million and Throw it Out No Problem,"In 2011, Demetrius ""Big Meech"" Flenory interviewed from behind bars with author Cavario H. Here, the former drug kingpin talks about becoming extremely ..."
1675,2017-03-26T11:24:41.000Z,DkzkO3ic79A,Hammer Grab HG 900,"Hammer Grab HG 900 by ""PTC ""ERDE TOOLS"" LLC at our workshop and on testing before shipment to the Customer."
1676,2017-03-30T11:42:57.000Z,LijiE2kRqVs,Smash 'n grab suspects arrested in Pinellas,NewsChannel 8 Today.
1677,2017-03-23T17:11:29.000Z,EBhX5Mgh8pY,GRAB YOUR PARTNERS,Song for English Primary teaching.
1678,2017-03-23T09:42:12.000Z,zWFFnTqtdR0,Walking Dead: Road To Survival - Guaranteed Old Comic Cash Grab Rant!!,Live streaming enabled at 1000 Subscribers!! Get social! Facebook: http://www.facebook.com/thesincitysteve Twitter: http://www.twitter.com/thesincitysteve ...
1679,2017-03-23T15:58:54.000Z,vWaljXUiCaE,Run The Jewels - Legend Has It (Official Music Video From RTJ3 & Black Panther),"""Legend Has It"" As featured in the trailer for Marvel's Black Panther movie. Is the first video from RTJ's hit album, RTJ3, which debuted at #1 on Billboard's Rap, ..."
1680,2017-03-17T16:39:17.000Z,sSkG1nw4IIA,BLACK GUY PENIS SIZE SOCIAL EXPERIMENT | HOLLYWOOD,︎Follow on IG: https://www.instagram.com/imalansinclair ➤ Watch THIS next https://youtu.be/Q8A1QQQ3yuU 17)Term papers writing services and “hot to use it” ...
1681,2017-03-24T18:41:12.000Z,d-rsneCEePI,WOULD YOU SMASH THIS BLACK GUY? | SOCIAL EXPERIMENT,︎SUBSCRIBE: http://bit.ly/1Fx8zZr [Click Show More] ➤ Watch THIS after! https://youtu.be/g7CrBWL2xYI 16)If you have used term papers writing services many ...
1682,2017-03-28T19:00:00.000Z,1gGGWeO0aWU,Simple Script for Raspberry Pi Steam Streaming Installer and Setup In RetroPie 4.2,"In this video, I'll show you the Simple Script for setting up and installing Raspberry Pi Steam Streaming In RetroPie 4.2 and above. Grab your own Raspberry Pi 3 ..."
1683,2017-03-24T19:00:01.000Z,C0S_ITQ8tN8,Kodi Remote Control Raspberry Pi 3 Setup using FLIRC USB IR Recevier,Kodi Remote Control Raspberry Pi 3 Setup using FLIRC USB IR Recevier In this video I'm going to show you how you can use any remote to control your Kodi ...
1684,2017-03-19T21:08:12.000Z,HUbwy9eoJWI,How to Increase the Flame on Disposable Lighters [HACK] | Make Flame Bigger on Disposable Lighter,Claim Your FREE Tactical Flashlight** ($25 Value) - LIMITED SUPPLY! - Grab Yours Here: http://bit.ly/freeflashlight1 ----- Discover how to increase the flame on ...
1685,2017-03-31T13:02:23.000Z,s6YEriXxL60,Nintendo- The History of a Legendary Video Game Company - A Case Study for Entrepreneurs,"In Case Study #20 Tom Ellsworth, The Biz Doc dives into Nintendo and takes you back to the beginning of what became a legendary company in video games."
1686,2017-03-29T17:30:00.000Z,35G7AW78kxo,HOME WORKOUT - 15 MINUTE WALKING WORKOUT FOR WEIGHT LOSS  -  burn calories at home  START NOW,WALKING WEIGHT LOSS AUDIO http://bit.ly/2fPRyPM HEALTHY EATING BOOK http://bit.ly/2wRq1G7 2018 HEALTHY HABIT CALENDAR ...
1687,2017-03-26T13:29:16.000Z,hpWbKnlrRvs,Dr. No Effects Turd Fuzz Pedal | CME Gear Demo,"Everyone has that s!@#y pedal on their pedal board somewhere, but Dr. No Effects has taken that idea one step further with its latest pile of crap—the Turd ..."
1688,2017-03-26T22:35:48.000Z,PCMQzVmnaJk,Yarr we be playing Roblox Galleons ya scallywag's,"I be wearing an eye patch because my eye is sore, but I get to upload an video ya scallywag's on Roblox Galleons :D ☆ Roblox Galleons ..."
1689,2017-03-21T19:30:00.000Z,W5EiLl_xjDI,Roblox Broken Bones 3 #2,"Ever wanted to jump out a plane and see how many bones you can break? If you answered yes, then you are crazy!!!! Instead why not use Roblox Broken Bones ..."
1690,2017-03-17T16:00:02.000Z,DG-O8wM1BtY,Wendy's Premium North Pacific Cod Sandwich REVIEW ,Check out my Amazon store! https://www.amazon.com/shop/oldnerdreviews Trying the Wendy's Premium North Pacific Cod Fillet Sandwich for ya'll.
1691,2017-03-23T11:00:01.000Z,ajL2l7i5KcY,Boom Beach Reviewing Fan Base Designs! Base Layout Tips!,"Fan base reviewing ep1! Boom Beach base layout tips and tricks! Base building tutorial and review! Best Boom Beach gameplay, attack strategies and amazing ..."
1692,2017-03-18T05:00:05.000Z,z2XD4olXkTg,New Boom Beach Heroes in Battle! (Sneak Peek Gameplay),"Heroes are here!! Well...on my Dev Build. Just messing around with heroes vs Imitation Game. Best Boom Beach gameplay, attack strategies and amazing base ..."
1693,2017-03-19T21:30:00.000Z,ByCynWmEyTo,Kid Gaming Vlog #8 / Q&A / John Doe Collab / Roblox Competition / MrBrownFox Shout Out / F2TM,"Welcome to the latest Kid Gaming Vlog from F2TM. In this one I answer more questions, talk about my funny collab video with Laugh It Up Gaming, G-rated ..."
1694,2017-03-30T18:30:00.000Z,87L3KD0T7sw,Roblox Skydiving Simulator,"Learn to fall from a very high height and die, opps I mean Skydive in Roblox Skydiving Simulator :D ☆ Roblox Skydiving Simulator ..."
1695,2017-03-29T18:30:00.000Z,Uju0dXgnEnk,Roblox Wipe Out Obby,Will I wipe out on Roblox Wipe Out Obby? ☆ My last video was Scribblenauts Unlimited - My Adventure Begins!
1696,2017-03-18T22:09:18.000Z,iyV3RlH4k60,Roblox Live Stream / Epic Minigames / Zombie Rush / Flood Escape and more / F2TM Live Stream #7,"Welcome to my Roblox live stream. Read the rules, don't ask for Mod, no need for super chats, just subscribe and like is all the ""payment"" I want xD, thanks."
1697,2017-03-18T11:30:00.000Z,An1tjXE4OJU,MORE FUN ON ROBLOX HACKER DAY LOL - Roblox Escape The John Doe Obby,"So, by now everyone should know that John Doe is not real and no one is getting hacked today unless of course you click on them “free Robux scam links”, don't ..."
1698,2017-03-16T20:30:00.000Z,YXXMNKWLtIQ,Roblox Events - How To Get Mask of the Lost Village from Roblox Epic Minigames - Smurfs Event,"How To Get Mask of the Lost Village from Roblox Epic Minigames in the Roblox Event, Smurfs The Lost Village. ☆ Roblox Epic Minigames ..."
1699,2017-03-17T20:00:00.000Z,AGSMfZ2XRDs,EATEN BY A GIANT!!! - Roblox Escape The Living Room Obby,"I totally no word of a lie get eaten by a giant, because this really happened someone else has to upload the video for me!!! LOL xD I am playing Roblox Escape ..."
1700,2017-03-22T19:30:01.000Z,Pf5sNo_3aGk,Roblox Escape The Launderette Obby by FatPaps,Help I am stuck in a washing machine! In this crazy Roblox Escape The Launderette Obby by FatPaps. ☆ Roblox Escape The Launderette Obby ...
1701,2017-03-25T21:55:36.000Z,jhWVM-kWIGA,MadaVoid is Standing in for Fraser2TheMax / Roblox Live Stream / F2TM Live Stream #8,"Hey guys, I am ill and can't do the live stream, however my brother MadaVoid is standing in for me, so be ready for the MadaVoid Take Over Stream, hope you ..."
1702,2017-03-20T19:30:02.000Z,SFLvpc9kYp0,Roblox ArrowZ #2 - Having some fun with glitches before they are removed!,"I am really enjoying Roblox ArrowZ and it's shaping up to a really cool game, today I am trying out some of the glitches you can do on the map before they get ..."
1703,2017-03-23T19:30:01.000Z,LUpBmvXFPGY,An eVentful Murder!!! - Roblox Murder Mystery 2 #3,An eVentful Murder!!! In Roblox Murder Mystery 2 ☆ Roblox Murder Mystery 2 ☆ https://www.roblox.com/games/142823291/Murder-Mystery-2?rbxp=97681946 ...
1704,2017-03-27T18:30:00.000Z,1fefxBVrJzk,Roblox Pixel Art Creator,It's art time on Roblox with Fraser in Roblox Pixel Art Creator draw your imagination in this cool game. ☆ Roblox Pixel Art Creator ...
