,published_at,video_id,title,description
0,2018-07-24T14:00:04.000Z,rzm7MDx0LIs,WÄHLE NICHT DAS FALSCHE KILLER GRAB IN MINECRAFT!,Wähle nicht das falsche Killer Grab in Minecraft! Kostenlos abonnieren » http://bit.ly/CentexMinecraft Folgt mir auf: Instagram ...
1,2018-07-20T00:45:25.000Z,KHOgbnnZS4E,"Grab Wants to Be Southeast Asia's SuperApp, Co-Founder Says","Jul.19 -- Hooi Ling Tan, Grab co-founder, discusses the company's expansion plans and competing with Uber. She speaks with Bloomberg's Emily Chang on ..."
2,2018-07-24T03:16:57.000Z,WMJEQwSod6A,Dad makes unreal grab on Franco's HR while holding a baby,"Maikel Franco launches his second home run of the game, and a fan makes a tremendous catch while holding a baby in his other arm About Major League ..."
3,2018-07-20T06:00:00.000Z,41A9BB_1mLY,(Malaysia) Female taxi driver not happy young Grab driver touting passengers,"Please share, comment and like our videos. Visit our Facebook at: https://www.facebook.com/singaporeincidents/"
4,2018-07-23T19:56:35.000Z,tblx6cE-bkE,How to do a Crossrocket Grab with Austin Smith | TransWorld SNOWboarding Grab Directory,"The Grab: Both hands grab the nose of the board with arms crisscrossed. The Tweak: On a skateboard, both feet are moved to the tail of the board."
5,2018-07-24T15:40:51.000Z,lsLRPtchACs,Grab That - Drumless Backing Track,Generator Web: http://www.generatortube.com/ Generator PayPal: https://www.paypal.me/GeneratorVideos Kalergi Plan: ...
6,2018-07-24T15:31:41.000Z,Ns05i9MB800,Poor Rose try run fast cus Princess&Solo grab her food.why April angry Brianna try fighting,"After she could enter the group,everyone start to welcome her and play with her as well. Rose is happy get more friends. However, at the same time she also ..."
7,2018-07-24T09:00:04.000Z,yB1G4z3Oa0o,Grab The Pebble From My Hand—Unrealsitc Martial Arts—Core JKD Breakdown,Ming gives a clear example of how people think they are training realistically and how realistic training actually is using the grab the pebble from my hand ...
8,2018-07-23T12:29:46.000Z,MzTvFo0BA6Q,How lovely Polly grab mom like this!,How lovely Polly grab mom like this!
9,2018-07-23T23:45:00.000Z,EColsIQ9sx8,Oh god! Why old monkey Merry grab baby Brutus jr?,"Please Subscribe Channel Here : https://goo.gl/8gdXzH Monkeys have always been regarded as fun, adorable and entertainingly witty creatures. If you spend ..."
10,2018-07-23T17:21:12.000Z,ctr9jJkudGY,UFOs Aliens Ets Grab and Tag,Brought to you by: http://www.richwest.net.
11,2018-07-22T18:33:36.000Z,mm1mIzJNUSM,Real Steel Survival Kit   The Grab-N-Go bag for the Outdoors Adventurer !,Real Steel Survival Kit Link to this Survival Kit on the Real Steel website: ...
12,2018-07-19T21:06:00.000Z,CXBZfUQJ638,HATI HATI GRAB MENGAMBIL UANG DAN MENSUSPEN DRIVERNYA SENDIRI,Vidoc by. A&N Studio.
13,2018-07-22T09:12:06.000Z,rLplrhO6wMA,CASH GRAB - XS POWER SHOW - $$$$$,"At the 2nd Annual XS POWER Show in Knoxville, TN. Drew Jones wins the cash grab, how much do you think he was able to grab? Comment below what you ..."
14,2018-07-22T20:16:11.000Z,Nmuww5gAihA,Smash and Grab Moped Thieves drive by Shepards Bush,SUPPORT HUNT A MOPED THIEF DAY I need to raise £100 to take a day off work to be fully armored and do patrols in some of the worst areas in the uk for ...
15,2018-07-24T12:46:26.000Z,ZBHOhDVuLBM,Amazon Gift Card Generator 2018 ( Grab Free Amazon Codes now!),LINK: http://amazoncodestool.supercheats.org/
16,2018-07-23T14:00:10.000Z,xn7XzsqlUfw,"Maria Not Good She Usually Grab Brutus JR From Jill,B.J Screams Too Loudly Scare Maria,SOK ST1883","Hello ladies and gentlemen! Maria Not Good She Usually Grab Brutus JR From Jill,B.J Screams Too Loudly Scare Maria,SOK ST1883 Thank you so much for ..."
17,2018-07-21T13:38:15.000Z,GnAtEDm8fU0,TMC has pledged to grab 42 seats in Lok sabha@ Mamata Banerjee,"To satisfy the demands of high-rise favourites of Bengali audiences, Zee 24 Ghanta brings all the latest headlines and news stories. Connect with us at our ..."
18,2018-07-20T17:31:26.000Z,sGMK_lZXzrw,Warlords Awakening Is A Disgusting Rebranded Cash-Grab Of An MMORPG.,"Warlords Awakening is not a new upcoming MMORPG. What a lot of players don't immediately realize is that in actuality, the game is a mere rebranding and ..."
19,2018-07-21T16:03:32.000Z,Wl1vKSevXWs,Mom Brinn screaming much cos old female grab Baby Bree | Brinn angry not stay with her |,Mom Brinn screaming much cos old female grab Baby Bree | Brinn angry not stay with her |
20,2018-07-21T14:53:19.000Z,O3IrtjuYeMI,$7000 iMac Pro EDITING BEAST | Filmmakers Dream?,I got myself the new Apple iMac Pro for video editing and today we're going to test how fast this monster really is. Especially for filmmakers that's a beast of a ...
21,2018-07-24T14:43:37.000Z,BPXR96VYXSk,GTA San Andreas Grab Enemy's Weapon CLEO Mod 2018,GTA San Andreas Grab Enemy's Weapon (PC) Author : HybridTheory Download link : https://www.mixmods.com.br/2018/06/pegar-arma-do-inimigo.html Hi guys ...
22,2018-07-12T02:58:51.000Z,FpfmlMkQxFM,In conversation with Grab,Tan Hooi Ling of Grab and Kara Swisher of Recode at RISE 2018. Grab made headlines in March of this year when they acquired Uber's operations in ...
23,2018-07-21T03:29:49.000Z,MRpds7zrGBM,8Ball Pool Latest 500M Coins Trick 2018 || How To Grab It Free 500M  99.9% Working Guranted 8bp,Player Of 8Ball Pool Grab It 500M Game Coins For Free 2018 Latest 8 Ball Pool Fresh Trick . Where You Goto Grab & Use 8 Ball Pool 500M Plying Coins First ...
24,2018-07-22T04:37:38.000Z,b4cGHrDWQSk,Try This Impossible Snowboard Grab,My Snowboard Gear CAPITA HORRORSCOPE: http://bit.ly/2LIgc5d THIRTYTWO LASHED BOOTS: http://bit.ly/2qP2SEd UNION CONTACT BINDINGS: ...
25,2018-07-19T15:52:44.000Z,uVDjK_bW_fM,RATUSAN ORANG DEMO DI DEPAN KANTOR DPRD UNTUK TOLAK GRAB TARAKAN 19 JULI 2018,1 hari angkot kota tarakan tidak berokprasi.dan semua angkot yg ada di tarakan parkir di depan kantor DPRD kota tarakan. Untuk penolakan keberadaan ...
26,2018-07-22T03:41:58.000Z,5c1GURpA1LI,Highlights R18: Eddie's grab and goal,Eddie Betts takes a big grab and kicks the goal. Subscribe NOW to AFC Media: http://bit.ly/1zUR9Bm Watch the latest episodes of The Crows Show: ...
27,2018-07-12T16:52:57.000Z,5DwtxmaHJow,Grab the Attention with these Modern Opt-in Forms,Get Thrive Leads: https://thrivethemes.com/leads Read the full post: https://thrivethemes.com/eccentric-optins-template-set/ A new set of opt-in form templates ...
28,2018-07-18T18:21:47.000Z,IkWhkkpG6-k,Gemini July 15-August 15 Money Grab: Move outside of the plan/Trust them,IG:@tarot_by_kelis FB:Tatianna Kelis Taro www.TarotbyKelis.com http://paypal.me/TarotbyKelis.
29,2018-07-16T19:28:49.000Z,rFupbKlvYoU,GRAB APK MOD 2018,Syarat ketentuan ada di video Thx to your driver +DOWNLOAD HERE+ http://zipansion.com/2MgOR http://zipansion.com/2MgLs http://zipansion.com/2MgGK ...
30,2018-07-20T16:56:35.000Z,cVr7dPr7m2I,‘Why hurry to grab power’: PM Modi counters Rahul Gandhi’s hug with a jibe,"'Why hurry to grab power', Prime Minister Narendra Modi retorted hours after Congress President Rahul Gandhi hugged him while wrapping up his speech on ..."
31,2018-07-14T14:19:55.000Z,Q0qg6_d1ZMk,Grab a Plate and Get Moving and Playing with Tatis Cervantes Aiken,"A paper plate might not be the typical Yoga prop, but just wait until you see the creative movements you can do. Tatis leads you through a sequence that gets ..."
32,2018-07-20T11:00:04.000Z,Y4V6_V52oBI,Why grab when you can down tilt cross up,"Why grab when you can down tilt cross up When the opponent starts to get too happy and approaches with shield, down tilt cross up works on some characters ..."
33,2018-07-21T23:15:56.000Z,D8Dho9B45-U,Hair Grab Defenses with Ando Mierzwa and Stephan Kesting,Hair grabs are a very common attack in the street so if you have hair then you need to know how to defend against someone grabbing it! in this video Ando ...
34,2018-07-20T09:44:34.000Z,DcCXBWxq9pQ,Grab Lab Hack and Cheats (Android/iOS) - How to get Unlimited Vials?,Hello lovers of Grab Lab! You are probably wondering how to get free vials? I found a way!! Today I want to share with you the only legit Grab Lab Hack. URL for ...
35,2018-07-22T09:21:42.000Z,OLY7yEx_www,Harvard's robot arm can grab squishy sea animals without hurting them,Harvard's robot arm can grab squishy sea animals without hurting them Sponsored by: Paid Social Media Jobs - http://bit.ly/2Gnl8v7 Subscribe for more: ...
36,2018-07-22T12:51:55.000Z,GPzB6RVOQFM,TOP GEM GRAB TIPS AND TRICKS! | HOW TO PLAY GEM GRAB GUIDE! | Brawl Stars Gameplay,"Hey guys and welcome back to another stream and today I will be talking about the best gem grab tips in brawl stars to help you win more! Like, comment and ..."
37,2018-07-24T11:00:15.000Z,fOl6WhHtXJ8,How many seats PTI will grab from Lahore? Know from analyst Sarmad Salik and Javed Iqbal,How many seats PTI will grab from Lahore? Know from analyst Sarmad Salik and Javed Iqbal #PublicNews dutifully brings you news about the Public of ...
38,2018-07-14T18:18:31.000Z,rJdKb1wiTFo,Dog Wants To Grab Stick For Owner But Too Scared Of Water,Dog Wants To Grab Stick For Owner But Too Scared Of Water Dog Wants To Grab Stick For Owner But Too Scared Of Water ...
39,2018-07-18T16:25:38.000Z,QeSrG_REco8,"Doing so bad Sweepea bite & grab Poor baby Lori , Poor Sp do like funny in front  Sasha","Doing so bad Sweepea bite & grab Poor baby Lori , Poor Sp do like funny in front Sasha 14: 58 Poor baby Lori get bite Sweetpea &grab baby away when mom ..."
40,2018-07-20T15:53:54.000Z,Y41XdIp6nxU,THE ULTIMATE CUTTING BREAKFAST | Grab & Go Stuffed Bell Peppers,Obtain Strength: https://obtainstrength.com/collections/all ▻ Fitness Cookbook: http://bit.ly/completecookbook ▻ Instagram: http://instagram.com/michaelkory ...
41,2018-07-23T02:21:39.000Z,Da8MWcs5cfc,2018 Temecula Cash Grab Invitational Consolation Round 3,"Temecula, CA 2018 Doug Ellin/Riley Newman vs. NoÈ Sariban/ Scott Burr."
42,2018-07-20T08:28:34.000Z,_VpPMDQgUoo,1Rs sale Paytm *OFFER* | Flash sale | Deal | How to grab fast | kapchalife,1Rs sale Paytm *OFFER* | Flash sale | Deal | How to grab fast | kapchalife ...
43,2018-07-19T04:21:30.000Z,7Ri3mo7kB78,Grab-NUS  AI Lab: The Power of Data,"Combining Grab's vast troves of data and National University of Singapore's expertise in AI research, Grab and NUS are partnering up to launch the Grab-NUS ..."
44,2018-07-19T01:39:04.000Z,trVylo7BSiA,Michael's Clearance $4 Grab Bag,Hello! Its been a long time since I bought a Grab Bag Box! Sorry about he noise and enjoy!
45,2018-07-18T03:49:21.000Z,u4BTdo6ELv0,Michaels 4$ Grab bags,We paid $20.00 for 5 bags( Grand total from the stuff in the bag is $462.54) I think it was though it.
46,2018-07-18T03:33:25.000Z,HI87XkhhfUM,CHA Seniors File Lawsuit Over Lack Of Bathroom Grab Bars,A group of senior citizens say they are done waiting for the Chicago Housing Authority to install grab bars in their bathrooms.
47,2018-07-19T21:00:02.000Z,cv5etx7onc0,EVE Online: Exploration Alpha #3 - Lowsec Smash and Grab!,"A new EVE Series! Rather than continue to explore in Highsec, I decide to try my luck in a small Lowsec pocket."
48,2018-07-24T07:30:00.000Z,PSmRld5LOsA,"The Neverending Pit: Grab them quickly! (Daily Challenge, 23/7/2018, PC) in 0'15""98 (150 Lums)","Rayman Legends, Daily Challenge from July 23rd 2018 (PC/Sony Playstation 3/Microsoft Xbox360/Nintendo WiiU). Finally got under 16 seconds! This beats my ..."
49,2018-07-12T13:56:09.000Z,uEaVj9Uroac," LOADSTRINGS AND GETOBJECTS!  SKISPLOITOP FULL LUA : GRAB KNIFE V4, TOPKEK, INFINITE YIELD! ","X Hey and welcome to the description! Click ""Show More"" for more information and for the download link! ----------------------------- X  LOADSTRINGS AND ..."
50,2018-07-11T22:00:00.000Z,Pd9Cu8XO2vU,Trump Quietly Signs Massive Judicial Power Grab,Help us cover the political revolution: http://www.patreon.com/TYTNation While we were talking about Brett Kavanaugh...
51,2018-07-13T18:01:59.000Z,0f0TIusW56g," EXECUTE EVERY SCRIPT!  SLX OP FULL LUA : GRAB KNIFE V4, TOPKEK, BOOGA BOOGA GOD BAGS AND MORE! ","X Hey and welcome to the description! Click ""Show More"" for more information and for the download link! ----------------------------- X  EXECUTE EVERY SCRIPT!"
52,2018-07-20T12:00:03.000Z,QOGKUz-dhYU,THE BEST THOMAS GRAB BAG IN HISTORY! ,Hi guys! Today on Izzy's Toy Time we're opening up the BEST THOMAS AND FRIENDS BAG EVER! Our family had so much fun playing with these toy trains for ...
53,2018-07-17T16:43:42.000Z,1OdK91BtsDY,My god! Why Brinn mom grab & drag her Bree like this?,"Please Subscribe Channel Here : https://goo.gl/8gdXzH Monkeys have always been regarded as fun, adorable and entertainingly witty creatures. If you spend ..."
54,2018-07-10T17:50:15.000Z,ipqX7s8xBMc,Woman assaulted by land-mafia to grab her land,Woman assaulted by land-mafia to grab her land.
55,2018-07-13T16:00:52.000Z,6Eb-i_7mB94,Grab Lab - World 7 Level 102 Walkthrough,Grab Lab - World 7 Level 102 Walkthrough.
56,2018-07-17T16:03:18.000Z,uA3sI4dnADU,Omg! Penelop Mum Angry Little Monkey Because Small Monkey Tries To Grab Peter Baby,"Penelop Mom Angry Little Monkey Because Small Monkey Tries To Grab Peter Baby, Daily Post Thank so much for watching if you like the video, please make ..."
57,2018-07-17T12:47:21.000Z,-bVPBBgfjig,Echo of Soul 3.0  Aesir  76er Dungeons  Verborgenes Grab HC  2️⃣ DD`s  Tank,Danke fürs Anschauen◢◤ ▽Klick 'Mehr Anzeigen'' für Links und Infos ▽ ▭▭▭▭▭▭▭▭▭▭▭▭▭▭▭▭▭▭▭▭▭▭▭▭▭▭▭▭▭ Musik aus...
58,2018-07-23T13:56:52.000Z,MT9jMMLiNfg,Grab That Dong | MOUNT YOUR FRIENDS 3D,You will never look at Mount your Friends the same way again. watch as we struggle to understand how to play and then fight to the death.
59,2018-07-21T09:37:58.000Z,fZs3e8yMkZw,How to Grab Tunnel Floor Rock I Floor Rock Tutorial,Floor Rock Tutorial: https://youtu.be/ceUdL3c0T9k Next Level Gear (Wardrobe) Instagram: nextlevelgear Youtube: ...
60,2018-06-28T13:54:40.000Z,b0bq-YHeo3Q,BUS SUMBER ALAM TABRAK MOTOR GRAB DI BOGOR rabu 27 juni,BUS SUMBER ALAM TABRAK MOTOR GRAB DI BOGOR kejadian rabu 27 juni di bogor keluar tol arah ciawi deket lampu merah.
61,2018-07-01T07:36:35.000Z,IXBb_OtGccE,Roblox Grab the Child. Secret Child (READ DESC),5:35 is when i actually break through the wall.
62,2018-06-26T17:13:21.000Z,WyUNy9fuHvE,"Babyface Ray Type Beat 2018 - ""Grab Woods"" | 2018 @ThisBeatBangs","Beat Store!(INSTANT DOWNLOAD): https://www.myflashstore.net/widgets/html5/?uid=45495&config=81436 ""What's The Ticket 'Klack?"" » Lease - $35 ..."
63,2018-06-25T14:17:58.000Z,NDT0Nj1GDcA,GRAB MURNI GACOR,Tutor Akun Grab murni tetep gacor.
64,2018-06-25T18:24:20.000Z,COmwfi7lLbc,27-year-old Grab driver found dead in vehicle in bizarre upside down position,27-year-old Grab driver found dead in vehicle in bizarre upside down position ------------------------- GOMBAK: A Grab driver was found dead in his vehicle at a ...
65,2018-06-25T21:20:49.000Z,qGjnKLa3DdY,DI MINTAIN TOLONG BAWAIN TAS MASUK APARTEMEN DRIVER GRAB ONLIN GOJEK ONLINE,"DI MINTAIN TOLONG BAWAIN TAS MASUK APARTEMEN DRIVER GRAB ONLIN GOJEK ONLINE,taxi online,taxol,grab,gojek,"
66,2018-07-06T15:27:16.000Z,k3z33bVJ0Jg,Mortis in Gem Grab :: Brawl Stars,"Mortis Gem Grab Bone Box The grind to 16 continues... Before the introduction of Pam, Mortis was the go to for gem grab (smash & grab for all you OG's out ..."
67,2018-07-08T17:00:05.000Z,mTK1eU-8RB4,Jameis Winston Uber Driver - Grab Her By the P**y,Tampa Bay Bucs quarterback Jameis Winston figured that he'd give it a shot. How many times do you get an Uber driver that's a woman? And we're guessing ...
68,2018-06-25T16:00:01.000Z,7VejPeqNuv0,"Oh My God!My Idol Coming Brutus JR,Jill Grab Lotus From BrutusJR,How Cute he Is Brutus JR,SOK ST1612","Hello ladies and gentlemen! Oh My God!My Idol Coming Brutus JR,Jill Grab Lotus From BrutusJR,How Cute he Is Brutus JR,SOK ST1612 Thank you so much for ..."
69,2018-06-25T12:42:56.000Z,yF2Uai5xM2I,Enrique Iglesias - Somebody's Me Choreography - Grab All Beatz,"Hey Guys, I couldn't shoot a video this week ... So thought of uploading this video shot in 2015 ... Hope you'll enjoy it ... Like the Video, if you feel its good, Share, ..."
70,2018-06-26T05:00:00.000Z,J39XUYZRQhk,"Flit Adorable Baby Grab Food Bella Mouth,Bella And Flit Look The Same Size,So Cute All,SOK ST1618","Hello ladies and gentlemen! Flit Adorable Baby Grab Food Bella Mouth,Bella And Flit Look The Same Size,So Cute All,SOK ST1618 Thank you so much for ..."
71,2018-06-26T05:58:18.000Z,69GSuSeZZCs,[Yogyakarta] Anniversary Grab Yogyakarta,Grab Yogyakarta merayakan anniversary! Mau tahu seperti apa? Simak keseruannya di video ini!
72,2018-06-25T23:18:09.000Z,cHHQKO8QQmY,DITOLONGIN DRIVER GRAB,"Kejadian yang gak terduga ane alamin pas tempo hari mau berangkat kerja, seudahnya persiapan ane starter motor... lah tapi kagak nyala... coba lagi kagak ..."
73,2018-06-25T20:23:35.000Z,m4WjHTqo4f8,"Grab driver in Malaysia killed, found upside down in car","Grab driver in Malaysia killed, found upside down in car. KUALA LUMPUR: A Grab driver believed to have been murdered was found upside down in his car on ..."
74,2018-06-25T00:34:46.000Z,rWOF5wk3ofM,Corner cmd grab rc from 0 to 10 (otg ender),Guilty Gear Xrd REV 2 https://store.playstation.com/#!/en-us/tid=CUSA07594_00.
75,2018-06-24T21:54:32.000Z,FKdiAdEl4dE,Corner cmd grab rc from 0 to 9,Guilty Gear Xrd REV 2 https://store.playstation.com/#!/en-us/tid=CUSA07594_00.
76,2018-06-25T13:21:27.000Z,ArhPBT4-pz0,[BBTAG] Yang Command Grab shenanigans?,"Since Twitter is rip You can tag cancel (or active switch for you MvCi heads) her command grab and, well..."
77,2018-06-25T11:51:46.000Z,xdqWygoA6_k,Rahtawu with saudara alias (Pak Grab Pribadi),Temen masa kecil.
78,2018-06-26T11:23:48.000Z,sbgi2vx9bPU,Grab the bag,Grab the bag - View all greyhater's Rockstar Editor videos at http://socialclub.rockstargames.com/member/greyhater.
79,2018-06-25T13:00:02.000Z,Hy6tPRi2UyE,Bubble Puppy racing down a road to grab bubbles - Bubble Puppy - Tuto Toons - Fun Games,"""Bubble Puppy racing down a road to grab bubbles - Bubble Puppy - Tuto Toons - Fun Games Join the classroom to dress up as Bubble Puppy happily dressed ..."
80,2018-06-24T19:45:29.000Z,xucweyE38b0,"In the grab of naxal, goverment is exploiting tribals/ Suraj Kumar Bauddh",नक्सल के नाम पर आदिवासी उत्पीड़नपूर्णतः सरकार पोषित है। खूंटी गैंग रेप.../...
81,2018-07-02T13:03:47.000Z,muj5FC4Xoj4,Grab Lab Level 78 All Potions Walkthrough,Thank you for watching my video and please don't forget to subscribe to get latest walkthrough guides update for ios and android game. SUBSCRIBE ...
82,2018-06-30T09:04:39.000Z,C69LlQyPujg,Trump Leaves Door Open to U.S. Recognizing Russia's Crimea Grab,Trump Leaves Door Open to U.S. Recognizing Russia's Crimea Grab politics Margaret Talev and Toluse Olorunnipa President Donald Trump speaks to the ...
83,2018-07-08T02:02:10.000Z,zeCroWnqlzw,Grab Lab | GameMod.Top Free Download Mobile (Android & iOS),Grab Lab | GameMod.Top Free Download Mobile (Android & iOS) Download (Android / iOS): http://bit.ly/2KU5H1O Just play. Have fun. Enjoy the game !
84,2018-07-03T13:01:27.000Z,6wycrF_-pQQ,roblox grab the child...,heres the game https://web.roblox.com/games/1796205852/Grab-The-Child-Many-Child-To-Collect-Grab i liked the game... (DONT PLAY THIS)
85,2018-06-28T20:55:55.000Z,1YqOxhllVps,GRAB THE BOTTLE PART 2! IT'S GETTING MORE DIFFICULT! (PS4),HOPE YOU GUYS ENJOY THIS AND MY STUGGLES! THANKS FOR WATCHING AND FOR ALL THE SUPPORT! MEANS A LOT! IF YOU ENJOYED PLEASE ...
86,2018-07-08T18:39:31.000Z,QfdIVeqi00w,Michael’s $4 Clearance Box - $300 value?!,Oh my gosh!! Check out all the items I got in this $4 clearance box at Michael's! The items I unbox are worth $300!! I love crafts and being crafty so Michael's is ...
87,2018-07-06T02:00:02.000Z,N3YhQRKjw0Q,WE MADE ANOTHER SONG TOGETHER!!!,We made another song together... JOIN THE ACE FAMILY & SUBSCRIBE: http://bit.ly/ THEACEFAMILY DOWNLOAD THE ACE FAMILY APP HERE: ...
88,2018-07-08T15:00:00.000Z,ArK45WdTfX8,20 CLOTHES DECOR IDEAS THAT ARE SO EASY TO DIY,BEST CLOTHES DECOR IDEAS It's high time to upgrade your wardrobe for summer season! And I've got plenty of super stylish and unique handmade clothes ...
89,2018-07-03T19:37:02.000Z,LZlvXk2SyDc,Khai Dreams – Find My Way (ft. Atwood) (Lyrics) [CC],"Aviencloud – Taking you to a better place • Khai Dreams - Find My Way (ft. Atwood) [Hip Hop] • Open me senpai and support the music artist, artwork artist and ..."
90,2018-07-07T13:00:01.000Z,1Kfd3VHiVhY,Robot restaurants won’t take your job and food will be better,"Robot restaurants are popping up all over downtown San Francisco, as a futuristic option for people to grab fast food for cheap. The latest example is Creator, ..."
91,2018-07-08T16:45:00.000Z,ioGJ3CCmeDg,"I Spent 24 Hours in 10,000 Bath Bombs Challenge!",I spent 24 hours in 10000 Bath Bombs! It was a challenge I was willing to take considering it might be a mistake. Enjoy! Make sure to grab Guava Toys at your ...
92,2018-06-25T18:29:55.000Z,CT6tsq6cj7w,Friction Catch of the Month: Slow White's Todd Herman,"In a showcase game against Wild Card, Slow White's Todd Herman ate a Super Mario Mushroom to make this insane grab. It's the Friction Gloves Catch of the ..."
93,2018-07-01T07:01:29.000Z,ptUhC58WFNI, Top 18 Best Girls In One Piece,Check Out My Main Channel! https://www.youtube.com/KingOfLightning Check Out My Twitch!
94,2018-07-07T04:31:49.000Z,WsYxXOBeRSk,How to ANIMATE a 360 photo in 2 Minutes!,Wanna take your 360 & reframing game to the next level?! Grab my best-selling eBook and BRAND NEW video course while they're on sale! ▻ A Beginner's ...
95,2018-07-04T18:15:08.000Z,7-p2nurpz3s,"Here's Why My BMW E39 M5 Was Worth $74,395",️Help us reach 50k subscribers! http://youtube.com/c/beemerfam ️Grab YOUR BF Merch http://shopbeemerfam.com ️Follow us on Instagram ...
96,2018-07-07T13:45:36.000Z,DuhkrF7F0Mk,7 Psychological TRICKS To Get A Girl To Like YOU!,Go check out my personal picks and grab them at a discount! http://www.mvmt.com/alpham Man I love the new Revolver collection... they are SICK! Special ...
97,2018-07-02T14:16:30.000Z,U8_O2nKx5-c,"Grabbike speaks : English, Spanish,German,Frecnch",Dành cho các bạn có cùng đam mê ngoại ngữ Facebook: https://www.facebook.com/haimypolyglot Thanks for watching !!!
98,2018-07-02T21:00:34.000Z,iws0eXtDWhM,The Best of The Good Advice Cupcake Part 2,"She's highly motivational, aggressively optimistic, and loves to grab life by the balls! Here are some of the best moments from The Good Advice Cupcake! Follow ..."
99,2018-07-02T21:59:19.000Z,vMuQ32ozd-4,Luke C goes to TRUCKFEST Malvern!,Scott's channel! go subscribe to him too https://www.youtube.com/user/Nylontrain Grab your merchandise now over at https://lukecinahgv.com/ #LukeCinaHGV ...
100,2018-07-05T06:12:22.000Z,pbRauc8gpQM,How to Overclock an 8700K & 8086K - ASUS Maximus X and Others,"If you're wanting a quick guide to overclocking an 8700k or 8086k processor on an ASUS Maximus X Motherboard, this is the video for you. In this video I go ..."
101,2018-07-09T12:00:07.000Z,nGSO56nPl1I,PIRL CHARGER QUICK OVERVIEW,Here's a really quick overview of the Pirl USB Charger. A 4 port charger which can deliver 2.7a each port without any power interruptions. How awesome is that!
102,2018-06-25T13:10:41.000Z,8QRXe0gVfGU,MKSAP 18 Preview,"Grab some popcorn -- it's time to watch the premiere of the MKSAP 18 trailer. Pre-order http://bit.ly/2FHQgYd before July 31, 2018, to save up to 15% on your ..."
103,2018-07-08T11:00:08.000Z,ofZOo4IISiQ,Travel Around the World Without Leaving Home | 360 VR,Enjoy our selection of the most beautiful places around the world in 360 VR and 4K quality. Use the mouse cursor to grab the screen and move it around! Travel ...
104,2018-07-08T02:15:11.000Z,ZFUu0CopNnA,"COFFEE, CHAT & WRECKFEST! | Playing Wreckfest | 7.7.2018  [REPLAY]",Grab a copy of WRECKFEST    http://bit.ly/nerdwreckfest Support the channel with a SUPERCHAT donation and you'll be the coolest kid in school! THANKS!
105,2018-07-08T01:59:07.000Z,EQ4NilphImM,9 yr old sings EMOTIONAL TRIBUTE at Great Grandmother’s graveside,"GRAB TISSUES, this will make you cry. 9 yr old singer Gracyn Sofia sings a final tribute to her Great Grandmother alongside her grave at the cemetery. Voice of ..."
106,2018-06-27T21:56:28.000Z,X-yS6NVI8pY,NOEL’S HOUSE PARTY (BBC ONE - Season 4: Episode 12 / 21.01.95),"This video features an episode from Season 4 of Noel's House Party from 21st January 1995. Shane Richie receives a ""Gotcha"", NTV invades another front room ..."
107,2018-07-07T07:21:59.000Z,CYgYSILEvlY,Port of Los Angeles Live Stream,"Grab a front-row seat on the Los Angeles Main Channel, complete with panoramic views of the Vincent Thomas Bridge, container cranes, cargo and cruise ships ..."
108,2018-06-25T02:26:04.000Z,vcW9-iiZPXw,What to Do When Someone Does You Wrong - Kris Reece- Relationship Coach,"Relationships are messy. And when you combine our sinful nature with our selfish desires, you often have a recipe for hurt. So what do you do when someone ..."
109,2018-07-01T06:20:04.000Z,FZAe4wS3QGY,Chit Chat Get Ready With Me | Trying New Products,It's a little long so grab a snack & enjoy! lashes: etsy.com/divalashesbyalfred.
110,2018-07-04T20:00:03.000Z,zlAhzFffrIU,10 Dark Secrets Hidden In Hotel Transylvania 3: Summer Vacation,Hotel Transylvania 3 Has Some DARK SECRETS Hidden In Plain Sight. Did you notice these surprising bombshells? Subscribe to our channel: ...
